id	text_a	text_b	label
ae7d1377-aa1b-4074-a2fd-6977a0213b6c	New Jersey Plan -- So check it, the New Jersey Plan, sometimes folks call it the Small State Plan or the Paterson Plan, was this idea William Paterson dropped at the Constitutional Convention on June 15, 1787. This whole thing popped off 'cause of the Virginia Plan, which was all about having two houses in Congress where seats would be given out based on how many people each state had. But the states with fewer folks weren't feeling that since it meant the big states would have most of the power. So, they came through with their own plan to keep things even with each state getting one vote in a single legislative group, just like it was under the Articles of Confederation. But yo, James Madison and Edmund Randolph, who were all in on that Virginia Plan, they weren't having any of that New Jersey Plan.	Did da New Jersey Plan suggest it be jus' one house in Congress?	1
6cf09138-f84c-44d5-a691-147aac35d968	Souls series -- The Souls series is a bunch of action role-playing video games made by FromSoftware. It started off with Demon's Souls droppin' for the PlayStation 3 back in 2009. Then came Dark Souls in 2011, followed by its sequels, Dark Souls II and Dark Souls III, in 2014 and 2016. Hidetaka Miyazaki, the brain behind it all, directed all these games except for Dark Souls II.	Is Demon's Souls related to Dark Souls?	1
28907af9-199f-4c3c-b91f-b82b322e9121	Cricket World Cup -- Twenty teams done made it to the Cricket World Cup at least once. Seven squads been up in every tournament, and five of 'em done snagged the title. The West Indies took home the first two championships, Australia got five, India copped two, and Pakistan and Sri Lanka each got one. The West Indies (1975 and 1979) and Australia (1999, 2003, and 2007) the only ones to win back-to-back. Australia been in seven outta the eleven finals (1975, 1987, 1996, 1999, 2003, 2007, 2015). England still ain't clinched the World Cup, but they been the second-best three times (1979, 1987, 1992). The top showing by a team that ain't play Test cricket before was Kenya hitting the semi-finals in 2003; and the best first-time showing was Ireland reaching the Super 8 in 2007.	England done won any World Cups in cricket yet?	0
7245f443-59ba-4b7b-bf95-a939c7ad95e5	The Hundred-Foot Journey -- The Hundred-Foot Journey, that's a book by Richard C. Morais, came out back in July 2010. They turned it into a movie too, same name and all, in 2014.	"Is ""The Hundred-Foot Journey"" based on a book?"	1
7988029c-6fbe-49b8-9f47-388a2af10cd5	Mr. Monk and the End -- Mr. Monk and the End be the two-part finale of that TV show Monk on USA Network, where they solve crimes and stuff. It’s the last two episodes, number 15 and 16, of season eight and overall it's episode 124 and 125. Adrian Monk, played by Tony Shalhoub, finally figures out who killed his wife Trudy (played by Melora Hardin) after looking for like twelve years, wrapping up a storyline that lasted seven years across eight seasons. When they showed Part 2, it broke records, y'all, pulling in 9.4 million people watching—that’s the highest ever for a regular drama on basic cable. Both parts were put together by the dude who made the series, Andy Breckman, and directed by Randall Zisk.	Monk ever find out who killed his wife?	1
aeb51738-7eff-4924-aea7-18354a69264b	Geography of Egypt -- Egypt got beaches on the Mediterranean Sea and the Red Sea. Egypt next to Libya on the west, the Gaza Strip and Israel on the northeast, and Sudan on the south. Egypt covers 1,001,449 km² (386,662 mi²).	Egypt be bordered by the Red Sea an' the Mediterranean Sea.	1
009717cb-c11b-4b81-89a8-179f92c1bdd2	Carling Black Label -- Black Label a Canadian brand of lager that Carling distribute, and it's big all over the old British Empire. In plenty places, folks call it Carling Black Label, but over in Sweden, they say Carling Premier. In the UK, though, it's just called Carling.	Carling Black Label, it from South Africa or nah?	0
a0bcf7a2-153c-4b33-a99a-4aeeaa1648e7	Lebanon national football team -- Back in 2000, they had the AFC Asian Cup at their crib but ended up last in they group. They only hit up the Asian Games once in 1998, and got bounced in the second round. They steady showing up at the WAFF Championship, which mostly got teams from West Asia. Lebanon be in the UAFA Arab Nations Cup too, and even hosted it in 1963, snagging third place. They took fourth in the 1964 and 1966 games. As hosts, they grabbed third at the UAFA Pan Arab Games in both 1957 and 1997, and landed fourth in 1961. They ain't never made it to the FIFA World Cup though. Lebanon hit they highest FIFA ranking at 79th back in June 2018.	Lebanon ever made it to the World Cup?	0
51ad3663-31f4-4f9c-98a8-4b9f9b54dbf7	Pound sign -- Since 2007, folks been usin' this symbol a lot to add them tags on social media, which folks started callin' hashtags. Cause of that, now some people even call the symbol a hashtag.	Is hashtag the same thing as the number sign?	1
a0da472c-3f9e-453f-8efe-a59a5fccf939	Kick-off (soccer) -- You can score a goal straight from the kick-off against the other team.	can you score from a kickoff in soccer?	1
79071d5a-7220-434c-95a6-f63cad1002e7	Challenger Deep -- On 23 January 1960, the Swiss-designed Trieste, built in Italy and copped by the U.S. Navy, dipped down to the ocean floor in the trench with Jacques Piccard (who helped design the sub with his pops, Auguste Piccard) and USN Lieutenant Don Walsh riding. They was in a spherical pressure vessel, a solid upgrade from the Italian original, made by Krupp Steel Works outta Essen, Germany. Took 'em nearly five hours to go down, and them dudes spent just about twenty minutes at the bottom 'fore they started the three-hour-and-fifteen-minute climb back up. They cut their time short on the ocean floor 'cause they was worried about a crack in the outer window from the temp changes while going down. The depth they hit at the bottom was checked with a manometer at 10,916 m (35,814 ft) ±5 m (16 ft).	nan	1
c184acb2-9848-4cb4-a0d8-aa46792b0893	Marvel's The Avengers (also known as Marvel Avengers Assemble in the UK and Ireland), or just The Avengers, is a 2012 American superhero movie based on the Marvel Comics superhero team of the same name, produced by Marvel Studios and distributed by Walt Disney Studios Motion Pictures. It's the sixth movie in the Marvel Cinematic Universe (MCU). The movie was written and directed by Joss Whedon and stars Robert Downey Jr., Chris Evans, Mark Ruffalo, Chris Hemsworth, Scarlett Johansson, and Jeremy Renner as the main Avengers team, along with Tom Hiddleston, Clark Gregg, Cobie Smulders, Stellan Skarsgård, and Samuel L. Jackson. In the movie, Nick Fury, the director of the spy agency S.H.I.E.L.D., brings together Tony Stark, Captain America, the Hulk, and Thor to form a team to stop Thor's brother Loki from taking over Earth.	nan	1
93c4fc88-0155-424d-9698-ab4022416517	Third Amendment to the U.S. Constitution -- So check it, the Third Amendment (Amendment III) to the U.S. Constitution makes sure soldiers can't just be staying in folks' houses without the homeowner saying it's cool, and this ain't allowed in peacetime. This whole rule came about 'cause of them Quartering Acts that the British parliament had going on before the American Revolutionary War started, letting the British Army crash at private spots.	the third amendment keep folks from havin' to house soldiers without they okay	1
3fb2a180-ff99-42bd-bd11-b0baae6c42a9	Football at the Summer Olympics -- Check it, the way the game set up at the Olympics, a bunch of the top men's national teams ain't really got the best records. Uruguay snapped up the gold the first two times they stepped in, back in 1924 and 1928, and that was it till they got back on the field in 2012 after missing out for 84 years. Argentina grabbed silver in 1928 and 1996, but they ain't hit gold till 2004 in Athens, then again in Beijing in 2008, and that was only their seventh time showing up (they made it eight in 2016). Brazil was holding down silver in the 1984, 1988, and 2012 games, but they didn't score gold till 2016. They even missed the cut in 1992 and 2004 when the pros could play. Italy only won the Olympic title once, way back in 1936, but they did scoop up two bronzes and been in the mix 15 times, last showing up in 2008. France got their one gold in 1984 but ain’t been back since 1996. Germany, before the 2016 games, only	Do pro soccer players ball out at the Olympics?	1
adbbd11f-b745-423e-b431-71c3226d153f	In the years after, Grace and Jack get hitched and take Pete in as they own kid. Not only does Elliot kinda fade from the town's memory, but Gavin gets his act together and moves past all that drama. Later on, Pete and his fam take a trip and peep that Elliot finally got back with his dragon crew.	Do Pete's dragon end on a good note?	1
9956002b-6632-4104-90d3-65660f4cfdc8	List of The Magic School Bus characters -- Liz don't talk, but she be doing stuff you wouldn't expect from no chameleon, like driving the bus. When she head to Herp Haven for a lil' bit, her packing list got things like claw polish, scale moisturizer, and fang-paste. If Ms. Frizzle gotta dip out from the kids for a minute, or if the class gotta split up, she put Liz in charge, kinda like a substitute teacher. In In a Pickle, Liz play the Judge in Ms. Frizzle's trial for swiping Keesha's 1st prize cucumber and turning it into a pickle – she got the wig, the outfit, and she holding the gavel and all.	"Liz from ""The Magic School Bus"" ain't a girl, bruh. Liz is actually a lizard, specifically Ms. Frizzle's pet lizard on the show."	1
f154b4e2-5e0c-4406-b27c-b30f86e83312	Sequence (music) -- You gotta have at least two times where the same sorta pattern shows up, including the first time it pops off, to call it a sequence. This pattern gotta be made up of a bunch of melody notes or at least a couple of chords one after the other. Even though folks often link it with Baroque music, like the kind Antonio Vivaldi was all about, this technique is all over the place in Western music history.	sequence happen when a pattern of notes get repeated	1
1199e5f0-ee46-4b7f-8138-816080741df1	Inside-the-park home run — In baseball, an inside-the-park home run happen when a batter smack a home run but don't even knock the ball outta the field. They also call it an in-the-park home run or in the park homer.	Do inside the park home runs count as home runs?	1
2a4a89b4-1be1-448f-aee1-f3f32a0dd6ca	Sgian-dubh -- When you rock it with the traditional Scottish outfit, it's all good and legal in Scotland, England, and Wales. In Scotland, check out the Criminal Law (Consolidation) (Scotland) Act of 1995, Section 49, Sub-section 5(c); and in England and Wales, peep the Criminal Justice Act of 1988 (section 139) and the Offensive Weapons Act of 1996 (section 4).	it legal to tote a sgian dubh around?	1
2c15e920-84a1-48a7-95c7-5e69b754cbb3	Acid -- Common liquids that got acid in 'em include hydrochloric acid (that's what you find in your stomach helping break down food), acetic acid (that's basically vinegar), sulfuric acid (they use this in car batteries), and citric acid (you find this in citrus fruits like oranges and lemons). Like these examples show, acids can either be mixed up in solutions or be pure on their own, and they come from different forms like solids, liquids, or gases. Some strong acids and them concentrated weak acids can eat through stuff, but there are some that don't, like carboranes and boric acid.	Nah, the main thing in stomach acid ain't sulfuric acid, it's hydrochloric acid.	1
cc4aa631-31bf-49e2-9183-b06f9d2d6b9b	United States Marine Corps -- The Department of the Navy, run by the Secretary of the Navy, is a military branch under the big-time U.S. Department of Defense that looks after both the Marine Corps and the Navy. The top dog in the Marines is the Commandant, unless a Marine officer is running things as Chairman or Vice Chairman of the Joint Chiefs. They answer to the Secretary of the Navy and handle all the business like organizing, recruiting, training, and gearing up the Marine Corps to make sure the troops are set for action under the Commanders in charge of combat operations. The Marine Corps got four main parts: Headquarters Marine Corps (HQMC), the Operating Forces, the Supporting Establishment, and the Marine Forces Reserve (MARFORRES or USMCR).	Do the Marines fall under the US Navy?	1
31933249-f24f-4f3d-a713-37e4f5e4eda6	The Chorus (2004 movie) -- The Chorus, or in French, Les Choristes, is a European drama movie from 2004 directed by Christophe Barratier. Barratier and Philippe Lopes-Curval wrote it together. It's a remake of the 1945 movie A Cage of Nightingales (La Cage aux rossignols). That old film itself was based on a story by René Wheeler and Georges Chaperot, and adapted by Noël-Noël and René Wheeler. The plot is inspired by the true story of The Little Singers of Paris, a famous boy choir who were the main focus in A Cage of Nightingales. The original French name means The Choirboys or The Choristers, not The Chorus.	Les Choristes based on a true story or nah?	1
d9a7cceb-35d2-486f-ae15-9441ffe83f4c	Twenty-sixth Amendment to the U.S. Constitution -- The Twenty-sixth Amendment (Amendment XXVI) stops states and the federal government from denying the vote to U.S. citizens who are 18 and older based on their age. Back in the 1960s, folks pushed hard to drop the voting age from 21 to 18. This was mainly because (1) the military draft was pulling in young men aged 18 to 21 into the armed forces, mostly the Army, either because they were drafted or they enlisted in other branches to dodge the draft, all to help in Vietnam War efforts, and (2) there was a lot of student activism against the Vietnam War. The push to make an amendment to lower the voting age started after the Supreme Court's decision in Oregon v. Mitchell, 400 U.S. 112 (1970), which ruled that Congress can set the voting age for federal elections, but not for local or state elections.	was the voting age 21 back in da day?	1
40fe98e2-3450-4d9d-98cb-06e8bdee0d6d	Mystic Pizza -- Mystic Pizza be a 1988 American coming-of-age movie directed by Donald Petrie, starring Annabeth Gish, Julia Roberts, and Lili Taylor. Since it dropped, the film done picked up a big cult following and mostly good reviews from critics, especially for how them three main actresses did they thang. It also the first movie Matt Damon was in.	Mystic Pizza based on some real stuff?	0
49af43f4-3ff0-44db-ab65-f1f366f72c61	Out-of-body experience -- Back in 1943, G.N.M. Tyrrell coined the term out-of-body experience in his book Apparitions. This term got picked up by folks like Celia Green and Robert Monroe, who wanted to step away from them old-school terms like astral projection, soul travel, or spirit walking. OBEs can happen from a lot of stuff like brain injuries, being in a spot with no senses, almost dying, using certain drugs, not drinking enough water, sleeping, or even getting your brain zapped. Some people even figure out how to make it happen on purpose. About one in ten folks will have an OBE once or even more times in their life.	can anybody have an out-of-body experience?	1
f3fdda59-42fa-451b-8bd6-fa89b8c24a75	Daylight saving time by country -- Most spots in North America and Europe, plus some places in the Middle East, be on that daylight saving time (DST) tip, but most areas in Africa and Asia ain’t with it. Down in South America, most countries up north near the equator don’t mess with DST, but Paraguay and the southern parts of Brazil do. Oceania's kinda mixed about it too; New Zealand and some parts of southeastern Australia be doing DST, while most other areas don’t.	do any other countries do daylight savings time too?	1
ebdf7f89-a58b-44f7-84cf-6fe8509f4cfe	Walgreens -- The Walgreen Company (folks just call it Walgreens, or sometimes old school folks might say Walgreen) is a big company in the U.S. that's the second-largest pharmacy store chain right after CVS Health. They all about filling prescriptions, selling health and wellness products, giving out health info, and they do photo services too. As of August 31, 2016, this company had 8,175 stores all over the 50 states, the District of Columbia, Puerto Rico, and the U.S. Virgin Islands. It started up in Chicago, Illinois, back in 1901. The main office for Walgreens is in the Chicago suburb of Deerfield, Illinois.	Walgreens and CVS owned by the same folks or nah?	0
8a89b547-53dd-4c96-8f02-22a9cd3d99bd	Oklahoma alcohol laws -- Can’t nobody sell bottled liquor for takin' home on Sundays. They also can't sell on Memorial Day, Independence Day, Labor Day, Thanksgiving, and Christmas. Plus, you ain't gon' be able to buy low-point beer to take home from 2:00 a.m. to 6:00 a.m. either.	Can you cop beer on Sunday in Oklahoma?	1
d4bb9f84-d2e5-4bca-aad2-26306cd08761	Pound sterling -- After that 2016 UK vote on stayin' in the EU, the pound really took a hit against other big currencies 'cause folks was unsure 'bout how trade and politics was gon' shake out. Right after the vote, the pound dropped 5% against the euro. Before folks voted, you could get €1.30 for every pound, but the day after, it was just €1.23. Come October 2016, it was down to €1.12, which is a 14% drop since the vote. By the end of August 2017, the pound was even lower at €1.08. Now, talkin' 'bout the US dollar, the pound went from $1.466 down to $1.3694 right when they announced the vote results, and it kept fallin' to $1.2232 by October 2016, which is a 16% fall.	is 1 pound the same as 1 dollar?	0
85ff180c-7153-4dbf-b14f-2480686fbb36	Jack Russell Terrier -- The Jack Russell Terrier, it's a lil terrier that started off in fox hunting. Mostly, it got a white body and can have a smooth, rough, or broken coat, and they come in all sorts of colors.	Is a Jack Russell considered a small breed?	1
37a1aeb9-325c-4f37-8fc2-0d688c2942d8	"Stanley Cup — Now, unlike them other big league sports trophies in North America, they don't make a new Stanley Cup every year. Back in the day, whoever won kept it till a new champ was crowned. Nowadays, the winning team gets to hold onto the Stanley Cup during the summer and for a few days in the season. It's special 'cause it's got the names of the winners engraved right on it. Since 1924, they been putting the names of some of the players, coaches, management, and club staff on its bands every year. But, ain't enough space for everybody's name, so some folks get left off.

From 1924 to 1940, they added a new band nearly every time it was handed out, which made it tall like a stovepipe, so they called it the Stovepipe Cup. In 1947, they made it shorter, but them rings wasn't all the same size. Then in 1958, they came out with the modern design, a five-band barrel that can hold 13 winning teams per band. To keep it from getting too big, when the bottom band fills up, they take the oldest one off, keep it in the Hockey Hall of Fame, and slap"	do every player get they name on the Stanley Cup?	0
020903b8-9edf-4b1d-ab2f-db996e49ad99	The Last Star (novel) -- The Last Star is a young adult science fiction book by the American writer Rick Yancey. It dropped on May 24, 2016, by G.P. Putnam's Sons. This book is the third and final one in The 5th Wave trilogy, coming after The Infinite Sea.	is there a sequel to the 5th wave?	1
218b259d-3623-4520-87d3-413c0bae4cce	Battle of Berlin -- Ain't no plans was made by the Western Allies to take the city by ground. The Supreme Commander (Western) Allied Expeditionary Force, General Eisenhower wasn't feelin' the race to Berlin and ain’t see no need to rack up casualties attacking a city that was gon' be in the Soviet zone after the war. He thought it'd be too much friendly fire if both armies tried to hold down the city at the same time. The big thing the Western Allies did in the battle was bombing Berlin in 1945. During that year, the United States Army Air Forces hit up Berlin with big daytime raids and for 36 nights straight, loads of RAF Mosquitos kept bombing the German capital, all ending on the night of 20/21 April 1945 just before the Soviets rolled in.	nan	1
3f571dcf-b2db-4ff4-a0e2-69e8ffa3cddc	So, talkin' 'bout the rules 'bout incest in the UK, right? Check it, each part of the UK got its own set on this. If you messin' around with somebody in your fam like your parent, grandparent, child, grandchild, sibling, uncle, auntie, nephew or niece, that's a no-go. Over in England and Wales, they switched up the old incest laws with the Sexual Offences Act 2003. Now they got two big categories: one for messing with kids in the fam (sections 25 to 29) and another for getting with adult relatives (sections 64 to 65). They set these laws to protect folks and keep everything right, but even if folks in the fam are down and know what's up, it's still illegal. Some folks been talking 'bout how the folks who review these laws use their words to make any consensual family hookups look bad, like they're not just illegal but straight up wrong. Up in Northern Ireland, they got their own set of rules with the Sexual Offences (Northern Ireland) Order 2008.	can you tie the knot wit yo sister in the uk?	0
cd9b72ca-6e25-4a60-81be-0686a07e92be	Buttermilk pie -- Buttermilk pie be like a custard-type pie, ya know? It started off in the United Kingdom, but now it's a big thing in the southern United States. It kinda reminds folks of chess pie, but ain’t got no cornmeal in it. The main mix up in it is sugar, butter, eggs, buttermilk, and wheat flour. You might catch some folks adding extra stuff like vanilla, lemon zest, and nutmeg to jazz it up. You make it with a pie crust, pour all that good filling inside, and bake it till it sets right. Best way to enjoy it? Let it cool down to room temp, but you can dig in while it's warm from the oven or even chill it if that’s your thing.	Nah, chess pie and buttermilk pie ain't the same. They similar tho, 'cause they both got that custardy filling, but chess pie usually got cornmeal in it which buttermilk pie don't. Plus, buttermilk pie use buttermilk for that tangy flavor, while chess pie got vinegar or lemon juice.	0
d8d267d8-d101-4b5f-bd9f-dc4af74ff1d7	Cell (biology) -- A cell, comin' from the Latin word cella which mean small room, is the basic structural, functional, and biological unit of all known livin' things. It's the tiniest unit of life that can make copies of itself on its own, and folks often refer to cells as the building blocks of life. When you study cells, that's known as cell biology.	cells da basic unit of life in all organisms	1
db151e6a-3334-408a-99f7-5591ae651f62	The Way Back -- The Way Back a 2010 American survival movie directed by Peter Weir, from a script by Weir and Keith Clarke. The movie inspired by The Long Walk (1956), the memoir by former Polish prisoner of war Sławomir Rawicz, who said he escaped from a Soviet Gulag and walked 4,000 miles to freedom in World War II. The movie stars Jim Sturgess, Colin Farrell, Ed Harris, and Saoirse Ronan, with Alexandru Potocean, Sebastian Urzendowsky, Gustaf Skarsgård, Dragoș Bucur and Mark Strong.	nan	1
399a7747-84ef-4f03-aaff-f234fd373de1	Blue jay -- Blue jays ain't too choosy 'bout where they set up shop. If they can't find nothin' better -- like in a place where there ain't much trees left -- they might even squat in them big mailboxes you see out in the country. They cool with taking over other birds' nests too, long as they in a good spot; for real, they often snatch up American robin nests.	do blue jays be takin' over other birds' nests?	1
73531540-7137-4c71-ad48-58bf92ab9609	Martial law -- In the US, they done used martial law here and there, like right after some countries attacked us, like what went down in Hawaii after Japan hit Pearl Harbor or in New Orleans during the Battle of New Orleans. They also pulled it out after big disasters hit, like the Great Chicago Fire in 1871 or the San Francisco earthquake in 1906. Sometimes, local leaders who ain't tryna get arrested would declare it too, like in Nauvoo, Illinois during the Illinois Mormon War, or Utah during the Utah War. And when things get wild with protests and mobs, like during the 1934 West Coast waterfront strike or when folks were trippin' on the Freedom Riders, they set it off then too.	Has there ever been martial law in the United States?	1
c5d92872-6b5f-44d6-a4b6-c3cbbe1c381e	Beauty and the Beast (2017 movie) -- After they share a sweet dance, Belle sees her daddy's trouble through a magic mirror. The Beast lets her go to save Maurice, and he gives her the mirror to keep him in her heart. Back in Villeneuve, Belle shows the townspeople the Beast in the mirror, proving her daddy ain't crazy. When Gaston sees that Belle got feelings for the Beast, he gets jealous and tells everyone she's under an evil spell. He locks her and her father up, planning to take down the Beast before he thinks the Beast can curse them all. Maurice and Belle break out, and Belle heads back to the castle fast.	do Maurice die in Beauty and the Beast?	0
