id	text_a	text_b	label
678ca86d-d26a-4d92-8c15-9e12df57e9c1	Power Rangers (film) -- Jason David Frank and Amy Jo Johnson, who both starred in the original TV series, pop up as folks from Angel Grove.	any of the OG Power Rangers in the new movie?	1
74e3b1e4-ed3c-4508-a571-a3b2e4fc0fc9	Fool's Gold (2008 film) -- Fool's Gold be a 2008 American adventure-romance movie from Warner Bros. Pictures 'bout a couple who just got divorced but find they spark again while they out there hunting for some hidden treasure. The movie directed by Andy Tennant and it bring back together the stars from How to Lose a Guy in 10 Days, Matthew McConaughey and Kate Hudson.	"Nah, the movie ""Fool's Gold"" ain't based on a true story. It's all fictional."	0
98d02cf1-06f3-400b-adf4-bb18480d83be	Ain't no stats on which countries folks from be doin' birth tourism in the U.S. The Center for Health Care Statistics say in 2008, which the latest year we got data for, it was 7,462 babies born to folks from elsewhere in the U.S. That’s just a lil’ bit of the 'bout 4.3 million babies born that year. The Center for Immigration Studies, which lean conservative, guessed in 2012 that 'bout 40,000 babies a year born to birth tourists in the U.S. They also thought in 2012 that the total number of babies born to temporary immigrants here (like tourists, students, guest workers) might be up to 200,000.	nan	1
2f9a7697-d64d-4e4a-9fdd-2aaf2a751687	Jersey pound -- In Jersey, both dem Jersey notes and dem Bank of England notes good for spending, and they be all around the place with Guernsey pound and Scottish banknotes too. Now, dem Jersey notes, they ain't officially good for spending in the UK, but they still legal currency, so folks over there can take 'em if they want to.	do they use Jersey money in the UK?	0
7b223665-70d9-4f76-8ba5-9ca6cd8f3c20	Croatia in the FIFA World Cup -- The Croatia national football team done been in the FIFA World Cup five times (1998, 2002, 2006, 2014, and 2018) since they got independence in 1991. Before that, from 1930 to 1990, Croatia was part of Yugoslavia. If you wanna check out the World Cup records and appearances during that time, peep the Yugoslavia national football team and Serbia at the FIFA World Cup. Their coldest moment was snagging that silver at the 2018 final, but they took a loss, 4-2, against France.	Croatia ever made it to the World Cup final?	1
5344c6d0-3eac-4f3a-995f-d9fc6c76e3b1	Iron Fist (season 2) -- This the second season of the American web TV series Iron Fist, based on that Marvel Comics character Iron Fist. It follows Danny Rand, aka Iron Fist, who's a martial arts expert with the special power to summon the Iron Fist. This season fits right into the Marvel Cinematic Universe (MCU), linking up with the movies and other TV shows of the same franchise. Marvel Television produced this season alongside ABC Studios, with Raven Metzner running the show.	they gon' drop a season 2 of marvel's iron fist or nah?	1
cbd4c440-4d8d-4fb1-9d6a-26a0df6b6147	FIFA World Cup -- Outta all dem national teams, Germany and Brazil done played the most World Cup matches (109), with Germany showin’ up in the most finals (8), semi-finals (13), quarter-finals (16). Meanwhile, Brazil been in the most World Cups (21), got the most wins (73), and scored the most goals (229). Them two teams done faced off twice in the World Cup, back in the 2002 final and then again in the 2014 semi-final.	have any teams played each other twice in the world cup?	1
68c77871-ed5d-4954-a71c-1cd08c9a169a	Birth certificates in the U.S. -- When a baby is born, the first ID they get is the birth certificate, and it's given out by the local government, like the city or county where the baby was born. This document is super important because it proves you’re a U.S. citizen right from birth, and you need it to get all other types of ID later on. But on its own, a birth certificate only shows you’re a citizen, not who you actually are, cause it ain’t got no photo or unique details about you. Normally, you gotta show your birth certificate along with something else that proves who you are, like a driver's license, or someone like your parent has to vouch for you, especially if you trying to get some services or rights.	Do a birth certificate count as a valid ID?	0
25befd8d-c273-4786-96b9-9de6c70252c4	"So, check it out, Puerto Rico's whole political setup is kinda unique. Constitutionally, Puerto Rico falls under the full control of the U.S. Congress because of this rule in the Constitution called the territorial clause. What this means is, even though Puerto Rico ain't a state and the folks there can't vote in the U.S. Congress, U.S. federal laws still apply over there. Back in 1950, this law called the Federal Relations Act made it so that all federal laws that fit with Puerto Rico’s situation automatically apply there.

Since this law kicked in during the 1950s, there have been only a couple of court cases where they decided a federal law didn't apply to Puerto Rico unless the law specifically said it didn't or treated Puerto Rico differently. The most recent case like that even got overturned.

Now, there's this law professor, Efrén Rivera Ramos, who’s been breaking down what these powers really mean. He says that while a state’s government gets its power from its people, a territory like Puerto Rico gets its powers from the United States. The courts seem to think this gives the U.S. government a lot of control, more than it would have over the states.

Justice Harlan, a long time ago"	do Puerto Rico gotta follow US laws?	1
568a081b-d09d-419c-9b88-b02f6f3f5d66	Gettin' rid of head lice — Usin' a regular home blow dryer can kill 96.7% of lice eggs if you do it right. You gotta use the blow dryer over and over (like every 1 to 7 days cause the eggs hatch in 7 to 10 days) until them lice done gone through they whole life cycle, which take about 4 weeks.	can you use a blow dryer to get rid of lice?	1
7d61bdba-7e68-4dac-96ca-466864d9407e	Carlotta from The Phantom of the Opera — In that 2004 movie version by Lloyd Webber and Joel Schumacher, Minnie Driver played her. But since Minnie wasn’t really experienced in opera, they had Margaret Preece dub her singing parts. However, Minnie did sing for real in that song Learn to Be Lonely that plays during the end credits.	Minnie Driver, she sang in Phantom of the Opera?	0
d93094ed-3f27-4f71-9524-0791d4c6b84f	Airsoft laws -- Under the big federal rules, airsoft guns ain't seen as real guns, so folks of all ages can have 'em. Now, if you under 18, you can't just walk into a store and cop one yourself. But, any age can use one if they got the okay from their folks, especially for the youngins under 18. This is how it goes down in most states too. But watch out, in some big cities, they got different rules where they treat anything that shoots from a spring or air like a real gun, so airsoft could get caught up in those laws. Like in California, you gotta be over 18 to buy one, but there ain't no age limit on selling them. And no matter where you at, remember, them toy guns gotta have that orange tip when they being shipped or moved around.	you gotta be 18 to cop airsoft guns?	1
fd0feda0-1939-4d0d-b786-691f56df26cd	David Labrava -- David M. Labrava (born October 19, 1962) be an actor, writer, tattoo artist, Hells Angels member, and motorcycle enthusiast most known for his role as Happy in the FX series Sons of Anarchy.	they got any Hells Angels in Sons of Anarchy?	1
0fa74351-3b14-4255-8640-5b013e92bf47	Checkmate -- Ain’t too hard for two bishops to force a checkmate, especially with they king helpin’. Two rules to follow:	Can you get a checkmate wit two bishops an' a king?	1
528bc194-7d03-49f3-a1cc-00fa9e114a63	Chocolate liqueur -- It got three kinds: regular liqueur, cream liqueur, and crème de cacao.	is creme de cacao the same as chocolate liqueur?	1
f79d9e17-e35a-47a7-9e58-2d09dec70d6c	Protein primary structure -- Besides the ones already mentioned, the key change to the primary structure is when peptides get cut (by chemical break-down or by proteases). Proteins usually start off in a form that ain't active yet; most times, a piece at the beginning or end of the protein blocks the part that does the work, stopping it from functioning. The protein gets going once that blocking piece is chopped off.	do how a protein sequence be lined up matter fo' its function?	1
1b6bc4fb-8cdd-4b5b-a714-2dea051c8a35	The Guardian (2006 movie) -- The Guardian be a action-adventure drama movie from 2006 directed by Andrew Davis. Kevin Costner, Ashton Kutcher, and Melissa Sagemiller all up in this flick. The movie got its name from a old story: folks who get lost at sea often feel like someone's lifting them up to the surface, breathing life back into them while they waiting on rescue. They call this spirit The Guardian. The movie's backdrop the United States Coast Guard and they Aviation Survival Technician (AST) program. It hit theaters on September 29, 2006.	"Was the movie ""The Guardian"" based on a real story?"	0
6c2b75a1-95a2-4181-a3b6-39b5738fe970	Peter Gardner Ostrum, born November 1, 1957, is an American vet and used to be a child actor back in the day. His only movie role was playin' Charlie Bucket in that 1971 movie Willy Wonka & the Chocolate Factory.	"Charlie from ""Charlie and the Chocolate Factory"" a book character, bruh. He ain't real, so he ain't alive or dead. He live on in the story and movies, feel me?"	1
2bba2f62-14f8-45cc-9a81-9435890fee49	Thursday Night Football -- Back in 2018, the NFL locked down a long-term deal with Fox to keep the rights all the way through 2022.	Thursday Night Football gon' be on regular TV or nah?	1
76711ecc-ba0e-468d-9382-92986713522e	Turning on red -- This means when you at a stoplight with a red signal, you can make a turn into the closest lane of traffic (you gotta stop completely first) when there ain’t no cars coming, without having to wait for the light to turn green. This helps keep traffic flowing smooth as long as everybody’s careful.	you gotta turn right at a red light or nah?	0
b1becb9e-2e5f-4fd7-ba29-7983e1da95ab	3-way lamp -- Dis lamp got two filaments that you can turn on one at a time or both at once, givin' you three different light levels. A common 3-way incandescent bulb be like a 50 W / 100 W / 150 W bulb. It got a low-power 50 W filament and a medium-power 100 W filament. When both lit up, it push out 150 W of power, and that's when it really bright. Usually, these screw-base 3-way bulbs fit into the regular Type A sockets. Them bigger 3-way bulbs, which can go up to 300 W, got a bigger mogul base. You can find these 3-way bulbs in spiral styles too.	can a 3 way bulb fit in any lamp tho?	1
156934a4-7b72-4e9f-9f04-512a459ddc07	John Wick -- A third movie, called John Wick 3: Parabellum, bein' made and it's droppin' on May 17, 2019. They keepin' it goin' with more movies in the works, plus a TV show called The Continental that Starz network done picked up.	John Wick finna be a trilogy or what?	0
e956cfb8-20d9-4e0a-9c5d-7f595fd9b80e	Table (database) -- Talkin' 'bout relational model of databases, a table is like a handy way to show a relation, but they ain't exactly the same thing. Like, an SQL table might have some duplicate rows, but a real-deal relation can't have duplicate tuples at all. Plus, when you lay it out as a table, it seems like there's a specific order to the rows and columns, but a relation don't care about order at all. Now, the database system ain't gonna keep the rows in any specific order unless you tell it to by using an ORDER BY clause when you run a SELECT statement to pull data from the table.	if a table got a primary key, ain't no duplicate records gonna be in that table.	0
82664b74-1a7b-4765-9d44-1eae0f87e52f	Static (DC Comics) -- They just let out that before he got snatched, Static linked up with Justice League's own Black Lightning to shut down ex-Blood Syndicate crew member Holocaust. Dude was tryna take out the superhero while he was droppin' knowledge as the main speaker at Ernest Hemingway High's senior graduation.	Nah, Static Shock and Black Lightning ain't the same person. They two different characters, yo.	0
54ec5978-db25-4ac2-8222-5364815800f4	Bi-Mart, it's like Costco and Sam's Club 'cause you need a membership to shop there. But check it, they started their members-only thing back in the day to get around them old fair trade laws from the 1930s, like the Miller-Tydings Act and other laws about suggested retail prices. And, yo, it's only $5 for a whole family to join, and that membership don't ever run out.	you gotta be a member at Bi-Mart?	1
53f2db4c-a3a3-44de-b688-c623865157f5	John Williams -- John Towner Williams, born February 8, 1932, is an American composer, conductor, and pianist who's been in the game for over six decades. He's behind some of the most famous and loved film scores ever, like those for the Star Wars series, Jaws, Close Encounters of the Third Kind, Superman, E.T. the Extra-Terrestrial, the Indiana Jones series, the first two Home Alone movies, Hook, the first two Jurassic Park movies, Schindler's List, and the first three Harry Potter movies. Williams has been tight with director Steven Spielberg since 1974, doing the music for nearly all his movies except three. He's also done theme music for the 1984 Summer Olympic Games, NBC Sunday Night Football, “The Mission” theme for NBC News and Seven News in Australia, and TV shows like Lost in Space and Land of the Giants. Plus, he did the music for the first season of Gilligan's Island. Besides all that, Williams has written loads of classical concertos and other pieces for orchestras and solo instruments. He was the main man leading the Boston Pops from 1980 to 1993, and now he's their laureate conductor.	Did John Williams write music for Indiana Jones?	1
44824721-94b1-4e47-811b-26e27fdc4350	Once Upon a Time (season 6) -- The sixth season of the American ABC fantasy-drama Once Upon a Time got the green light on March 3, 2016. It dropped on September 25, 2016, and wrapped up on May 14, 2017. Back in January 2017, they announced that the sixth season was gonna wrap up the main story, and for season seven, they planned to kinda reboot the series with a fresh new storyline.	they gon' have a season 6 of Once Upon a Time or nah?	1
92135eac-37c2-4d03-9092-387769b2ee38	Isotope -- So check it, the number of protons in the center of the atom, that's called the atomic number, right? And that's the same as the number of electrons when the atom ain't charged up. Now, this atomic number, it tell you what element you dealing with, but it don't tell you about the isotope; 'cause see, an atom of the same element can have all different numbers of neutrons. Then you got the mass number, which is the total count of both protons and neutrons in the middle. Each different isotope of an element, it's gonna have its own unique mass number.	can an element have different kinds of atoms?	1
7026fa52-ef12-489d-9d84-fcecc0e61976	Texas flag -- By law, this flag gotta be up by the main building of every state spot on all the state or national holidays, and any big days with historical vibes, always up over both doors of the Texas State Capitol. It hangs solo at the north door, but it’s under the U.S. flag at the south door, unless the flags are half mast or the POW/MIA flag is up with the U.S. flag; then the Texas flag just flies at the North Door. State law say it also gotta be flown at or near any International Port of Entry. When you hang it vertically, put the blue stripe on top and, for anyone looking, the white stripe should be on the left side of the red stripe.	Do the Texas flag and the American flag fly at the same height, or nah?	0
e48e1333-2df6-40e9-9e41-c7cd3f7ea555	Marvel Cinematic Universe -- In December 2017, The Walt Disney Company agreed to buy assets from 21st Century Fox, including 20th Century Fox, for $52.4 billion. The next June, after Comcast offered $65 billion, Disney raised their bid to $71.3 billion. This deal would bring the film rights for Deadpool, and the X-Men and Fantastic Four characters back to Marvel Studios, which would create richer, more complex worlds of inter-related characters and stories. In July 2018, Feige mentioned they started talks with Disney about what role Marvel Studios could play with Disney's streaming service, since Feige thought the service was an important thing for the company.	nan	0
ebcca08f-4cca-4538-85fa-1cde3cb950bc	Relational database -- A foreign key a field in a relational table that match the primary key column of another table. The foreign key can be used to cross-reference tables. Foreign keys ain't gotta have unique values in the referencing relation. Foreign keys effectively use the values of attributes in the referenced relation to restrict the domain of one or more attributes in the referencing relation. A foreign key could be described formally as: “For all tuples in the referencing relation projected over the referencing attributes, there must exist a tuple in the referenced relation projected over them same attributes such that the values in each of the referencing attributes match the corresponding values in the referenced attributes.”	nan	1
7f039219-e301-4a38-b236-86392727a46e	Drinking outside -- Aight, so in Singapore, you can drink in public, but there's rules you gotta follow, especially after that 2013 Little India mess. You can't be sipping on alcohol in public spaces or places that ain’t got no liquor license from 10:30 at night till 7 in the morning. If you tryna drink during these hours, you gon' need a permit. Plus, places like NTUC FairPrice, Giant Hypermarket, Sheng Siong, Cold Storage, and 7-Eleven ain't selling no booze from 10:30 PM to 7 AM.	Is it against the law to sip on somethin' in public in Singapore?	0
5960729c-0344-4819-b4f3-9bb491d8b5dc	Willie Robertson -- Willie Jess Robertson (born April 22, 1972) is an American TV personality, businessman, outdoorsman, hunter, author, and actor. He most known for bein' on the reality TV show Duck Dynasty on A&E, and he the current CEO of Duck Commander. Robertson stay in West Monroe, Louisiana with his wife Korie and his kids: John Luke, Sadie, Will, Rowdy, Bella, and Rebecca.	Willie Robertson from Duck Dynasty, he still alive or what?	0
a282ea09-068b-4187-95cf-03910581ae69	Guinea, officially called the Republic of Guinea (in French, République de Guinée), is a country on West Africa's coast. Back in the day, it was known as French Guinea. Nowadays, folks sometimes call it Guinea-Conakry to set it apart from other places with Guinea in their names like Guinea-Bissau and Equatorial Guinea. Guinea got about 12.4 million people living there and covers an area of 245,860 square kilometers (that's 94,927 square miles).	Nah, Equatorial Guinea and Guinea ain't the same country. They different.	1
9a3e8573-82ee-4409-85fd-84b71314da2f	Stop and identify laws -- These laws in the U.S. let police ask for your ID if they think you might've done something wrong. But if they ain't got no good reason to think a crime happened, is happening, or gonna happen, you ain't gotta show your ID, even in states with these Stop and ID laws.	do i gotta show ID to the cops	0
70f65afb-0f69-426e-aba4-f47d3c65f4e5	List of FIFA World Cup penalty shoot-outs -- Here's a rundown of all the penalty shoot-outs that have gone down in the FIFA World Cup Finals. They started using penalty shoot-outs to break ties in the 1978 World Cup, but the first one didn't happen until 1982. The first time somebody clinched the World Cup title in a penalty shoot-out was in 1994. It only happened again in 2006. By the time the 2018 tournament wrapped up, there had been 30 shoot-outs. Out of these, only two hit the sudden death phase after they were still tied following the initial best of five kicks.	do the world cup final go to penalties?	1
42b88470-1a27-4eac-8566-b7ecb47ca50d	"Closed communion -- So here’s how it goes down in the Catholic Church: They got a list of churches they cool with when it comes to how they do the Eucharist and who they got as ministers. But, if you're stuck and can’t get to a Catholic priest, and you really need it or it’s gonna help you spiritually, and long as it don’t lead to no confusion or mixing up beliefs, then the Catholic Church is alright with its folks getting Communion from the Orthodox Churches. But peep this, the Orthodox Churches ain’t down for returning the favor; they only let their own members take Communion.

Now, when it comes to Protestant churches, the Catholic Church usually ain’t letting their members get communion there. They don’t see Protestant ministers as legit priests since they ain’t got that direct line back to the apostles like they believe their own priests do. Even though groups like the Lutherans, Moravians, and Anglicans say they keep to that apostolic succession, the Catholic Church still holds them to the same rule, especially after they laid down the law in Apostolicae curae. The Church of England wasn’t having it and clapped back with Saepius officio, but that’s how it’s set"	Can a Catholic get communion at an Episcopal church?	0
318072d8-33e0-4d85-9265-07f07738ba8a	Online relationship -- An online relationship is when folks link up over the internet, and often, they ain’t met face-to-face, just through the web. These relationships can be like having pen pals back in the day. This type of connection can be about romance, friendship, or even business stuff. An online relationship usually gotta build up over some time before it's considered a real relationship, just like when folks meet up in person. The big difference here is that folks maintain an online relationship through computers or online services, and sometimes, they might never meet in real life. The term covers a lot of ground and can involve texting, video chats, voice messages, or even interacting through virtual avatars. This kind of relationship can happen between folks in different places, different countries, across the globe, or even between people living in the same area who just don’t meet up face-to-face.	Can you have a relationship online?	1
a624bd54-5c84-4710-a975-f3bf12e085ff	Associate degree -- Transfer admissions in the United States lets courses taken and credits earned on an A.A., A.S., or A.A.S. course sometimes count toward a bachelor's degree through articulation agreements or recognition of prior learning, depending on the courses taken, applicable state laws/regulations, and the university's transfer requirements.	nan	0
21ac4fae-d83d-4d40-88dd-e91cbb0e7220	Vidalia onion -- A Vidalia onion is a sweet onion of certain kinds, grown in a specific area set by law in Georgia, U.S., and by the United States Code of Federal Regulations (CFR).	vidalia onions the same as other sweet onions?	1
466b8a63-7174-4377-b65f-55bd2aa3a309	Law & Order -- Law & Order be a American police procedural and legal drama TV show, created by Dick Wolf and part of the Law & Order franchise. It first came on NBC and, in syndication, on various cable networks. Law & Order started on September 13, 1990, and wrapped up its 20th and final season on May 24, 2010. By the time it got cancelled, Law & Order was the longest-running crime drama on American primetime TV. Its 20 seasons match with Gunsmoke (1955--75) for the longest-running live-action scripted American prime-time series with ongoing characters. Even though it got fewer episodes than Gunsmoke, Law & Order stands as the longest-running hour-long primetime TV series. Gunsmoke, for its first six seasons, was initially a half-hour show.	nan	0
f155ec2f-ddb5-4e98-b6cc-5992d79731a3	List of hurricanes in North Carolina -- This list got 413 tropical or subtropical cyclones on record that hit up North Carolina. Cause of where it's at, a bunch of hurricanes done made direct landfall, plus plenty more done whipped by close or right through the state over time. North Carolina's the fourth most hit state for them cyclones that bring hurricane-force winds, just behind Florida, Texas, and Louisiana. Them hurricanes in North Carolina's history done caused more than $11 billion in damage (that's 2008 dollars) and nearly 1,000 people lost their lives.	Do North Carolina be gettin' a lot of hurricanes?	1
407ac88d-f64f-487d-983d-cc0158b7aa64	Scott O'Grady -- Scott Francis O'Grady (born October 12, 1965) a former United States Air Force fighter pilot. On June 2, 1995, he got shot down over Bosnia and Herzegovina by a 2K12 Kub mobile SAM launcher and had to eject from his F-16C into enemy territory. After almost a week of dodging the Serbs he finally got rescued by Marines. Before that, he was in the Banja Luka incident where he shot at six enemy aircraft. The 2001 movie Behind Enemy Lines loosely based on his experiences.	nan	1
7a61c674-878f-41e8-a846-df3729387e10	Drinking outside -- Aight, so check it, in England and Wales, it's all good to drink in public. You can grab your drink from a bar and just walk down the street with it. Just make sure you ask for a plastic cup though, cause carrying a glass can lead to some problems, like it breaking or accidentally stealing the glass since you actually just bought the drink, not the glass. Plus, you can hit up an off-licence store, buy your liquor, and start sipping right there outside. Also, you can drink on planes and on most of the National Rail trains, whether you buy your booze there or bring your own.	Can you legally drink in public in London?	1
ea26575c-3861-439d-9bdb-88a65a4071d8	Boy Scouts of America -- The National Council be set up as a 501(c)(3) non-profit organization and get money from private donations, membership dues, corporate sponsors, and special events, pullin' in a total of $237 million.	nan	1
