id	text_a	text_b	label
cda333c6-136e-49e8-8d7c-6aa4abb63119	Prime Minister of the United Kingdom -- Ain't no official law or document set up this position; it's all about tradition. The queen or king gotta choose someone to be the Prime Minister who they think can get the most love from the House of Commons; usually, it's whoever leading the party with the most seats. This whole role of Prime Minister ain't just pop up overnight; it took like 300 years to form, mixing in all kinds of laws, political moves, and just random historical events. To really get it, you gotta look back at the history. The gig started getting its shape back during the Revolutionary Settlement between 1688 and 1720 when power started shifting from the king or queen to Parliament. Even though the king or queen was still technically in charge, politically, they had to start working through a Prime Minister who could hold down a majority in Parliament.	do da prime minister gotta be a MP?	0
a7d3cd4d-53b9-4066-8c93-e909b4d50992	Fargo (season 3) -- Da third season of Fargo, a American anthology black comedy-crime drama TV series made by Noah Hawley, kicked off on April 19, 2017, on the basic cable network FX. This season got ten episodes, and it wrapped up on June 21, 2017. Bein' an anthology, each season of Fargo got its own story, followin' different folks in different spots, but they all in this same connected universe, ya know?	they gon' have a third season of Fargo or nah?	1
d7d09897-b7dd-4fda-ae43-e81ab0399270	Cradle cap -- Cradle cap be seborrheic dermatitis that hit up infants. It show up on the scalp as greasy patches of scaling, lookin' thick, crusty, yellow, white, or brown. The spots where it show up usually ain't itchy and don't trouble the baby none. It can also pop up on the eyelids, ear, 'round the nose, and in the groin. Might even cause some hair loss too.	do cradle cap make baby hair drop out?	1
32d65116-d649-458c-8532-e8d21fd40422	Blue Cross Blue Shield Association -- So, Blue Cross Blue Shield Association (BCBSA) is like a big group of 36 different health insurance organizations and companies all over the U.S., right? They give health insurance to over 106 million folks. Blue Cross started up in 1929 and switched up to become the Blue Cross Association in 1960. Then, Blue Shield popped up in 1939, and they set up the Blue Shield Association in 1948. Both of these groups came together in 1982.	Is Blue Cross the same as Blue Shield?	1
a77dc4f7-6484-4620-8ebd-778d0a7af5bf	"Monaco, officially called the Principality of Monaco, is a small, independent city-state on the French Riviera in Western Europe. It's bordered by France on three sides and the Mediterranean Sea on the other. Monaco is tiny, covering just 2.02 square kilometers (about 0.78 square miles) and had a population of around 38,400 in 2016. It's the second-smallest and most densely populated country in the world, with about 19,009 people per square kilometer.

The country has a short land border of about 5.47 kilometers (3.40 miles), a coastline of 3.83 kilometers (2.38 miles), and its width varies between 1,700 and 349 meters. The highest point in Monaco is a narrow path called Chemin des Révoires on Mont Agel's slopes, standing at 161 meters (528 feet) above sea level.

The busiest part of Monaco is Monte Carlo, and the most populated area is the Larvotto/Bas Moulins ward. Over the years, Monaco has grown in size by about 20% through land reclamation; back in 2005, it was only 1.974 square kilometers.

Monaco is famous as"	Is Monaco its own country?	1
f1973dc7-10da-4d3d-94d4-3945fc275a48	List of Sons of Anarchy characters -- James O'Phelan (played by Titus Welliver), better known as Jimmy O., is the boss of the Real IRA group who be sellin' guns to SAMCRO. Jimmy O. first shows up in Season 2 to handle the mess after Hayes betrayed SAMCRO, since the Real IRA been relyin' on the Sons of Anarchy's Belfast chapter for a minute. Folks mostly see Jimmy as Chibs Telford's main rival. When the Real IRA catch Jimmy messin' around behind they back, he snatches Jax's son, Abel, plannin' to trade the kid for a safe way back to the US. After a whole lot of searching, SAMCRO figures out the Russians are hiding him. They strike a deal to hand Jimmy over. When Agent Stahl takes Jimmy O from SAMCRO, Chief Unser stops them with a trick, sayin' Jimmy's crew set up a road block ahead. With Stahl's other agents gone, Chibs and some other SAMCRO members roll up in a bus. Chibs yanks Jimmy O out the car and cuts his mouth, just like how Jimmy scarred him back in	do jimmy o get killed in sons of anarchy?	1
59f4bda8-477a-4240-a934-8cef5bcc920a	My Mama and Other Strangers -- My Mama and Other Strangers takes place in 1943 during World War II, in the made-up town of Moybeg, right by the shores of Lough Neagh in Northern Ireland. This show focuses on the Coyne fam and their neighbors as they deal with a whole bunch of American soldiers from the USAAF Eighth Air Force rolling into their small, country spot. The writer, Barry Devlin, who grew up in the little village of Ardboe by Lough Neagh, said he wanted to whip up a unique love story set in a place he knew like the back of his hand.	"Is ""My Mother and Other Strangers"" based on a true story?"	0
66af6ac1-a69a-4a25-b512-72a41523a7ce	Indian Himalayan Region -- Up north, the highest mountain range is the Karakoram Mountains that stretch into Pakistan and China. Right south of them Karakoram Mountains, you got the Zaskar Ranges. Running side by side with the Zaskar, there’s the Pir Panjal Ranges. All three of these mountain ranges line up next to each other in the northwest part of India, with most of the land in the state of Jammu and Kashmir, where Srinagar is the capital.	Pir Panjal be part of dem Trans Himalayas.	1
58868aa3-1840-4364-af97-08b2637159f6	Whistleblower protection in the U.S. -- Back in 1989, they came out with the Whistleblower Protection Act to look out for federal workers who spill the beans on stuff like government illegal activities, wastefulness, and corruption, making sure they don't face bad job consequences. This law is there to protect folks who might get demoted, have their pay cut, or even be replaced just cause they spoke up. It sets up some solid rules to prevent unfair job loss, messed up contract cancellations, and other nasty treatment like demotions or pay cuts. If someone files a complaint 'bout being fired or their contract getting axed unfairly, it's up to the courts to decide if the complaint's legit.	Do the whistleblower protection act only cover folks workin' for the federal government, or it cover everybody?	1
e2f18496-c51d-44d4-85e5-0b73dbe8dcd9	Fairmont Hotels and Resorts -- Fairmont Hotels & Resorts, dat be a luxury hotel chain owned by AccorHotels since 2016. It got started in 2001 when Canadian Pacific Hotels, which been around since the late 1880s, merged with Fairmont Hotels, founded in 1907. Fairmont got 75 spots in 24 different countries, and they real strong in the US and Canada.	Is the Fairmont Hotel part of a chain?	1
0867ab6f-ede1-40fe-b7f8-eaf387d393d0	Visa rules for Canada -- If you tryna go to Canada and you ain't from there, you gotta get a temporary resident visa from a Canadian embassy or consulate unless you got a passport from one of the 51 countries that don’t need one, or you got proof that you live permanently in the U.S.	when you start needin' a passport to hit up Canada?	1
2c0f48e2-bf06-4a4c-9f08-954bfc0bf6e9	Elmer's Products -- Elmer's ain't usin' no animals or animal parts for they glue. They glue products are made from fake stuff and ain't got nothin' to do with horses, cows, or any other animals, or milk.	do Elmer's glue got horse in it?	0
5a07da03-75bf-4512-a9ed-a98b27eba6d7	Stealin' of the Jules Rimet Trophy -- The Jules Rimet Trophy, given to the champs of the football World Cup, got swiped in 1966 before the 1966 FIFA World Cup in England. They found the trophy later, though. One dude, Steve Crook from Bristol, got busted for bein' mixed up in it, but they still ain't sure who else might've been involved.	Has the World Cup eva been stolen befo'?	1
0f5d40d7-da92-485e-86f4-8c75d2aa4acd	"Alright, check it. Every year, you gotta figure out which tax you owe more on: the alternative minimum tax (AMT) or the regular tax, right? So for folks who make a lot of money and manage to lower their taxes throughout the year, they gotta pull together all their taxable income when the year wraps up and report that. Then, they pay what they owe, minus the normal taxes taken out from their paycheck and any deductions they can claim.

Now, depending on how much you make, you might fall into different tax brackets with the AMT. The tax rates start at 0% if you're exempt, then it goes up to 26% or 28%, and if you're really pulling in cash but start losing some exemptions, it could hit you at 32.5% or even 35%.

Just like with the regular income tax, how much tax you pay and what exemptions you get depends on how you file—like single, married, whatever. And if you make a bunch, they start phasing out the lower rate and exemptions, taking away 25% of your AMT income over certain levels. Plus, there’s a lower tax rate for long-term capital gains and some dividends. Clear?"	do alternative minimum tax hit capital gains?	1
3249cc3d-e208-4479-b495-e544905e1bf0	List of the tallest buildings in New York City -- New York City, which holds the title as the most populated city in the U.S., got over 6,486 high rises that stretch at least 35 meters into the sky, and outta those, at least 113 of them towers over 600 feet (183 m). The king of the skyline in New York is One World Trade Center, shooting up to 1,776 feet (541 m). This 104-story giant ain't just the tallest in the city but also tops the charts in the whole U.S., the entire Western Hemisphere, and it ranks as the sixth-tallest worldwide. Following it, the second-highest spot goes to 432 Park Avenue, which stands proud at 1,396 feet (426 m). The bronze goes to the fresh-on-the-scene 30 Hudson Yards. Now, if we ain't counting antennas, sitting at number four is the iconic 102-story Empire State Building in Midtown Manhattan. Finished back in 1931, it reaches up to 1,250 feet (381 m), but with its antenna, it hits 1,454 feet (443 m). It holds down the fifth spot for the tallest in the U.S. and stands as	Is One World Trade Center taller than the Empire State Building?	1
2feffb8c-9589-4953-8551-b74fa46b8410	Creatine kinase -- Creatine kinase (CK), also known as creatine phosphokinase (CPK) or phosphocreatine kinase, is an enzyme (EC 2.7.3.2) expressed by various tissues and cell types. CK catalyzes the conversion of creatine and uses adenosine triphosphate (ATP) to make phosphocreatine (PCr) and adenosine diphosphate (ADP). This CK enzyme reaction can go both ways, so ATP can be made from PCr and ADP.	nan	1
14413732-c1f1-4fe0-b2aa-cd3dcfcdc18a	New Delhi -- Even tho folks often mix up Delhi and New Delhi when they talkin' 'bout the National Capital Territory of Delhi (NCT), these two ain't the same, wit New Delhi jus' bein' a lil part of Delhi. The National Capital Region way bigger, coverin' all of NCT and some areas around it in the neighboring states. New Delhi one of the hundred Indian cities picked to get flipped into a smart city under Prime Minister Narendra Modi's Smart Cities Mission.	nan	0
878b16d0-d4eb-49dc-a020-3afb07f1ed58	Throw-in -- You can't score straight from a throw-in. If you throw the ball straight into your own goal and nobody else touches it, the other team gets a corner kick. Same way, you can't score on the offense directly from a throw-in; that'll just give the defending team a goal kick.	do a goal count if it come from a throw in?	0
b2e0ee36-f7ad-4cb2-bf60-f5c6c990d578	Consequences of the Black Death -- Consequences of the Black Death included a series of religious, social, and economic upheavals, which had profound effects on the course of European history. The Black Death was one of the most devastating pandemics in human history, peaking in Europe between 1347 and 1350 with 30% to 65% of the population killed. It reduced world population from an estimated 450 million to between 350 and 375 million. It took 80 and in some areas more than 150 years for Europe's population to recover.	nan	1
20338710-d271-40e5-86a5-976faad3c781	Tunisia in the FIFA World Cup -- Tunisia done showed up in the FIFA World Cup finals 'bout four times, startin' back in 1978 where they came in ninth. From 1998 to 2006, they made it to the World Cup three times in a row. They finna make their fifth appearance at the 2018 FIFA World Cup in Russia.	Tunisia been in the World Cup before?	1
d16213de-546d-4ad5-bce1-287d47629ce5	Dine Brands Global -- Dine Brands Global Inc, used to be called DineEquity Inc., and even before that, it was known as IHOP Corporation. It's an American company that runs franchises and operates IHOP and Applebee's restaurants. They got their main office in Glendale, California.	Do IHOP and Applebee's got the same owner?	1
24d8c1e6-a88a-40e2-8526-f8993131f60d	Turn on red -- You can make right turns on red in many places across North America. Out West, they been doing this for over 50 years, but the Eastern states didn't start allowing it until the 1970s when there was a big gas shortage. The Energy Policy and Conservation Act of 1975 made it a rule that states needed to let folks turn right on red to get some federal help with their energy-saving plans. Since 1980, all 50 states, plus D.C., Guam, and Puerto Rico been letting drivers turn right on red unless there's a sign that says you can't or if there's a special light just for right turns. (On January 1, 1980, Massachusetts was the last state to jump on board.) But yo, there are a few places like New York City where you can't turn right on red unless there's a sign telling you it's cool.	Can you turn right on red in California?	1
2fe260d3-2dea-4e47-8790-2eba16eab34f	One Flew Over the Cuckoo's Nest (novel) -- One Flew Over the Cuckoo's Nest, a book written by Ken Kesey back in 1962, takes place in an Oregon psychiatric hospital. This story digs into how institutions operate and explores the human psyche, while also throwing shade at behaviorism and bigging up the idea of being your own person. The book got turned into a Broadway play (and later an off-Broadway one) called One Flew Over the Cuckoo's Nest by Dale Wasserman in 1963. Later on, Bo Goldman turned it into a movie in 1975, directed by Miloš Forman, and that film scooped up five Academy Awards.	"Is ""One Flew Over the Cuckoo's Nest"" based on a true story?"	0
792c06c4-f458-4b7f-90b9-3d216359be6e	Induction cooking -- Look, for most of these induction stoves, you gotta have pots or pans made from or got some iron in 'em, like cast iron or certain kinds of stainless steel. The iron helps focus the electricity to get that heat going in the metal. If your pot or pan too thin or ain’t resisting the electric flow right, it ain’t gonna heat up well. Most induction stoves can't heat up copper or aluminum pots 'cause the magnetic field don’t focus the current right; but them “all metal” induction stoves, they use higher frequencies to get past that. You can use any pot though if you put it on a suitable metal disk that works like a regular hotplate.	can stainless steel be used on induction cooktop?	1
14654700-cdd4-4baf-b8c2-819df17ecf31	Pyramidal tracts -- The corticospinal tract, it be carryin' signals from the brain straight down to the spinal cord. It's split into two parts, the lateral and anterior tract. This tract plays a big role in movin' on purpose. Most of the fibers in the corticospinal tract switch sides in the medulla oblongata, which means that the muscles are managed by the opposite side of the brain. Also, inside the corticospinal tract, you find Betz cells, which are the biggest pyramidal cells around and ain't found nowhere else in the body.	The paths that go from the cerebral cortex down to the spinal cord, we call them the corticospinal tracts.	1
e88c1267-2271-4d85-963d-23cd00a089cf	Andrea Gail -- Only found some fuel drums, a fuel tank, the EPIRB, an empty life raft, and some other bits floatin' around. They figured the ship got lost at sea near that continental shelf by Sable Island.	Did they ever find dat boat from The Perfect Storm?	0
5909db6b-5518-4472-b73e-7ac344bef7cc	Thanksgiving, or Thanksgiving Day, be a public holiday we celebrate on the fourth Thursday of November here in the United States. It started out as a harvest festival. Folks been celebrating Thanksgiving nationally on and off since 1789, after Congress asked for a proclamation by George Washington. It's been recognized as a federal holiday every year since 1863, when, amidst the American Civil War, President Abraham Lincoln declared a national day of Thanksgiving and Praise to our beneficent Father who dwelleth in the Heavens, and set it for the last Thursday in November. Along with Christmas and New Year's, Thanksgiving is part of the bigger fall/winter holiday season in the U.S.	do thanksgiving always fall on the last thursday of the month?	1
4c0d7b56-ad4c-4337-b8e0-14a03f071bf4	Britannia (TV series) -- In March 2018, they said that Sky Atlantic done brought it back for a second season.	they finna drop another season of Britannia or what?	1
b872ded7-4801-4b26-b9e9-4097801baff2	Too Close to Home (TV series) -- On November 2, 2017, it got confirmed that they ain't bringin' the show back and it won't get no third season.	they gon' have a season 3 of Too Close to Home or nah?	0
a9add9f1-6ce4-42ca-8327-132531d4c905	Epsom railway station -- Epsom railway station be servin' the town of Epsom in Surrey. It's sittin' off Waterloo Road and less than two minutes' walk from the High Street. It ain't in the London Oyster card zone like Epsom Downs or Tattenham Corner stations. They swapped out the old station building in 2012/2013 for a new one with apartments above the station (check the end of the article).	can you use yo oyster card at epsom station?	0
821fb14b-b8ff-47ea-93b1-f28f5cd1c088	Throwin' hands in ice hockey -- Throwin' hands in ice hockey, it’s like a big ol' part of the game in North America, been around for a minute with all these amateur and pro levels gettin' down and some standout one-on-one brawls too. Mostly, it’s them enforcers or goons—folks on the team whose job is to scrap and scare folks—handling the business. They all follow this deep set of unwritten rules that the players, coaches, the refs, and even the media call the code. Some of these throwdowns just happen outta nowhere, while others, folks plan 'em out ahead of time. Refs kinda let it slide, but they still gonna slap you with some penalties if you out there fightin'.	is it legal to throw hands in ice hockey?	1
1d29ea5b-1e79-455d-a8fd-4a8bb4a8b1a5	"Aight, so check it out -- back in the day, from the late '70s to the early '90s, Marvel Entertainment Group was all about letting movie studios use their comic book characters to make films. They started with Spider-Man in the late '70s, but nothing came out of it 'cause time ran out on the deal. Then, from '86 to '96, they had all these major characters like the Fantastic Four, X-Men, Daredevil, Hulk, Silver Surfer, and Iron Man getting optioned too.

They did manage to drop a Howard the Duck movie in 1986, but that joint flopped hard at the box office. Later in '86, Marvel got bought by New World Entertainment, and they tried to push out more films based on Marvel characters. They got The Punisher out in '89, then the Andrews Group, led by Ronald Perelman, scooped up Marvel. They also dropped a Captain America movie in 1990 over in the UK and sent it straight to video in the U.S., and they made The Fantastic Four in '94, but that one wasn’t even meant to be seen.

Meanwhile, Marvel's competition, DC Comics, was killing it with their Superman and Batman movies, turning"	Do Marvel got the rights to Fantastic Four?	1
4af57123-a316-4647-a0b0-87b9ae639bf0	Sports in St. Louis -- The St. Louis Rams, started back in 1936 in Cleveland, Ohio, clinched the pre-merger NFL Championship two times, once in 1945 and again in 1951. After reppin' Los Angeles from 1946 to 1994, the Rams made their move to St. Louis in 1995. They took down the Tennessee Titans 23--16 to grab the Super Bowl XXXIV title in 1999. The squad also hit up Super Bowl XXXVI in 2001, but they fell short, losing 20--17 to the New England Patriots. The team's old digs in St. Louis (the Edward Jones Dome) could hold 66,965 folks. Then, on January 13, 2016, it came out that NFL owners voted 30--2 to let the Rams' ownership take the team back to Los Angeles for the 2016 season.	St. Louis still got a football team or nah?	0
ac3beee0-cd60-458c-80d7-b2d95e88c5e7	ITV Hub -- ITV Hub got started on Xbox One back on Friday, February 10, 2017. They did this using a new Universal Windows Platform app that works together with Windows 10 and Xbox One. The STV Player app, managed by STV who got the ITV license for Scotland, done hit Xbox 360. The STV Player app got a lot of the same shows as ITV Player and you gotta put in a Scottish postcode before you can use it.	can you get itv hub on xbox 360?	1
842e5691-526f-4cec-93be-43e385dd599c	Married at First Sight (Australian TV series) -- Married at First Sight be a Australian reality TV show based on the Danish program wit' the same name. The show come on at 7:00pm every Sunday and 7:30pm every Monday, Tuesday and Wednesday on the Nine Network. The show got four to eleven couples, matched by three experts, who agree to marry when they first meet. But, unlike other versions of the show around the world, the couples ain't in a legally binding marriage 'cause of legal restrictions, but instead meet as strangers at the altar of a commitment ceremony. The couples spend they wedding night in a hotel, then dip out for a honeymoon. When they get back, they live together for a month, then decide if they gon' keep it pushin' together.	nan	0
e488fabf-65ee-4f13-af83-552844126d40	Speed limits in Germany -- So check it, in Germany, the government sets the speed limits. All them limits go by multiples of 5 km/h. Now, there's two main speed limits you gotta know: inside the city, you gotta roll at 50 km/h (that's like 31 mph), and outside the city, you can push it up to 100 km/h (bout 62 mph). Now, on some parts of the autobahns and a bunch of other highways that feel like freeways, they got limits up to 130 km/h (81 mph) depending on how many wrecks happen, how much traffic there is, and a few other things. But yo, on many country roads, there ain't no set speed limit at all. The German Highway Code, or what they call Straßenverkehrsordnung, starts off talking about speed like this:	Ain't no speed limit on the autobahn, right?	0
58858a18-6217-416b-a6ad-a1b0c6efadf1	2018 FIFA World Cup qualification – UEFA Group D -- The 2018 FIFA World Cup qualification for UEFA Group D was one of the nine UEFA groups for the 2018 FIFA World Cup qualification. This group had six teams in it: Wales, Austria, Serbia, Republic of Ireland, Moldova, and Georgia.	Did Austria make it to the 2018 World Cup?	1
57c67bce-f36d-455f-bcc2-d41d450bca31	Freedom of speech in Canada -- Freedom of speech in Canada protected as a fundamental freedom by Section 2 of the Canadian Charter of Rights and Freedoms.	nan	1
5a1b1d6b-df6b-446e-aaef-32ddb816069a	Empire State Building -- The Empire State Building was holdin' it down as the tallest building in the world for almost 40 years, until they finished buildin' the North Tower of the World Trade Center in Lower Manhattan back in late 1970. After them September 11 attacks in 2001, it became the tallest building in New York again, up until the new One World Trade Center got done in April 2012.	was the Empire State Building the tallest in the world at some point?	1
998239bc-1dca-4a5b-8792-4896d4d2b9d8	Sales taxes in the U.S., right? Look, in Washington, they got a statewide sales tax of 6.50%. Depending on where you at when you buy something, local rates might add up to 3.10%, making it all total up to 9.60%. Plus, they got a bunch of Native American sovereign nations in Washington, so the sales-tax rates might switch up depending on the state treaties with each nation.	Do they got sales tax in Washington state?	1
e405e428-1d1c-4eb6-9f79-3db02cccdefb	Seven (1995 film) -- The main inspiration for the movie's script came from Andrew Kevin Walker's days in New York City while he was tryna make it as a screenwriter. I ain't really like my time in New York, but it's facts that if I hadn't lived there I probably wouldn't have written Seven. He pictured actor William Hurt as Somerset and named the character after his favorite author, W. Somerset Maugham.	"Nah, the movie ""Se7en"" ain't based on no book. It’s an original screenplay written by Andrew Kevin Walker."	0
44c18e29-6451-4ba1-bc1b-96e7c6bbf9e5	Cougar -- The cougar (Puma concolor), also known around as the mountain lion, puma, panther, or catamount, is a big cat from the Felinae family, right? They from all over the Americas. They got the biggest range of any big wild land mammal in the Western Hemisphere, stretching from the Canadian Yukon all the way down to the southern Andes in South America. The cougar can adapt and thrive in most types of American habitats. It's the second biggest cat in the New World, coming in right after the jaguar. These cats are mostly on their own, real secretive, and they mostly move around at night or during twilight, though sometimes they out in the day too. The cougar is more like smaller cats, including the house cat (they in the same subfamily, Felinae), than it is like any of the big cats in the Pantherinae subfamily, where the only American native is the jaguar.	Yeah, pumas, cougars, and mountain lions, is they all the same animal or what?	1
