id	text_a	text_b	label
856692c6-a2d5-454a-84ff-00dad745ef35	Siamese fighting fish -- Males and females flare or puff out their gill covers (opercula) to appear more impressive, either to intimidate other rivals or as an act of courtship. Other reasons for flaring can include when they are intimidated by movement or change of scene in their environments. Both sexes display pale horizontal bars if stressed or frightened. However, such colour changes, common in females of any age, are rare in mature males due to their intensity of colour. Females often flare at other females, especially when setting up a pecking order. Flirting fish behave similarly, with vertical instead of horizontal stripes indicating a willingness and readiness to breed (females only). Betta splendens enjoy a decorated tank, being a territorial fish it is necessary to establish territory even when housed alone. They may set up a territory centered on a plant or rocky alcove, sometimes becoming highly possessive of it and aggressive toward trespassing rivals. This is the reason why when kept with other fish the minimum tank size should be 45 litres (about 10 gallons). Contrary to popular belief, bettas are compatible with many other species of aquarium fish. Given the proper parameters bettas will be known to only be aggressive towards smaller and slower fish than themselves such as guppies.	do betta fish only fight other betta fish	0
c9e83895-0051-4fa7-b590-95375a7f5640	Daylight saving time by country -- Most areas in North America and Europe, and some areas in the Middle East, observe daylight saving time (DST), while most areas of Africa and Asia do not. In South America, most countries in the north of the continent near the equator do not observe DST, while Paraguay and southern parts of Brazil do. The practice of observing daylight saving time in Oceania is also mixed, with New Zealand and parts of southeastern Australia observing DST, while most other areas do not.	is daylight savings time all over the world	0
e486b67f-c90d-49a0-a336-cd7574cdc7dd	Gospel of Mark -- The Gospel According to Mark (Greek: τὸ κατὰ Μᾶρκον εὐαγγέλιον, to kata Markon euangelion), the second book of the New Testament, is one of the four canonical gospels and one of the three synoptic gospels. It tells of the ministry of Jesus from his baptism by John the Baptist to his death and burial and the discovery of the empty tomb -- there is no genealogy of Jesus or birth narrative, nor, in the original ending at chapter 16, any post-resurrection appearances. It portrays Jesus as a heroic man of action, an exorcist, a healer, and a miracle worker. Jesus is also the Son of God, but he keeps his identity secret, concealing it in parables so that even the disciples fail to understand. All this is in keeping with prophecy, which foretold the fate of the messiah as suffering servant. The gospel ends, in its original version, with the discovery of the empty tomb, a promise to meet again in Galilee, and an unheeded instruction to spread the good news of the resurrection.	is the book of mark in the new testament	0
d9e575ff-c0df-4d74-8d06-c511f72636b3	Sky Cinema -- Sky Cinema (formerly Sky Movies) is the collective name for the premium subscription television film channels operated in the United Kingdom and the Republic of Ireland by Sky plc. The UK and Ireland channels have over 5 million subscribers, via satellite, cable and IPTV. In addition to the television channels, it has an interactive 'red button' service, a website (sky.com/movies) and in 2005 launched a 3G mobile service via Vodafone.	is sky movies the same as sky cinema	0
8d230846-0f96-4151-ba2f-aee4e201bd7f	Phone hacking -- Phone hacking, being a form of surveillance, is illegal in many countries unless it is carried out as lawful interception by a government agency. In the News International phone hacking scandal, private investigator Glenn Mulcaire was found to have violated the Regulation of Investigatory Powers Act 2000. He was sentenced to six months in prison in January 2007. Renewed controversy over the phone hacking claims led to the closure of the News of the World in July 2011.	is it illegal to hack into someones phone	0
cc4b0dc0-1840-4755-becf-34cf131a7095	Third Amendment to the United States Constitution -- The Third Amendment (Amendment III) to the United States Constitution places restrictions on the quartering of soldiers in private homes without the owner's consent, forbidding the practice in peacetime. The amendment is a response to Quartering Acts passed by the British parliament during the buildup to the American Revolutionary War, which had allowed the British Army to lodge soldiers in private residences.	the third amendment protects citizens from having to quarter troops without consent	0
8ade0839-6276-4c2c-953d-91c538273021	Washington, D.C. -- The signing of the Residence Act on July 16, 1790, approved the creation of a capital district located along the Potomac River on the country's East Coast. The U.S. Constitution provided for a federal district under the exclusive jurisdiction of the Congress and the District is therefore not a part of any state. The states of Maryland and Virginia each donated land to form the federal district, which included the pre-existing settlements of Georgetown and Alexandria. Named in honor of President George Washington, the City of Washington was founded in 1791 to serve as the new national capital. In 1846, Congress returned the land originally ceded by Virginia; in 1871, it created a single municipal government for the remaining portion of the District.	is washington dc a state in the united states	0
f1f6fdf3-ba96-45ec-acb5-ed319622ff11	Mr. Monk and the End -- ``Mr. Monk and the End'' is the two-part series finale of the USA Network original criminal mystery dramedy television series, Monk. It is the fifteenth and sixteenth episodes of the eighth and final season, and is the 124th and 125th episodes in the series overall. Adrian Monk (Tony Shalhoub) finally discovers his wife Trudy's (Melora Hardin) murderer after twelve years of searching, concluding a seven-year, eight-season long arc. When ``Part 2'' aired, it set a series high and a new viewership record for the most watched episode of a regular drama series ever in basic cable with 9.4 million viewers. Both parts were written by series creator Andy Breckman and directed by Randall Zisk.	did monk ever find out who killed his wife	0
9a0b4ffb-202a-43f5-90ea-23e9219fd4be	Station 19 -- Station 19 is an American action-drama television series created by Stacy McKee for ABC. McKee, Shonda Rhimes, Betsy Beers, and Paris Barclay serve as executive producers on the series, which is the second spin-off to Grey's Anatomy. Set in Seattle, the series focuses on the lives of the men and women at Seattle Fire Station 19. The series is produced by Shondaland and ABC Studios, with McKee serving as showrunner.	is station 19 a grey's anatomy spin off	0
3ad9f414-b3a4-4dab-bef2-407659ff2d60	Sound trademark -- More famously, Harley-Davidson attempted to register as a trademark the distinctive ``chug'' of a Harley-Davidson motorcycle engine. On February 1, 1994, the company filed its application with the following description: ``The mark consists of the exhaust sound of applicant's motorcycles, produced by V-twin, common crankpin motorcycle engines when the goods are in use.'' Nine of Harley-Davidson's competitors filed oppositions against the application, arguing that cruiser-style motorcycles of various brands use the same crankpin V-twin engine which produces the same sound. After six years of litigation, with no end in sight, in early 2000, Harley-Davidson withdrew their application.	does harley davidson have a patent on their sound	0
7259fecd-b641-448f-873e-5a66ae1e88ec	Substrate-level phosphorylation -- Unlike oxidative phosphorylation, oxidation and phosphorylation are not coupled in the process of substrate-level phosphorylation, and reactive intermediates are most often gained in the course of oxidation processes in catabolism. Most ATP is generated by oxidative phosphorylation in aerobic or anaerobic respiration while substrate-level phosphorylation provides a quicker, less efficient source of ATP, independent of external electron acceptors. This is the case in human erythrocytes, which have no mitochondria, and in oxygen-depleted muscle.	can substrate level phosphorylation occur in the absence of oxygen	0
49ee2845-5a89-4064-acef-94966ae171f6	Whistleblower protection in the United States -- The Whistleblower Protection Act of 1989 was enacted to protect federal employees who disclose ``Government illegality, waste, and corruption'' from adverse consequences related to their employment. This act provides protection to whistleblowers that may receive demotions, pay cuts, or a replacement employee. There are certain rules stated in this act that are civil protection standards against voidance of dismissal, voidancce of cancellation of worker dispatch contracts, and disadvantageous treatment (i.e. demotion or a pay cut). The court judges what is considered valid or not for each complaint filed for dismissal or cancellation.	does the whistleblower protection act only apply to federal employees	0
161192bc-d00b-4b6d-a81c-424f9ed4a408	Gun laws in the United States by state -- State level laws vary significantly in their form, content, and level of restriction. Forty-four states have a provision in their state constitutions similar to the Second Amendment to the U.S. Constitution, which protects the right to keep and bear arms. The exceptions are California, Iowa, Maryland, Minnesota, New Jersey, and New York. In New York, however, the statutory civil rights laws contain a provision virtually identical to the Second Amendment. Additionally, the U.S. Supreme Court held in McDonald v. Chicago that the protections of the Second Amendment to keep and bear arms for self-defense in one's home apply against state governments and their political subdivisions.	is it illegal to have a gun in your home	0
74794389-c3dc-42c5-8bd2-d562b7eb8ca7	Saving Private Ryan -- In 1994, Robert Rodat wrote the script for the film. Rodat's script was submitted to producer Mark Gordon, who liked it and in turn passed it along to Spielberg to direct. The film is loosely based on the World War II life stories of the Niland brothers. A shooting date was set for June 27, 1997.	is saving private ryan based on a book	0
9e63e48c-f301-49f7-97a7-1278217f063f	Sherlock (TV series) -- In January 2014, Moffat stated that a fifth series had been plotted by himself and Gatiss; however, by the release of the fourth series in January 2017, they had not yet decided whether to produce it. Cumberbatch and Moffat in particular have expressed interest in continuing at some point in the future, but there are no immediate plans.	is there a new series of sherlock holmes	0
2ae27005-1832-4192-a69b-8f76a7f59abe	Series and parallel circuits -- In a series circuit, the current through each of the components is the same, and the voltage across the circuit is the sum of the voltages across each component. In a parallel circuit, the voltage across each of the components is the same, and the total current is the sum of the currents through each component.	do the individual parallel lines in a parallel circuit have different currents flowing through them	0
67781444-abee-4816-86a5-d50c15195618	Studio Tour -- The Tour is the signature attraction at the park, and goes into a working movie studio, with various film sets on the lot. In recent years, guests have sat in multi-car trams for the duration of the ride. The Tour lasts about 45--60 minutes and is led by a live tour guide who can be seen throughout the tram on video screens. It travels through the Front Lot, Backlot and various attractions, passing sets and props from movies along the way.	do they actually film movies at universal studios	0
d5a67683-06ba-4d5e-8f5e-698636e5c8ac	Magnus Chase and the Gods of Asgard -- Magnus Chase and the Gods of Asgard is a trilogy of fantasy novels written by American author Rick Riordan and published by Disney-Hyperion. It is based on Norse mythology and is set in the same universe as the Camp Half-Blood Chronicles, and The Kane Chronicles series. The first book, The Sword of Summer, was released on October 6, 2015. The second book, The Hammer of Thor, was released on October 4, 2016. The Ship of the Dead, the third and final book, was released on October 3, 2017.	is there a fourth book of magnus chase	0
a2728f7a-810b-4eb3-81b4-b29006dae284	List of The Magic School Bus characters -- Liz is mute, but often does things that one would not expect from a chameleon in real life, such as driving the bus. When she goes to Herp Haven for a brief period her packing list includes claw polish, scale moisturizer and fang-paste. If Ms. Frizzle has to leave the students for a brief period for any reason, or if the class must split up, she leaves Liz in charge, acting as a sort of substitute teacher. In ``In a Pickle'', she is the supposed ``Judge'' in Ms. Frizzle's trial for stealing Keesha's 1st prize cucumber/turning it into a pickle (she wears the wig, and the outfit, and carries the gavel).	is liz from magic school bus a girl	0
7609e8e8-58c5-42fb-9114-89e4e6cfe985	Calcium hydroxide -- Calcium hydroxide (traditionally called slaked lime) is an inorganic compound with the chemical formula Ca(OH). It is a colorless crystal or white powder and is obtained when calcium oxide (called lime or quicklime) is mixed, or slaked with water. It has many names including hydrated lime, caustic lime, builders' lime, slack lime, cal, or pickling lime. Calcium hydroxide is used in many applications, including food preparation. Limewater is the common name for a saturated solution of calcium hydroxide.	is hydrated lime the same as calcium hydroxide	0
5d2f97fd-5134-4a4f-935f-ae0984a95b1f	Air Force One -- The Air Force usually does not have fighter aircraft escort the presidential aircraft over the United States but it has occurred, for example during the attack on the World Trade Center.	does air force one travel with fighter escort	0
68340d36-100c-4862-bc0d-5695cb043558	Chickpea -- The chickpea or chick pea (Cicer arietinum) is a legume of the family Fabaceae, subfamily Faboideae. Its different types are variously known as gram or Bengal gram, garbanzo or garbanzo bean, and Egyptian pea. Its seeds are high in protein. It is one of the earliest cultivated legumes: 7500-year-old remains have been found in the Middle East. In 2016, India produced 64% of the world's total chickpeas.	are garbanzo beans and chick peas the same	0
60553aa6-58c2-46f3-aed1-56ea18e5bfe8	House of Commons of Canada -- Though it does not formally elect the prime minister, the House of Commons indirectly controls the premiership. By convention, the prime minister is answerable to, and must maintain the support of, the House of Commons. Thus, whenever the office of prime minister falls vacant, the governor general has the duty of appointing the person most likely to command the support of the House--normally the leader of the largest party in the lower house, although the system allows a coalition of two or more parties. This has not happened in the Canadian federal parliament, but has occurred in Canadian provinces. The leader of the second-largest party (or in the case of a coalition, the largest party out of government) usually becomes the Leader of the Official Opposition. Moreover, the prime minister is, by unwritten convention, a member of the House of Commons, rather than of the Senate. Only two prime ministers governed from the Senate: Sir John Abbott (1891--1892) and Sir Mackenzie Bowell (1894--1896). Both men got the job following the death of a Prime Minister, and did not contest elections.	does canada's prime minister hold a seat in the house of commons	0
3915ad41-2b3d-4680-8e76-d329fb8a5f30	Martial law -- In the United States, martial law has been used in a limited number of circumstances, such as directly after a foreign attack, such as Hawaii after the Japanese attack on Pearl Harbor or New Orleans during the Battle of New Orleans, after major disasters, such as the Great Chicago Fire of 1871 or the San Francisco earthquake of 1906, by renegade local leaders seeking to avoid arrest, such as Nauvoo, Illinois during the Illinois Mormon War, or Utah during the Utah War, or in response to chaos associated with protests and mob action, such as the 1934 West Coast waterfront strike, or mob actions against the Freedom Riders.	has there ever been martial law in the united states	0
cab295cb-d5ca-4606-b4fb-1b33f8c82f1d	Japan Standard Time -- Japan Standard Time or JST (日本標準時, Nihon Hyōjunji, or 中央標準時 Chūō Hyōjunji) is the standard timezone in Japan, 9 hours ahead of UTC (i.e. it is UTC+09:00). There is no daylight saving time, though its introduction has been debated several times. During World War II, it was often called Tokyo Standard Time.	does all of japan have the same time zone	0
c6eecb19-b262-4c27-aea2-dec6176afaf8	Eddie and the Cruisers -- Eddie and the Cruisers is a 1983 American film directed by Martin Davidson with the screenplay written by the director and Arlene Davidson, based on the novel by P.F. Kluge. A sequel, Eddie and the Cruisers II: Eddie Lives!, followed in 1989.	is eddie and the cruisers a real story	0
58123382-172f-40e3-b88c-30d5aaa03438	Alcohol inhalation -- Alcohol inhalation is a method of administering alcohol (also known formally as ethanol) or alcoholic drinks directly into the respiratory system, with aid of a vaporizing or nebulizing device. It is chiefly applied for recreational use, when it is also referred to as alcohol smoking, but it has medical applications for testing on laboratory rats and treatment of pulmonary edema in humans.	can you inhale alcohol vapors and get drunk	0
840a47a5-fd5d-4022-ba00-ecfddc1a43fc	The Guardian (2006 film) -- The Guardian is a 2006 action-adventure drama film directed by Andrew Davis. The film stars Kevin Costner, Ashton Kutcher and Melissa Sagemiller. The film's title is introduced by a mythic tale: people lost at sea often claim they feel a presence lifting them to the surface, breathing life into their bodies while they are waiting for help to arrive. They call this presence ``The Guardian''. The setting for the film is the United States Coast Guard and their Aviation Survival Technician (AST) program. The Guardian was released on September 29, 2006.	was the movie the guardian based on a true story	0
e1586c23-c0eb-4c8c-8157-c6a1ecf9e583	Italian sausage -- The most common varieties marketed as ``Italian Sausage'' in North American supermarkets are hot(1), sweet(2)(3)(4)(5), and mild(6). The main difference between hot and mild is the addition of hot red pepper flakes in the spice mix of the former. The difference between mild and sweet is the addition of sweet basil in the latter.	is sweet italian sausage the same as mild	0
7888e74b-717b-4805-bb2e-f7c0572d0460	Channel Islands -- The Channel Islands (Norman: Îles d'la Manche; French: Îles Anglo-Normandes or Îles de la Manche) are an archipelago in the English Channel, off the French coast of Normandy. They include two Crown dependencies: the Bailiwick of Jersey, which is the largest of the islands; and the Bailiwick of Guernsey, consisting of Guernsey, Alderney, Sark and some smaller islands. They are considered the remnants of the Duchy of Normandy and, although they are not part of the United Kingdom, the UK is responsible for the defence and international relations of the islands. The Crown dependencies are not members of the Commonwealth of Nations or of the European Union. They have a total population of about 164,541, and the bailiwicks' capitals, Saint Helier and Saint Peter Port, have populations of 33,500 and 16,488, respectively. The total area of the islands is 198 km.	are the channel islands part of the united kingdom	0
a985eb78-4bad-437d-80c5-6f02b941899b	Hermaphrodite -- In biology, a hermaphrodite (/hɜːrˈmæfrədaɪt/) is an organism that has complete or partial reproductive organs and produces gametes normally associated with both male and female sexes. Many taxonomic groups of animals (mostly invertebrates) do not have separate sexes. In these groups, hermaphroditism is a normal condition, enabling a form of sexual reproduction in which either partner can act as the ``female'' or ``male''. For example, the great majority of tunicates, pulmonate snails, opisthobranch snails, earthworms and slugs are hermaphrodites. Hermaphroditism is also found in some fish species and to a lesser degree in other vertebrates. Most plants are also hermaphrodites.	can a person have both female and male parts	0
64d3932f-455e-46e5-a897-70ac3a5321b1	Table (database) -- In terms of the relational model of databases, a table can be considered a convenient representation of a relation, but the two are not strictly equivalent. For instance, an SQL table can potentially contain duplicate rows, whereas a true relation cannot contain duplicate tuples. Similarly, representation as a table implies a particular ordering to the rows and columns, whereas a relation is explicitly unordered. However, the database system does not guarantee any ordering of the rows unless an ORDER BY clause is specified in the SELECT statement that queries the table.	if a table contains a primary key there can be no duplicate records in a table	0
53946e41-daf1-4aed-ae79-e6d8e6a6ce7c	Tandoori masala -- Tandoori masala or Tandoori sauce is a mixture of spices specifically for use with a tandoor, or clay oven, in traditional cooking in the Indian subcontinent. The specific spices vary somewhat from one region to another, but typically include garam masala, garlic, ginger, onion, cayenne pepper, and may include other spices and additives. The spices are often ground together with a pestle and mortar.	is tandoori masala the same as garam masala	0
99c1be15-9e10-4ca2-866f-7e21990f6a21	Sleeping while on duty -- Sleeping while on duty or sleeping on the job refers to falling asleep while on the time clock or equivalent, or else while responsible for performing some active or passive job duty. While in some jobs, this is a minor transgression or not even worthy of sanctioning, in other workplaces, this is considered gross misconduct and may be grounds for disciplinary action, including possible termination of employment. Recently however, there has been a movement in support of sleeping, or napping at work, with scientific studies highlighting health and productivity benefits, and over 6% of employers in some countries providing facilities to do so. In some types of work, such as firefighting or live-in caregiving, sleeping at least part of the shift may be an expected part of paid work time. While some employees who sleep while on duty in violation do so intentionally and hope not to get caught, others intend in good faith to stay awake, and accidentally doze.	can i be sacked for falling asleep at work	0
0b65e247-e996-45cb-8674-9761c703e6ca	Broadway Junction (New York City Subway) -- Broadway Junction is a New York City Subway station complex shared by the elevated BMT Canarsie Line and BMT Jamaica Line, and the underground IND Fulton Street Line. It was also served by trains of the Fulton Street Elevated until that line closed in 1956. It is located roughly at the intersection of Broadway, Fulton Street and Van Sinderen Avenue at the border of Bedford-Stuyvesant and East New York, Brooklyn. The complex is served by the A, J, and L trains at all times; the C train at all times except late nights; and the Z train during rush hours in the peak direction only.	does the m train go to broadway junction	0
3b05c4cd-5681-46f8-9849-d38a821b9c84	Prime Minister of the United Kingdom -- The office is not established by any statute or constitutional document but exists only by long-established convention, which stipulates that the monarch must appoint as Prime Minister the person most likely to command the confidence of the House of Commons; this individual is typically the leader of the political party or coalition of parties that holds the largest number of seats in that chamber. The position of Prime Minister was not created; it evolved slowly and erratically over three hundred years due to numerous acts of Parliament, political developments, and accidents of history. The office is therefore best understood from a historical perspective. The origins of the position are found in constitutional changes that occurred during the Revolutionary Settlement (1688--1720) and the resulting shift of political power from the Sovereign to Parliament. Although the Sovereign was not stripped of the ancient prerogative powers and legally remained the head of government, politically it gradually became necessary for him or her to govern through a Prime Minister who could command a majority in Parliament.	does prime minister have to be an mp	0
aba92a67-ad1e-4175-a723-274f507e96b3	Lincoln Burrows -- Lincoln Burrows, played by Dominic Purcell, is a fictional character and one of the two protagonists of the American television series Prison Break. The plot of Prison Break revolves around Lincoln Burrows' setup for the murder of the vice president's brother and his brother's plan to help him escape his death sentence. Lincoln's brother, Michael Scofield is portrayed by Wentworth Miller. In episode flashbacks, the teenage Lincoln is played by Max Kirsch, while a younger Michael is portrayed by Dylan Minnette. Lincoln Burrows was born on March 17, 1970.	are michael and lincoln brothers in real life	0
