id	text_a	text_b	label
0934d05e-d546-41af-bb2f-f3166a03ff2e	List of How I Met Your Mother characters -- Ted has dated many people and been in several long-term relationships. Ted has an on-again, off-again relationship with Robin. Ted also dated Victoria, Stella, Zoey and Jeanette. Ted finally gets to meet his wife-to-be, Tracy, on the day of Barney and Robin's wedding, after accidentally teaching one of her college classes, owning her yellow umbrella for a short time, and dating her roommate. When he ran into Tracy's roommate (Cindy), it led to Tracy's band performing at Barney and Robin's wedding.	is stella the mother on how i met your mother	0
d0832ce0-5223-40ab-9e40-c6ba22dbb7fb	Iron Fist (season 2) -- The season was released on September 7, 2018, and consists of ten episodes. The season received mixed reviews from critics, but was considered a major improvement over the previous season. Netflix canceled the series on October 12, 2018.	is there a second season of iron fist	0
ba0546c3-6448-4706-9f0f-e66143aa28cb	My Generation -- Another salient aspect of ``My Generation'' is Daltrey's delivery: an angry and frustrated stutter. Various stories exist as to the reason for this distinct delivery. One is that the song began as a slow talking blues number without the stutter (in the 1970s it was sometimes performed as such, but with the stutter, as ``My Generation Blues''), but after being inspired by John Lee Hooker's ``Stuttering Blues,'' Townshend reworked the song into its present form. Another reason is that it was suggested to Daltrey that he stutter to sound like a British mod on speed. It is also proposed, albeit less frequently, that the stutter was introduced to give the group a framework for implying an expletive in the lyrics: ``Why don't you all fff... fade away!'' However, producer Shel Talmy insisted it was simply ``one of those happy accidents'' that he thought they should keep. Roger Daltrey has also commented that he had not rehearsed the song prior to the recording, was nervous, and he was unable to hear his own voice through the monitors. The stutter came about as he tried to fit the lyrics to the music as best he could, and the band decided it worked well enough to keep. The BBC initially refused to play ``My Generation'' because it did not want to offend people who stutter, but it reversed its decision after the song became more popular.	did the lead singer of the who have a stutter	0
c134ff2f-933f-40fe-b8ef-c14c86c57b10	Jarvis Christian College -- Jarvis Christian College (JCC) is an independent four year, historically black college located in unincorporated Wood County, Texas, and affiliated with the Disciples of Christ. Founded in 1912, the institution is currently headed by President Dr. Lester C. Newman.	is jarvis christian college a 4 year school	0
c46daa61-5f70-4343-8bea-180cb3562a81	Dead ball -- In baseball, when the ball is dead, no runners may advance beyond the respective bases they are entitled to, and no runners may be put out. The ball becomes dead when:	can a runner advance on a dead ball in baseball	0
cac0135e-8d02-4ab0-a475-3b5d094c1125	The Handmaid's Tale (TV series) -- The Handmaid's Tale is an American dystopian drama web television series created by Bruce Miller, based on the 1985 novel of the same name by Margaret Atwood. It was ordered by the streaming service Hulu as a straight-to-series order of 10 episodes, for which production began in late 2016. The plot features a dystopian future following a Second American Civil War wherein a totalitarian society subjects fertile women, called ``Handmaids'', into child-bearing servitude.	is the handmaid's tale a hulu original	0
a2e67471-a14a-404e-8a72-37c6de4a920b	Canada–United States relations -- Canada--United States relations refers to the bilateral relations between Canada and the United States of America. Relations between Canada and the United States of America historically have been extensive, given a shared border and ever-increasing close cultural, economical ties and similarities. The shared historical and cultural heritage has resulted in one of the most stable and mutually beneficial international relationships in the world. For both countries, the level of trade with the other is at the top of the annual combined import-export total. Tourism and migration between the two nations have increased rapport, but border security was heightened after the terrorist attacks in the United States on September 11, 2001. The U.S. is approximately 9.25 times larger in population and has the dominant cultural and economic influence. Starting with the American Revolution, when anti-American Loyalists fled to Canada, a vocal element in Canada has warned against US dominance or annexation. The War of 1812 saw invasions across the border. In 1815, the war ended with the border unchanged and demilitarized, as were the Great Lakes. The British ceased aiding First Nation attacks on American territory, and the United States never again attempted to invade Canada. Apart from minor raids, it has remained peaceful.	is canada in the united states of america	0
d36d346a-324c-4386-8931-32f916e73260	Equus (genus) -- Equus is a genus of mammals in the family Equidae, which includes horses, donkeys, and zebras. Within Equidae, Equus is the only recognized extant genus, comprising seven living species. The term equine refers to any member of this genus, including horses. Like Equidae more broadly, Equus has numerous extinct species known only from fossils. The genus most likely originated in North America and spread quickly to the Old World. Equines are odd-toed ungulates with slender legs, long heads, relatively long necks, manes (erect in most subspecies), and long tails. All species are herbivorous, and mostly grazers, with simpler digestive systems than ruminants, but able to subsist on lower-quality vegetation.	are horses donkeys and zebras the same species	0
574f7ad7-715d-4adf-919e-45b98f0bf6f3	Gulf of California -- The Gulf of California (also known as the Sea of Cortez, Sea of Cortés or Vermilion Sea; locally known in the Spanish language as Mar de Cortés or Mar Bermejo or Golfo de California) is a marginal sea of the Pacific Ocean that separates the Baja California Peninsula from the Mexican mainland. It is bordered by the states of Baja California, Baja California Sur, Sonora, and Sinaloa with a coastline of approximately 4,000 km (2,500 mi). Rivers which flow into the Gulf of California include the Colorado, Fuerte, Mayo, Sinaloa, Sonora, and the Yaqui. The gulf's surface area is about 160,000 km (62,000 sq mi). Depth soundings in the gulf have ranged from fording depth at the estuary near Yuma, Arizona, to in excess of 3,000 meters (9,800 ft) in the deepest parts.	is the gulf of california the same as the sea of cortez	0
2743cd86-c8cc-4b7e-9604-ac883344ef4f	Back-pass rule -- While not an infringement of the back-pass rule, players are also prohibited from using a deliberate trick to pass the ball to the goalkeeper with a part of the body other than the foot to circumvent the rule. This would include, but not be limited to:	can you knee a ball back to the goalkeeper	0
bf50a6e4-9d34-41a4-b036-195541864ad1	Sibling-in-law -- One's sibling-in-law is one's spouse's sibling, or one's sibling's spouse. By gender, this is specified as brother-in-law for one's spouse's brother, one's sibling's husband, or one's spouse's sibling's husband, and sister-in-law for the one's spouse's sister, one's sibling's wife, or one's spouse's sibling's wife.	is my brothers wife my husbands sister in law	0
f9ada838-d2ad-437b-863c-e66f608487aa	Channel Islands -- Since 1969, Jersey and Guernsey have operated postal administrations independently of the UK's Royal Mail, with their own postage stamps, which can be used for postage only in their respective Bailiwicks. UK stamps are no longer valid, but mail to the islands, and to the Isle of Man, is charged at UK inland rates. It was not until the early 1990s that the islands joined the UK's postcode system, Jersey postcodes using the initials JE and Guernsey GY.	is jersey part of the uk royal mail	0
b5ed8e36-fa3e-45bc-96ce-59d36c70498e	Snow White and the Seven Dwarfs (1937 film) -- The primary authority on the design of the film was concept artist Albert Hurter. All designs used in the film, from characters' appearances to the look of the rocks in the background, had to meet Hurter's approval before being finalized. Two other concept artists -- Ferdinand Hovarth and Gustaf Tenggren -- also contributed to the visual style of Snow White and the Seven Dwarfs. Hovarth developed a number of dark concepts for the film, although many other designs he developed were ultimately rejected by the Disney team as less easily translated into animation than Hurter's. Tenggren was used as a color stylist and to determine the staging and atmosphere of many of the scenes in the film, as his style borrowed from the likes of Arthur Rackham and John Bauer and thus possessed the European illustration quality that Walt Disney sought. He also designed the posters for the film and illustrated the press book. However, Hovarth didn't receive a credit for the film. Other artists to work on the film included Joe Grant, whose most significant contribution was the design for the Queen's Witch form.	was snow white in color when it first came out	0
423a56ca-e7fd-45e2-a60a-9853e4f8f34d	Medal of Honor -- The Medal of Honor is the United States of America's highest and most prestigious personal military decoration that may be awarded to recognize U.S. military service members who distinguished themselves by acts of valor. The medal is normally awarded by the President of the United States in the name of the U.S. Congress. Because the medal is presented ``in the name of Congress'', it is often referred to informally as the ``Congressional Medal of Honor''. However, the official name of the current award is ``Medal of Honor'', as it began with the U.S. Army's version. Within United States Code the medal is referred to as the ``Medal of Honor'', and less frequently as ``Congressional Medal of Honor''. U.S. awards, including the Medal of Honor, do not have post-nominal titles, and while there is no official abbreviation, the most common abbreviations are ``MOH'' and ``MH''.	is the medal of honor the highest honor	0
542b98e4-51a1-4e8f-8416-e11824f6d9d5	The Other Boleyn Girl -- The Other Boleyn Girl (2001) is a historical novel written by British author Philippa Gregory, loosely based on the life of 16th-century aristocrat Mary Boleyn (the sister of Anne Boleyn) of whom little is known. Inspired by Mary's life story, Gregory depicts the annulment of one of the most significant royal marriages in English history (that of King Henry VIII and Catherine of Aragon) and conveys the urgency of the need for a male heir to the throne. Much of the history is highly distorted in her account.	the other boleyn girl is it based on a true story	0
797e3283-c618-4105-ae44-776a0c826230	List of royal yachts of the United Kingdom -- This is a list of royal yachts of the United Kingdom. There have been 84 royal yachts since the restoration of the monarchy in 1660. King Charles II had 25 royal yachts and five were simultaneously in service in 1831. Occasionally merchantmen or warships have been chartered or assigned for special duty as a temporary royal yacht, for example the steamship Ophir in 1901 and the battleship HMS Vanguard in 1947. In 1997 HMY Britannia was decommissioned and not replaced. Since 1998, following a successful national tender process, the Royal Yacht Britannia has been berthed permanently at the Port of Leith in Edinburgh. There are currently no British royal yachts, although MV Hebridean Princess has been used by the Royal Family.	does the british royal family have a yacht	0
c0807b38-b64b-4a89-ade3-e3741d0e5c39	Incredibles 2 -- The soundtrack album was released on June 15, 2018. In addition to the film's score, it includes the vocalized theme songs for Mr. Incredible, Frozone, and Elastigirl heard in the credits, as well as bonus versions of the songs sung by Disney's a cappella group, DCappella, and the latter's version of the track ``The Glory Days'' from the first film.	is there ending credits for the incredibles 2	0
a6e1325b-7fb3-4f24-9d59-c027773975f7	Wheat flour -- In terms of the parts of the grain (the grass fruit) used in flour--the endosperm or protein/starchy part, the germ or protein/fat/vitamin-rich part, and the bran or fiber part--there are three general types of flour. White flour is made from the endosperm only. Brown flour includes some of the grain's germ and bran, while whole grain or wholemeal flour is made from the entire grain, including the bran, endosperm, and germ. Germ flour is made from the endosperm and germ, excluding the bran.	is wheat flour and white flour the same thing	0
c30849fd-d9b8-4c19-bc90-fe5b3929c27a	Capital gains tax in the United States -- In the United States of America, individuals and corporations pay U.S. federal income tax on the net total of all their capital gains. The tax rate depends on both the investor's tax bracket and the amount of time the investment was held. Short-term capital gains are taxed at the investor's ordinary income tax rate and are defined as investments held for a year or less before being sold. Long-term capital gains, on dispositions of assets held for more than one year, are taxed at a lower rate.	are long term capital gains taxed at a lower rate	0
8cca938d-7303-473c-88b6-9a1190750a1d	1966 FIFA World Cup -- 1966 was a World Cup with few goals as the teams began to play much more tactically and defensively. This was exemplified by Alf Ramsey's England as they finished top of Group 1 with only four goals, but having none scored against them. They also became the first World Cup winning team not to win its first game in the tournament. Uruguay were the other team to qualify from that group at the expense of both Mexico and France. All the group's matches were played at Wembley Stadium apart from the match between Uruguay and France which took place at White City Stadium.	did england lose a game in the 1966 world cup	0
7ad39587-7f64-464f-b434-e92c51151de2	Inside-the-park home run -- In baseball, an inside-the-park home run is a play where a batter hits a home run without hitting the ball out of the field of play. It is also known as an ``in-the-park home run'' or ``in the park homer''.	does an inside the park home run count as a home runs	0
c6293f5b-0de6-4f82-b505-fb68e8ec9eaf	Social Security number -- The Social Security number is a nine-digit number in the format ``AAA-GG-SSSS''. The number is divided into three parts: the first three digits, known as the area number because they were formerly assigned by geographical region; the middle two digits, known as the group number; and the final four digits, known as the serial number.	can a social security number have 8 digits	0
dfe14b00-d09d-4510-a87c-209260211752	Everything, Everything (novel) -- The two go to Hawaii, explore the country and just be blissful for a day. The next day, Maddy has to be taken to a hospital because she begins to feel extremely sick. Her heart stops, but only for a moment.	did they actually go to hawaii in everything everything	0
de1fec82-4af2-4a84-b6ee-38054b8a2357	Second city of the United Kingdom -- Birmingham has generally been regarded as the second city of the United Kingdom in terms of populace and GDP while Edinburgh has been promoted as the second city by virtue as the capital of Scotland. Less authoratitive claims have been made on behalf of Cardiff and Belfast due to their status as the respective capital cities of Wales and Northern Ireland. Furthermore, a number of opinion polls have been conducted since 2000 and complicate the issue further, with public response showing a consistent view amongst the British population that Manchester is the second city. It should be noted that Birmingham is technically the United Kingdom's most populous city; the City of London has fewer than 10,000 inhabitants, and Greater London is not recognized as a city.	is birmingham the 2nd largest city in uk	0
5ff79ca5-fa07-4ce9-b758-8e9e4392e486	Berry -- The scientific usage of the term ``berry'' differs from common usage. In scientific terminology, a berry is a fruit produced from the ovary of a single flower in which the outer layer of the ovary wall develops into an edible fleshy portion (pericarp). The definition includes many fruits that are not commonly known as berries, such as grapes, tomatoes, cucumbers, eggplants, bananas, and chili peppers. Fruits excluded by the botanical definition include strawberries, raspberries, and blackberries, which are aggregate fruits; and mulberries, which are multiple fruits. A plant bearing berries is said to be bacciferous or baccate.	is a banana part of the berry family	0
d7ff991e-7a62-4bf7-9bc6-66fae2252069	Implications of Puerto Rico's current political status -- Constitutionally, Puerto Rico is subject to the Congress' plenary powers under the territorial clause of Article IV, sec. 3, of the U.S. Constitution. U.S. federal law applies to Puerto Rico, even though Puerto Rico is not a state of the American Union and their residents have no voting representation in the U.S. Congress. Because of the establishment of the Federal Relations Act of 1950, all federal laws that are ``not locally inapplicable'' are automatically the law of the land in Puerto Rico. Following the 1950 and 1952 legislation, only two district court decisions have held that a particular federal law, which does not specifically exclude or treat Puerto Rico differently, is inapplicable to Puerto Rico. The more recent decision was vacated on appeal. Efrén Rivera Ramos, Dean and Professor of Law at the University of Puerto Rico School of Law, clarified the meaning of plenary powers, explaining, ``The government of a state derives its powers from the people of the state, whereas the government of a territory owes its existence wholly to the United States. The Court thus seems to equate plenary power to exclusive power. The U.S. government could exert over the territory power that it could not exercise over the states.'' Ramos quotes Justice Harlan, writing in Grafton v. United States, 206 U.S. 333 (1907), ``The jurisdiction and authority of the United States over that territory (referring to the Philippines) and its inhabitants, for all legitimate purposes of government is paramount,''. Ramos then goes on to argue ``This power, however, is not absolute, for it is restrained by some then-undefined fundamental rights possessed by anyone subject to the authority of the U.S. government.''	does puerto rico have to follow us laws	0
a7433ff0-be44-40f4-b946-f5f238695d94	Vinegar -- The term ``distilled vinegar'' as used in the United States (called ``spirit vinegar'' in the UK, ``white vinegar'' in Canada) is something of a misnomer because it is not produced by distillation but by fermentation of distilled alcohol. The fermentate is diluted to produce a colorless solution of 5% to 8% acetic acid in water, with a pH of about 2.6. This is variously known as distilled spirit, ``virgin'' vinegar, or white vinegar, and is used in cooking, baking, meat preservation, and pickling, as well as for medicinal, laboratory, and cleaning purposes. The most common starting material in some regions, because of its low cost, is malt, or in the United States, corn. It is sometimes derived from petroleum. Distilled vinegar in the UK is produced by the distillation of malt to give a clear vinegar which maintains some of the malt flavour. Distilled vinegar is used predominantly for cooking, although in Scotland it is used as an alternative to brown or light malt vinegar. White distilled vinegar can also be used for cleaning, and some is actually sold specifically for this purpose.	is distilled vinegar the same as white vinegar for cooking	0
1a3c1be8-b221-4ed5-8e4d-6307263aaff5	Father's Day -- Father's Day is a celebration honoring fathers and celebrating fatherhood, paternal bonds, and the influence of fathers in society. In Catholic Europe, it has been celebrated on March 19 (St. Joseph's Day) since the Middle Ages. This celebration was brought by the Spanish and Portuguese to Latin America, where March 19 is often still used for it, though many countries in Europe and the Americas have adopted the U.S. date, which is the third Sunday of June. It is celebrated on various days in many parts of the world, most commonly in the months of March, April and June. It complements similar celebrations honoring family members, such as Mother's Day, Siblings Day, and Grandparents' Day.	is father's day always on the same day	0
5ea9c833-ceba-4df4-8dc7-75d12c833f3d	Waiter Rule -- The Waiter Rule refers to a common belief that one's true character can be gleaned from how one treats staff or service workers, such as a ``waiter''. The rule was one of William H Swanson's 33 Unwritten Rules of Management, copied from Dave Barry's version ``If someone is nice to you but rude to the waiter, they are not a nice person.''	you can tell a lot about a person by how they treat their waiter	0
e6454454-1c80-4b52-a854-ddbed3f7847b	Soul Surfer (film) -- Soul Surfer is a 2011 American biographical drama film directed by Sean McNamara, based on the 2004 autobiography Soul Surfer: A True Story of Faith, Family, and Fighting to Get Back on the Board by Bethany Hamilton about her life as a surfer after a horrific shark attack and her recovery. The film stars AnnaSophia Robb, Helen Hunt, Dennis Quaid, and Lorraine Nicholson with Carrie Underwood, Kevin Sorbo, Sonya Balmores, Branscombe Richmond, and Craig T. Nelson.	is carrie underwood in the movie soul surfer	0
126bce82-5cc7-4720-9c7b-ed511af0e455	Cooking apple -- It is often believed that eating cooking apples raw will make a person sick. In reality cooking apples are harmless raw and are just varieties of apples whose characteristics are well suited to cooking. This myth is simply a product of cooking apples' tart taste and the possibility of it not sitting well in the stomach.	is it ok to eat cooking apples raw	0
a5432833-055a-4c54-b03e-6066f05e2534	Diary of a Wimpy Kid -- Diary of a Wimpy Kid is a satirical realistic fiction comedy novel for children and teenagers written and illustrated by Jeff Kinney. It is the first book in the Diary of a Wimpy Kid series. The book is about a boy named Greg Heffley and his struggles to fit in as he begins middle school.	is diary of a wimpy kid realistic fiction	0
d938d300-042d-425d-95b5-792aa01e802e	Warning (traffic stop) -- When a traffic stop is made, a warning issued by the officer is a statement that the motorist has committed some offense, but is being spared the actual citation. Officers use their own discretion whether to issue a citation or warning. The motorist may receive the warning either verbally or written, but will not be charged with the offense, will not have to pay a fine, and will not receive any points. Depending on the laws of the jurisdiction, the warning may or may not appear on records visible to officers, which, if it does, could result in another stop within a fixed period of time leading to an actual citation, or in some cases, the motorist may be charged with both offenses.	do you have to pay for a warning ticket	0
87cc4450-57f1-4afb-b884-830ebc58a85d	New Jersey Plan -- The New Jersey Plan (also known as the Small State Plan or the Paterson Plan) was a proposal for the structure of the United States Government presented by William Paterson at the Constitutional Convention on June 15, 1787. The plan was created in response to the Virginia Plan, which called for two houses of Congress, both elected with apportionment according to population. The less populous states were adamantly opposed to giving most of the control of the national government to the more populous states, and so proposed an alternative plan that would have kept the one-vote-per-state representation under one legislative body from the Articles of Confederation. The New Jersey Plan was opposed by James Madison and Edmund Randolph (the proponents of the Virginia state Plan).	did the new jersey plan suggest only one house of congress	0
c3e05f1a-3be5-4564-9cbb-5335de617a9d	Sraosha -- In Zoroastrian tradition, Sraosha is one of the three guardians of the Chinvat bridge, the ``bridge of judgement'' that all souls of the dead must cross. Although Sraosha is only one of the three divinities that pass judgement (the other two being Rashnu and Mithra), Sraosha alone accompanies the soul on their journey across the bridge.	according to zoroastrianism one of the gods who presides over your judgement is sroasha	0
7a8653d6-4a7d-4a1c-81d7-c4c837feb87c	Flag of New Zealand -- The New Zealand flag was the first national flag to incorporate the stars of the Southern Cross constellation, and remains distinctive as the only national flag that includes only those stars from the constellation that actually form the cross itself. The Australian flag adopted in 1901 also has the Union Flag in the canton and the Southern Cross on the fly. The cross on the New Zealand flag is composed of the four prime stars of the Southern Cross constellation, each being a red five pointed star with a white outline. The Australian flag has six white stars, five of which have seven points (the Commonwealth Star) and a five pointed star, Epsilon Crucis, the smaller star of the Southern Cross constellation which does not form part of the actual cross itself is also included. Australia's flag features a large Commonwealth Star below the Union Flag as it is a symbol of Australia.	do new zealand and australia have the same flag	0
