id	text_a	text_b	label
93e618a1-041b-45fe-b228-93f6dae48467	Married at First Sight (Australian TV series) -- Married at First Sight is an Australian reality television series based on the Danish program of the same name. The show is premiered 7:00pm every Sunday and 7:30pm every Monday, Tuesday and Wednesday on the Nine Network. The show features four to eleven couples, matched by three experts, who agree to marry when they first meet. However, unlike other versions of the show around the world, the couples do not partake in a legally binding marriage due to legal restrictions, but instead meet as strangers at the altar of a commitment ceremony. The couples spend their wedding night in a hotel, then leave for a honeymoon. Upon returning they live together for a month, whereafter they choose whether they will continue their relationship.	is married at first sight a legal marriage	0
e0c3495a-781e-4e31-a89c-e34f4168096a	A Song of Ice and Fire -- A Song of Ice and Fire is a series of epic fantasy novels by the American novelist and screenwriter George R.R. Martin. He began the first volume of the series, A Game of Thrones, in 1991, and it was published in 1996. Martin, who initially envisioned the series as a trilogy, has published five out of a planned seven volumes. The fifth and most recent volume of the series published in 2011, A Dance with Dragons, took Martin six years to write. He is still writing the sixth novel, The Winds of Winter.	is the game of thrones book series over	0
8ff782e6-5843-4cbc-80a2-6ff5b50ef31c	Batman (1989 film) -- Batman is a 1989 American superhero film directed by Tim Burton and produced by Jon Peters and Peter Guber, based on the DC Comics character of the same name. It is the first installment of Warner Bros.' initial Batman film series. The film stars Michael Keaton as Bruce Wayne/Batman and Jack Nicholson as the Joker, alongside Kim Basinger, Robert Wuhl, Pat Hingle, Billy Dee Williams, Michael Gough and Jack Palance. The film takes place early in the title character's war on crime, and depicts a battle with his nemesis the Joker.	did dennis quaid play the joker in batman	0
d712dd30-c05e-4ff1-90dc-8eb0b50d0604	President of the Philippines -- Filipinos refer to their President as Pangulo or Presidente. The President serves a single, fixed, six-year term without possibility of re-election. On June 30, 2016, Rodrigo Duterte was sworn in as the 16th and current president.	can the president of the philippines be re elected	0
dcbdefa2-7146-433b-a850-b8e2bc9ede99	Pump and dump -- ``Pump and dump'' (P&D) is a form of securities fraud that involves artificially inflating the price of an owned stock through false and misleading positive statements, in order to sell the cheaply purchased stock at a higher price. Once the operators of the scheme ``dump'' sell their overvalued shares, the price falls and investors lose their money. This is most common with small cap cryptocurrencies and very small corporations, i.e. ``microcaps''. See Microcap stock fraud.	is it illegal to pump and dump stocks	0
90b15077-2cd0-4f9b-b3a4-4a45ea166e7f	Grand Union Canal -- The Grand Union Canal in England is part of the British canal system. Its main line starts in London and ends in Birmingham, stretching for 137 miles (220 km) with 166 locks. It has arms to places including Leicester, Slough, Aylesbury, Wendover and Northampton.	is there a canal from birmingham to london	0
1ff2a9de-4c14-4629-bfcb-d85be81fd6bb	Texas Highway Patrol -- Troopers' headwear is unique in that instead of the peaked caps or campaign hats popular with other agencies, cowboy hats are worn with the duty uniform. Felt hats are worn in colder weather and straw hats are worn in warmer weather. Dress uniforms are similar to the patrol uniform, with the addition of a blue tie, long-sleeved shirt and black cowboy boots. Dress for various ceremonial units adds white gloves, a white ascot, a black Sam Browne shoulder strap and a red shoulder cord.	do texas state troopers have to wear hats	0
40d66f0e-37d4-40c0-b9d2-27dce8f21c8d	The Punisher (season 2) -- The second season of the American web television series The Punisher, which is based on the Marvel Comics character of the same name, revolves around Frank Castle ruthlessly hunting down criminals. It is set in the Marvel Cinematic Universe (MCU), sharing continuity with the films and other television series of the franchise. The season is produced by Marvel Television in association with ABC Studios and Bohemian Risk Productions, with Steven Lightfoot serving as showrunner.	is there a season 2 for the punisher	0
63bf652e-d4e0-4313-a6b5-726289eb17aa	Family Feud -- From 1999 to 2002, two new families appeared on each episode. The returning champions rule was reinstated with the same five-day limit starting with the 2002--03 season. Starting with the 2009--10 season, a family that wins five matches also wins a new car.	does each person win a car on family feud	0
0475e2ef-2569-4a28-8362-cdd15a5a5da1	Vanilla sugar -- Vanilla sugar is made of sugar and vanilla beans or sugar mixed with vanilla extract.	is vanilla sugar the same as regular sugar	0
39b6f577-bd8b-40cd-a882-be9eeba3273a	Double jeopardy -- Double jeopardy is a procedural defence that prevents an accused person from being tried again on the same (or similar) charges and on the same facts, following a valid acquittal or conviction. As described by the U.S. Supreme Court in its unanimous decision one of its earliest cases dealing with double jeopardy, ``the prohibition is not against being twice punished, but against being twice put in jeopardy; and the accused, whether convicted or acquitted, is equally put in jeopardy at the first trial.''	can you go to court for the same thing twice	0
02e019c0-331a-4ef8-9fd6-174ba54d933d	John Wick: Chapter 2 -- John Wick: Chapter 2 is a 2017 American neo-noir action thriller film directed by Chad Stahelski and written by Derek Kolstad. The second installment in the John Wick film series, the plot follows hitman John Wick, who goes on the run after a bounty is placed on him. It stars Keanu Reeves, Common, Laurence Fishburne, Riccardo Scamarcio, Ruby Rose, John Leguizamo and Ian McShane, and marks the first collaboration between Reeves and Fishburne since appearing together in The Matrix trilogy.	is there more than one john wick movie	0
de190604-74b0-4294-b12d-f2e18cdcd8cb	Alcohol laws of New Jersey -- In addition to granting local governments wide latitude over liquor sales, New Jersey law has some other unusual features. Corporations are limited to two retail distribution licenses, making it impractical for chain stores to sell alcoholic beverages; this restriction, in conjunction with municipal ordinances, severely limits supermarket and convenience store chains from selling beer as they do in many other states. State law treats drunk driving as a traffic offense rather than a crime, and permits individual municipalities to define the scope of underage drinking laws.	do they sell beer in grocery stores in new jersey	0
0eae8aaf-10a4-4e2a-85be-121b3890dc96	Home run -- A home run accomplished in any of the above manners is an automatic home run. The ball is dead, even if it rebounds back onto the field (e.g., from striking a foul pole), and the batter and any preceding runners cannot be put out at any time while running the bases. However, if one or more runners fail to touch a base or one runner passes another before reaching home plate, that runner or runners can be called out on appeal, though in the case of not touching a base a runner can go back and touch it if doing so won't cause them to be passed by another preceding runner and they have not yet touched the next base (or home plate in the case of missing third base). This stipulation is in Approved Ruling (2) of Rule 7.10(b).	do you have to touch the bases on a home run	0
64d8892e-2dc2-4d40-af21-31e9fd151953	Methodist Church of Great Britain -- Following Wesley's death, the Methodist revival became a separate church and ordained its own ministers; it is called a nonconformist church because it does not conform to the rules of the established Church of England. In the 19th century, the Wesleyan Methodist Church experienced many secessions, with the largest of the offshoots being the Primitive Methodists. The main streams of Methodism were reunited in 1932, forming the Methodist Church as it is today.	is methodist the same as church of england	0
65cd67c7-0639-474c-992a-551bc000e995	Post-Soviet states -- The post-Soviet states, also collectively known as the former Soviet Union (FSU) or former Soviet Republics, are the states that emerged and re-emerged from the Union of Soviet Socialist Republics in its breakup in 1991, with Russia internationally recognised as the successor state to the Soviet Union after the Cold War. The three Baltic states were the first to declare their independence, between March and May 1990, claiming continuity from the original states that existed prior to their annexation by the Soviet Union in 1940. The remaining 12 republics all subsequently seceded. 12 of the 15 states, excluding the Baltic states, initially formed the CIS and most joined CSTO, while the Baltic states focused on European Union and NATO membership.	the former soviet union broke into separate states	0
18818d8a-8f19-439a-bc6e-bae6cb6cac8b	Project Runway: Junior -- In May 2016, Lifetime renewed Project Runway: Junior for a second and third season in a deal with The Weinstein Company.	is there going to be a season 3 of project runway junior	0
7dfbcb9f-ede3-4fad-85c6-26e5024fbec3	Green bean -- Green beans are the unripe, young fruit and protective pods of various cultivars of the common bean (Phaseolus vulgaris). Immature or young pods of the runner bean (Phaseolus coccineus), yardlong bean (Vigna unguiculata subsp. sesquipedalis), and hyacinth bean (Lablab purpureus) are used in a similar way. Green beans are known by many common names, including French beans, string beans, snap beans, and snaps.	are green beans the same as french beans	0
0c498190-360e-4ec7-bd5d-14cdab6ea883	List of tallest buildings in New York City -- New York City, the most populous city in the United States, is home to over 6,486 completed high rise buildings of at least 35 meters, of which at least 113 completed are taller than 600 feet (183 m). The tallest building in New York is One World Trade Center, which rises 1,776 feet (541 m). The 104-story skyscraper also stands as the tallest building in the United States, the tallest building in the Western Hemisphere, and the sixth-tallest building in the world. The second-tallest building in the city is 432 Park Avenue, standing at 1,396 feet (426 m), and the third-tallest is the recently-topped-out 30 Hudson Yards. Not counting its antenna, the 4th-tallest is the 102-story Empire State Building in Midtown Manhattan, which was finished in 1931 and rises to 1,250 feet (381 m), increased to 1,454 feet (443 m) by its antenna. It is the fifth-tallest building in the United States and the 37th-tallest building in the world.	is one world trade center taller than the empire state building	0
5cf38c5e-ff92-4589-98c0-ffd0cd43b0a2	Pittsburgh Penguins -- The two teams have faced-off eleven times in the playoffs, with the Penguins winning nine of the eleven matchups, their two series losses coming in the 1994 and 2018 playoffs. The Penguins defeated the Capitals en route to all five of their Stanley Cup victories. They have met in a decisive, series-deciding Game 7 in the 1992, 1995, 2009 and 2017 playoffs. This rivalry was showcased at the NHL's fourth Winter Classic, played on January 1, 2011, at Heinz Field in Pittsburgh. The Capitals won the game 3--1.	are the penguins out of the stanley cup	0
66cad3c8-a8bf-4545-87c4-d8eb54bb8b28	Drinking in public -- Drinking in public is legal in England and Wales -- one may carry a drink from a public house down the street (though it is preferred that the user requests a plastic glass to avoid danger of breakage and because the taking of the glass could be considered an offence of Theft as only the drink has been purchased), and one may purchase alcohol at an off-licence and immediately begin drinking it outside. Separately, one may drink on aeroplanes and on most National Rail train services, either purchasing alcohol on-board or consuming one's own.	is it legal to drink in public in london	0
063ee368-2dea-44fb-8769-115aa951c861	Arkansas Razorbacks -- On December 4, 2012, the University of Arkansas named Bret Bielema the football team's new head coach. The position was previously held by John L. Smith, who served as the interim coach while UofA found a replacement for Bobby Petrino after Petrino was released from his duties with cause on April 10, 2012. Petrino followed the ten season tenure of Houston Nutt. The team plays its home games either at Donald W. Reynolds Razorback Stadium, located on the University of Arkansas campus in Fayetteville, or at War Memorial Stadium, located in Little Rock. In 1964, the Razorbacks were the only team to go through the regular season and a bowl game undefeated, and they were awarded the Football Writers Association of America National Championship. The 1969 team, led by quarterback Bill Montgomery, challenged the Texas Longhorns for a national championship in the Game of the Century.	have the arkansas razorbacks ever won a national championship in football	0
a65dec09-08f7-4e5e-ace7-f35d7cc8f874	ITV Hub -- ITV Hub was launched for Xbox One on Friday 10 February 2017, this was made possible by a new Universal Windows Platform app which integrates with Windows 10 and Xbox One. The STV Player app run by STV, who currently hold the ITV licence for Scotland, has been launched on Xbox 360. The STV Player app contains much of the content found on ITV Player and requires a Scottish postcode to be entered prior to use.	can you download itv hub on xbox 360	0
3b2a9aee-69a6-42c9-85ff-ee3497983e77	Acid -- Common aqueous acids include hydrochloric acid (a solution of hydrogen chloride which is found in gastric acid in the stomach and activates digestive enzymes), acetic acid (vinegar is a dilute aqueous solution of this liquid), sulfuric acid (used in car batteries), and citric acid (found in citrus fruits). As these examples show, acids (in the colloquial sense) can be solutions or pure substances, and can be derived from acids (in the strict sense) that are solids, liquids, or gases. Strong acids and some concentrated weak acids are corrosive, but there are exceptions such as carboranes and boric acid.	the main component of stomach acid is sulfuric acid	0
5537e7db-bc47-438d-aea8-dd7efeb76a04	Race (film series) -- Producer Ramesh S.Taurani and Director Remo D'Souza have hinted that Race 4 will go on floor in 2020 with some new characters and a new plot.	is there going to be a race 4	0
e588478b-1c42-40f8-8c04-a8075d10bfb1	Octet rule -- The octet rule is a chemical rule of thumb that reflects observation that atoms of main-group elements tend to combine in such a way that each atom has eight electrons in its valence shell, giving it the same electron configuration as a noble gas. The rule is especially applicable to carbon, nitrogen, oxygen, and the halogens, but also to metals such as sodium or magnesium.	does the octet rule apply to all elements	0
70266a45-6d7b-4f81-b544-68d07749eb7f	Taylor Hayes (The Bold and the Beautiful) -- Taylor Hayes is a fictional character from the American CBS soap opera The Bold and the Beautiful, portrayed by Hunter Tylo. The character was created by William J. Bell and debuted during the episode dated June 6, 1990. Tylo appeared as a regular continuously until 1994 when she took a hiatus for a few months before being written back into the series. In 1996, she left the serial after being cast on Melrose Place, where she was soon fired on the grounds of being pregnant, and returned shortly after. In 2002, Tylo and the show's executive producer Bradley Bell had mutually agreed that the character was ``played out'', and Taylor was subsequently killed off, last appearing on October 30, 2002. Tylo returned in 2004, reprising Taylor as a ghost. She returned on a permanent basis in April 2005, with the character revealed to be alive. Tylo exited The Bold and the Beautiful again in July 2013, but returned for multiple guest appearances in 2014. She returned again in April 2018.	is taylor still on the bold and beautiful	0
83b078e2-915c-46fd-8fa0-a0fb22bf00e0	Truth in Lending Act -- TILA also gives consumers the right to cancel certain credit transactions that involve a lien on a consumer's principal dwelling, regulates certain credit card practices, and provides a means for fair and timely resolution of credit billing disputes. With the exception of certain high-cost mortgage loans, TILA does not regulate the charges that may be imposed for consumer credit. Rather, it requires uniform or standardized disclosure of costs and charges so that consumers can shop. It also imposes limitations on home equity plans that are subject to the requirements of 12 C.F.R. 1026.40 and certain ``higher-priced'' mortgage loans (HPMLs) that are subject to the requirements of 12 C.F.R. 1026.35. The regulation prohibits certain acts or practices in connection with credit secured by a consumer's principal dwelling.	the truth in lending act regulates interest rates and the terms of loans	0
7cff4097-7b7d-4be7-99bd-00aab5810cde	A Quiet Place (film) -- Regan, who was not allowed in the house basement previously, sees her father's notes on the creatures and on his experimentation with several different implants. When the creature returns to invade the basement, Regan places the boosted implant on a nearby microphone, magnifying the feedback to ward off the creature. Painfully disoriented, the creature exposes the flesh beneath its armored head, and Evelyn shoots the creature in the head with a shotgun, destroying its head and killing it. The family views a CCTV monitor, showing two creatures attracted by the noise of the shotgun blast approaching the house. With their newly acquired knowledge of the creatures' weakness, the members of the family arm themselves and prepare to fight back.	does the family die in a quiet place	0
4b9e57be-e2fd-4f28-8493-121303ec55cb	Carlotta (The Phantom of the Opera) -- In the Lloyd Webber-Joel Schumacher 2004 film version, she was played by Minnie Driver. Due to Driver's lack of experience in opera, her singing voice was dubbed by opera singer Margaret Preece, although she lent her actual voice to the song ``Learn to Be Lonely'' during the end credits.	minnie driver did she sing in phantom of the opera	0
80927f1c-34c0-41d1-997a-a0c501311146	The Mountain Between Us (film) -- The Mountain Between Us is a 2017 American drama film directed by Hany Abu-Assad and written by Chris Weitz and J. Mills Goodloe, based on the 2011 novel of the same name by Charles Martin. It stars Idris Elba and Kate Winslet as a surgeon and a journalist, respectively, who survive a plane crash, with a dog, and are stranded in High Uintas Wilderness with injuries and harsh weather conditions. The film premiered on September 9, 2017, at the 2017 Toronto International Film Festival, and was theatrically released in the United States on October 6, 2017, by 20th Century Fox.	is the movie the mountain between us based on a real story	0
f11a7658-c340-4226-8136-527ec58fb5e3	Convention to propose amendments to the United States Constitution -- To become part of the Constitution, an amendment must be ratified by either--as determined by Congress--the legislatures of three-fourths (presently 38) of the states or State ratifying conventions in three-fourths of the states. Thirty-three amendments to the United States Constitution have been approved by Congress and sent to the states for ratification. Twenty-seven of these amendments have been ratified and are now part of the Constitution. As of 2018, the convention process has never been used for proposing constitutional amendments.	has there ever been a convention of states	0
5d4590f5-2376-43b7-bc44-bc78395be6be	Endonuclease -- Restriction enzymes are endonucleases from eubacteria and archaea that recognize a specific DNA sequence. The nucleotide sequence recognized for cleavage by a restriction enzyme is called the restriction site. Typically, a restriction site will be a palindromic sequence about four to six nucleotides long. Most restriction endonucleases cleave the DNA strand unevenly, leaving complementary single-stranded ends. These ends can reconnect through hybridization and are termed ``sticky ends''. Once paired, the phosphodiester bonds of the fragments can be joined by DNA ligase. There are hundreds of restriction endonucleases known, each attacking a different restriction site. The DNA fragments cleaved by the same endonuclease can be joined together regardless of the origin of the DNA. Such DNA is called recombinant DNA; DNA formed by the joining of genes into new combinations. Restriction endonucleases (restriction enzymes) are divided into three categories, Type I, Type II, and Type III, according to their mechanism of action. These enzymes are often used in genetic engineering to make recombinant DNA for introduction into bacterial, plant, or animal cells, as well as in synthetic biology.	is a section of dna recognized by a restriction endonuclease	0
f75051c6-81ff-4836-9dd1-a257eff5f732	The Book of Henry -- Susan slips away from the talent show and puts the plan into motion. As she is about to pull the trigger, however, she realizes that Henry's plan, though ingenious, is the construct of a child, and that she must act as an adult. She immediately confronts Glenn and tells him that she is going to expose him for what he has done to Christina. Glenn replies that everyone will believe him, not her, and he tells her that he is going to call his police chief to come and bring her in. At the same time, affected by Christina's dance performance at the talent show, Principal Wilder decides to follow through on the abuse accusation and contacts the authorities. Glenn returns home, calls his relative at Social Services, and learns that an investigation is being opened into his abuse of Christina. As the police arrive at his house, Glenn kills himself. Susan legally adopts Christina as her daughter. She also finishes writing one of her children's books, as Henry had urged her to do.	does christina die in the book of henry	0
59112589-8088-4060-8fba-32536a042088	Alcohol laws of Utah -- The alcohol laws of Utah regulate the selling and purchasing of alcohol in the United States state of Utah and are some of the most restrictive in the United States. A person must be 21 years old or older to buy or consume alcohol. The Utah Department of Alcoholic Beverage Control (UDABC) has regulated the sale of alcoholic beverages since 1935, two years after the end of Prohibition. Utah is one of 18 control states, meaning the state has a monopoly over the wholesaling and/or retailing of some or all categories of alcoholic beverages.	can you drink alcohol in salt lake city	0
f3d8b0ad-ae04-481b-be62-8ad3724047b3	The Good Dinosaur -- Sixty-five million years later, Apatosaurus farmers Henry and Ida have children Libby, Buck, and the runt Arlo, who has trouble adjusting to farm life. While his successful siblings are allowed to ``make their mark'' (a mud-print on the family's corn silo), Arlo's timid nature makes tasks difficult for him. Henry attempts to give Arlo a sense of purpose by putting him in charge of guarding their silo, and helps him set a trap. It captures a feral caveboy, but Arlo doesn't have the heart to kill him, and sets him free. Disappointed, Henry takes Arlo to track the caveboy, leading them into a ravine. Henry saves Arlo from a flash flood before being swept away and killed.	did the dad die in the good dinosaur	0
b22c46e6-a425-4a19-b44e-1cbe03dbd0df	Bonnie Blair -- Blair began dating fellow Olympic speed skater Dave Cruikshank in 1990. The pair married in Milwaukee, Wisconsin in 1996. Blair and Cruikshank have two children: a son, Grant, and daughter, Blair. As of 2018, Grant Cruikshank plays hockey in Canada. Blair Cruikshank competed at the 2018 United States Olympic speed skating trials at the 500 meter distance, held in Pettit National Ice Center.	did bonnie blairs daughter make the olympic team	0
39bbf50e-2c2e-42c7-bf1a-cd11301ce31f	Irish pound -- The European Exchange Rate Mechanism finally broke the one-for-one link that existed between the Irish pound and the pound sterling; by 30 March 1979 an exchange rate was introduced.	is the irish pound the same as the british pound	0
d4940f93-64a8-45ad-b835-431a021ef9da	Color blindness -- The most common cause of color blindness is an inherited problem in the development of one or more of the three sets of color sensing cones in the eye. Males are more likely to be color blind than females, as the genes responsible for the most common forms of color blindness are on the X chromosome. As females have two X chromosomes, a defect in one is typically compensated for by the other, while males only have one X chromosome. Color blindness can also result from physical or chemical damage to the eye, optic nerve or parts of the brain. Diagnosis is typically with the Ishihara color test; however, a number of other testing methods also exist.	is it impossible for a girl to be colorblind	0
623fcb15-6942-45d8-be75-403ef2d8a0fb	Estée Lauder Companies -- Estée Lauder's Clinique brand became the first women's cosmetic company to introduce a second line for men when, in 1976, they began a separate line called ``Skin Supplies for Men'', which continues to be sold at Clinique counters worldwide. In 1981, the company's products became available in the Soviet Union.	is estee lauder and clinique the same company	0
