id	text_a	text_b	label
18476a02-0cab-4acf-adf6-82276faf485b	Aero (chocolate) -- The Aero bar was made available for a short time in the United States by Nestlé during the 1980s, though it seems not to have been a commercial success. However, they are still available at certain speciality vendors or supermarkets such as Big Y, Wegmans and Publix that import the bars. Previously The Hershey Company sold Aero bars in the United States under licence from Rowntree Chocolate Company from 1937 until 1939. Hershey currently markets a similar bar called Hershey's Air Delight.	can you get aero bars in the us	0
026e7cd1-cc1c-437c-a596-679c7a26223f	Elena Gilbert -- Much of Elena's story revolves around her relationships with vampires Stefan Salvatore and his older brother, Damon. It is revealed that Elena is a Petrova Doppelgänger, which is thus responsible for her being identical to her ancestor, Katherine Pierce (née Katerina Petrova). This also has the implication of making her a supernatural creature. Dobrev portrayed the ``conniving'' Katherine as well, who is opposite of Elena. The actress stated that it has been a challenge distinguishing the two, and enjoys playing them both. In the television series's fourth season, Elena becomes a vampire and deals with the struggles that come with her change. She took the cure and became human again towards the end of the sixth season. In the finale of the sixth season, Kai linked Elena to Bonnie's life by magic. Elena will only wake up when Bonnie dies in around 60 years. She was locked inside the Salvatore tomb, which was changed in the seventh season, and was relocated in Brooklyn, New York. In late 2016, when it was announced that the eighth season would be the final season, Dobrev was in talks about returning to the television series to reprise her role in the final episode. After much speculation. Dobrev's return was confirmed on January 26, 2017, via an Instagram post. Dobrev appeared in the final episode of the show as both Elena and her evil doppelgänger Katherine Pierce.	is elena still a vampire in season 6	0
e00f683a-a83c-4822-b03a-1efb6fdc251e	Daylight saving time by country -- Most areas in North America and Europe, and some areas in the Middle East, observe daylight saving time (DST), while most areas of Africa and Asia do not. In South America, most countries in the north of the continent near the equator do not observe DST, while Paraguay and southern parts of Brazil do. The practice of observing daylight saving time in Oceania is also mixed, with New Zealand and parts of southeastern Australia observing DST, while most other areas do not.	does any other country have daylight savings time	0
2218c447-5b03-4b49-801d-86ff581d7723	Grand Slam (golf) -- The term ``Grand Slam'' was first applied to Bobby Jones' achievement of winning the four major golf events of 1930: The Open Championship, the U.S. Open, the U.S. Amateur and the British Amateur. When Jones won all four, the sports world searched for ways to capture the magnitude of his accomplishment. Up to that time, there was no term to describe such a feat because no one had thought it possible. The Atlanta Journal's O.B. Keeler dubbed it the ``Grand Slam,'' borrowing a bridge term. George Trevor of the New York Sun wrote that Jones had ``stormed the impregnable quadrilateral of golf.'' Keeler would later write the words that would forever be linked to one of the greatest individual accomplishments in the history of sports:	has anyone won the grand slam in golf in one year	0
398fc2a6-b6ea-4883-9c4b-c6a87dc1d868	Morgan Corinthos -- The character was created under head writers, Robert Guza, Jr. and Charles Pratt, Jr. and introduced by executive producer Jill Farren Phelps, as a newborn on October 24, 2003. In 2009, the character is SORASed (rapidly aged) and the role was recast with actor Aaron Refvem in 2009, and later Aaron Sanders in 2010. The character is written out of the series in the summer of 2011 by head writer, Garin Wolf, and sent off to military school. Craig's Morgan is introduced in 2013 under head writer Ron Carlivati and executive producer, Frank Valentini, SORASed again. Craig left the soap in October 2016 and made a one-off appearance in January 2018.	did morgan corinthos come back to general hospital	0
c482539e-49ec-4338-86be-200e65bf4705	Stand by Me (film) -- After a series of misadventures and self-revelations, the boys locate the body. However, local hoodlum ``Ace'' Merrill and his gang, including Chris' older brother ``Eyeball'' Chambers, arrive to claim the body and the credit for finding it. When Chris refuses to allow this, Ace draws a switchblade with intent to kill him, but Gordie intervenes with the pistol Chris had stolen. Ace and his gang leave and Ace vows revenge.	do they find the body in stand by me	0
973aff8b-7449-4287-ad34-49beca084458	Call Me by Your Name (novel) -- Call Me by Your Name is a 2007 novel by American writer André Aciman that centers on a blossoming romantic relationship between an intellectually precocious and curious 17-year-old American-Italian Jewish boy named Elio Perlman and a visiting 24-year-old American Jewish scholar named Oliver in 1980s Italy. The novel chronicles their summer romance and the 20 years that follow.	was call me by your name a book	0
8cceba72-829a-4bc1-b844-033579dd34c0	Closed communion -- The Catholic Church distinguishes between Churches whose celebration of the Eucharist, as well as holy orders, it recognizes as valid and those of other Christian communities. In the case that it is impossible to approach a Catholic minister, that it is a case of real need or spiritual benefit,and that the danger of error or indifferentism is avoided, the Catholic Church permits its faithful to receive Communion in Orthodox Churches, although Orthodox Churches do not honour this and only permit Orthodox Christians to receive Communion in Orthodox Churches. The Catholic Church does not ordinarily allow a Catholic to receive communion in a Protestant church, since it does not consider Protestant ministers to be priests ordained by bishops in a line of valid succession from the apostles, although Lutherans, Moravians, and Anglicans teach that they ordain their clergy in lines of apostolic succession. It applies this rule also to the Anglican Communion, pursuant to Apostolicae curae, a position that the Church of England disputed in Saepius officio.	can a catholic receive communion in an episcopal church	0
c937cd11-ca96-45bc-86b6-7017221b56b3	Penalty shoot-out (association football) -- A shoot-out is usually considered for statistical purposes to be separate from the match which preceded it. In the case of a two-legged fixture, the two matches are still considered either as two draws or as one win and one loss; in the case of a single match, it is still considered as a draw. This contrasts with a fixture won in extra time, where the score at the end of normal time is superseded. Converted shoot-out penalties are not considered as goals scored by a player for the purposes of their individual records, or for ``golden boot'' competitions.	does penalty shoot out goals count for golden boot	0
a21ef97f-cfea-404c-aa0d-93dd67f31231	Return address -- The return address is not required on postal mail. However, lack of a return address prevents the postal service from being able to return the item if it proves undeliverable; such as from damage, postage due, or invalid destination. Such mail may otherwise become dead letter mail.	do you need to put return address on mail	0
2d584eab-8c4b-442b-a1f3-77b16e292428	List of Fairy Tail episodes (season 2) -- The second season of the Fairy Tail anime series was directed by Shinji Ishihira and produced by A-1 Pictures and Satelight. Like the rest of the series, it follows the adventures of Natsu Dragneel and Lucy Heartfilia of the magical guild, Fairy Tail. The series contains two story arcs. The first 20 episodes make up the ``Nirvana'' (ニルヴァーナ, Niruvāna) arc, which adapts Hiro Mashima's Fairy Tail manga from shortly after the beginning of the 16th through the middle of the 20th volume. The arc focuses on Fairy Tail's alliance with other guilds to take down the dark guild Oración Seis, aided by the Dragon Slayer Wendy Marvell and a reformed Jellal Fernandez. The last four episodes form the self-contained ``Daphne'' (ダフネ, Dafune) arc, where Gray Fullbuster seemingly betrays the guild and helps Daphne, a deranged wizard, capture Natsu to power an artificial dragon.	will there be a second season of fairy tail	0
62de2e1c-faf2-4e59-9fdc-7147cf6bead4	Himalayan salt -- Although its salt is sometimes marketed as ``Jurassic Sea Salt'', this salt deposit comes from a seabed of the Permian and Cretaceous eras 100 to 200 million years ago. This sea became landlocked and evaporated, leaving a dense salt deposit, colored by a common pink microorganism that had lived in it. Over the next few hundred million years, that deposit was at the border of a continental plate, and was pushed up into a mountain range in Pakistan.	is himalayan pink salt the same as himalayan sea salt	0
574651a3-7efb-47a6-a2fc-db1ce114f623	Nebraska -- Nebraska /nɪˈbræskə/ ( listen) is a state that lies in both the Great Plains and the Midwestern United States. The state is bordered by South Dakota to the north, Iowa to the east and Missouri to the southeast, both across the Missouri River, Kansas to the south, Colorado to the southwest and Wyoming to the west. It is the only triply landlocked U.S. state. Nebraska's area is just over 77,220 sq mi (200,000 km) with almost 1.9 million people. Its state capital is Lincoln, and its largest city is Omaha, which is on the Missouri River.	is nebraska in the middle of the usa	0
3d9c47df-a82e-45a1-9829-6bbe50983089	West Edmonton Mall -- West Edmonton Mall (WEM), located in Summerlea, Edmonton, Alberta, Canada, is the largest shopping mall in North America and the tenth largest in the world (along with The Dubai Mall) by gross leasable area. It was the world's largest mall until 2004. The mall was founded by the Ghermezian brothers, who emigrated from Iran in 1959.	is west edmonton mall the biggest mall in the world	0
638d8914-8914-4d8d-9315-22cb62f6bbe9	Gin rummy -- The basic game strategy is to improve one's hand by forming melds and eliminating deadwood. Gin has two types of meld: Sets of 3 or 4 cards sharing the same rank, e.g. 8♥ 8 8♠; and runs of 3 or more cards in sequence, of the same suit, such as 3♥ 4♥ 5♥ or more. Deadwood cards are those not in any meld. Aces are considered low--they can form a set with other aces but only the low end of runs (A♠ 2♠ 3♠ is a legal run but Q♠ K♠ A♠ is not). A player can form any combination of melds within their hand, whether it contains all sets, all runs, or a mix of both. A hand can contain three or fewer melds to knock or form legal gin.	does a run in gin rummy have to be the same suit	0
c2e04b31-bb22-4188-adf3-53467c833727	Chloé -- See is a younger line of the Chloé luxury brand. This line manufactures ready-to-wear, handbags, and accessories since 2001. This line of apparel is intended to target the younger generation and is more affordable for those who are starting to become more sophisticated in their styles.	is see by chloe the same as chloe	0
0cad4ab2-1c9f-40f5-8c19-2e4d4c699a18	Fifty Shades Freed -- Fifty Shades Freed is the third and final installment of the erotic romance Fifty Shades Trilogy by British author E.L. James. After accepting entrepreneur CEO Christian Grey's proposal in Fifty Shades Darker, Anastasia Steele must adjust not only to married life but to her new husband's wealthy lifestyle and controlling nature. The paperback edition was first published in April 2012.	is there a 50 shades of grey 3	0
56687c81-2f61-452c-b1fe-a49f07f67165	Natural-born-citizen clause -- The former unincorporated territory of the Panama Canal Zone and its related military facilities were not regarded as United States territory at the time, but 8 U.S.C. § 1403, which became law in 1937, retroactively conferred citizenship on individuals born within the Canal Zone on or after February 26, 1904, and on individuals born in the Republic of Panama on or after that date who had at least one U.S. citizen parent employed by the U.S. government or the Panama Railway Company; 8 U.S.C. § 1403 was cited in Judge William Alsup's 2008 ruling, described below. A March 2008 paper by former Solicitor General Ted Olson and Harvard Law Professor Laurence H. Tribe opined that McCain was eligible for the Presidency. In April 2008, the U.S. Senate approved a non-binding resolution recognizing McCain's status as a natural-born citizen. In September 2008, U.S. District Judge William Alsup stated obiter in his ruling that it is ``highly probable'' that McCain is a natural-born citizen from birth by virtue of 8 U.S.C. § 1401, although he acknowledged the alternative possibility that McCain became a natural-born citizen retroactively, by way of 8 U.S.C. § 1403.	can someone born on a military base be president	0
70ad4278-24dd-45d1-82b3-b45716bc93d4	Series and parallel circuits -- In a series circuit, the current through each of the components is the same, and the voltage across the circuit is the sum of the voltages across each component. In a parallel circuit, the voltage across each of the components is the same, and the total current is the sum of the currents through each component.	is voltage the same in a series circuit	0
4f0256d2-123f-43cc-896a-bdcd7acec2cd	Andrea Gail -- Fuel drums, a fuel tank, the EPIRB, an empty life raft, and some other flotsam were the only wreckage ever found. The ship was presumed lost at sea somewhere along the continental shelf near Sable Island.	did they ever find the boat from the perfect storm	0
22bd6063-5703-4c23-8994-5e30abe8d1a3	World Trade Center (1973–2001) -- The original World Trade Center was a large complex of seven buildings in Lower Manhattan, New York City, United States. It featured the landmark twin towers, which opened on April 4, 1973, and were destroyed as a result of the September 11 attacks in 2001. At the time of their completion, the ``Twin Towers''--the original 1 World Trade Center, at 1,368 feet (417 m); and 2 World Trade Center, at 1,362 feet (415.1 m)--were the tallest buildings in the world. The other buildings in the complex included the Marriott World Trade Center (3 WTC), 4 WTC, 5 WTC, 6 WTC, and 7 WTC. All these buildings were built between 1975 and 1985, with a construction cost of $400 million ($2,300,000,000 in 2014 dollars). The complex was located in New York City's Financial District and contained 13,400,000 square feet (1,240,000 m) of office space.	were the world trade centers the tallest buildings in america	0
e7f193fe-73fb-4d89-a4d7-b0112bca3438	List of Sesame Street Muppets -- The Muppets are a group of puppet characters created by Jim Henson, many for the purpose of appearing on the children's television program Sesame Street. Henson's involvement in Sesame Street began when he and Joan Ganz Cooney, one of the creators of the show, met in the summer of 1968, at one of the show's five three-day curriculum planning seminars in Boston. Author Christopher Finch reported that director Jon Stone, who had worked with Henson previously, felt that if they could not bring him on board, they should ``make do without puppets''.	are the muppets the same as sesame street	0
ca21d3df-ebb8-4e23-8cd0-c22067db41c8	Pisgah Crater -- Pisgah Crater, or Pisgah Volcano, is a young volcanic cinder cone rising above a lava plain in the Mojave Desert, between Barstow and Needles, California in San Bernardino County, California. The volcanic peak is around 2.5 miles (4.0 km) south of historic U.S. Route 66-National Old Trails Highway and of Interstate 40, and west of the town of Ludlow. The volcano had a historic elevation of 2,638 feet (804 m), but has been reduced to 2,545 feet (776 m) due to mining.	is there a volcano in the mojave desert	0
8b62c101-165f-49e7-8239-e488cc5cb5e2	Euro sign -- The euro sign (€) is the currency sign used for the euro, the official currency of the Eurozone in the European Union (EU). The design was presented to the public by the European Commission on 12 December 1996. The international three-letter code (according to ISO standard ISO 4217) for the euro is EUR. In Unicode it is encoded at U+20AC € euro sign (HTML &#8364; &euro; ). In English, the sign precedes the value (for instance, €10, not 10 €, unlike most other European languages). In some style guides, but not others, the euro sign is unspaced.	does the euro sign go before the number	0
743f9008-f582-46b9-b679-b8dfe2065fd3	List of large council estates in the UK -- Becontree in Dagenham is generally considered to be the largest council estate (in terms of population), with Wythenshawe in Manchester the second largest. Gipton in Leeds is a contender for third largest.	is wythenshawe the biggest council estate in europe	0
836a7efc-6266-46ab-ae86-7fd559b82374	Britannia (TV series) -- In March 2018, is was announced that Sky Atlantic had renewed the show for a second season.	is there going to be another season of britannia	0
a4a68cbc-e8dd-4ddd-ab10-d5d09771c0b0	Persian language -- Persian (/ˈpɜːrʒən, -ʃən/), also known by its endonym Farsi (فارسی fārsi (fɒːɾˈsiː) ( listen)), is one of the Western Iranian languages within the Indo-Iranian branch of the Indo-European language family. It is primarily spoken in Iran, Afghanistan (officially known as Dari since 1958), and Tajikistan (officially known as Tajiki since the Soviet era), and some other regions which historically were Persianate societies and considered part of Greater Iran. It is written in the Persian alphabet, a modified variant of the Arabic script, which itself evolved from the Aramaic alphabet.	do iran and afghanistan speak the same language	0
137a5cec-e86a-4125-a291-beb7d7aad191	Gun laws in New Hampshire -- Since 22 February 2017, New Hampshire is a constitutional carry state, requiring no license to open carry or concealed carry a firearm in public. Concealed carry permits are still issued for purposes of reciprocity with other states.	do i need a concealed carry permit in nh	0
4f4ce23c-7548-47c6-a484-b0cefadd137f	Quick ratio -- In finance, the quick ratio, also known as the acid-test ratio is a type of liquidity ratio which measures the ability of a company to use its near cash or quick assets to extinguish or retire its current liabilities immediately. Quick assets include those current assets that presumably can be quickly converted to cash at close to their book values. It is the ratio between quickly available or liquid assets and current liabilities.	is quick ratio the same as acid test	0
2cc4c0ea-d266-4aed-9849-5dfc5ff48d2b	Blue law -- In Texas, for example, blue laws prohibited selling housewares such as pots, pans, and washing machines on Sunday until 1985. In Colorado, Illinois, Indiana, Iowa, Louisiana, Maine, Minnesota, Missouri, Oklahoma, New Jersey, North Dakota, Pennsylvania, and Wisconsin, car dealerships continue to operate under blue-law prohibitions in which an automobile may not be purchased or traded on a Sunday. Maryland permits Sunday automobile sales only in the counties of Charles, Prince George's, Montgomery, and Howard; similarly, Michigan restricts Sunday sales to only those counties with a population of less than 130,000. Texas and Utah prohibit car dealerships from operating over consecutive weekend days. In some cases these laws were created or retained with the support of those whom they affected, to allow them a day off each week without fear of their competitors still being open.	can you buy a car in wisconsin on sunday	0
5f87a9ba-b197-4458-aab6-da57c5f61487	Uterus -- The uterus (from Latin ``uterus'', plural uteri) or womb is a major female hormone-responsive secondary sex organ of the reproductive system in humans and most other mammals. In the human, the lower end of the uterus, the cervix, opens into the vagina, while the upper end, the fundus, is connected to the fallopian tubes. It is within the uterus that the fetus develops during gestation. In the human embryo, the uterus develops from the paramesonephric ducts which fuse into the single organ known as a simplex uterus. The uterus has different forms in many other animals and in some it exists as two separate uteri known as a duplex uterus.	is a uterus and a womb the same thing	0
f8c0e40b-e2bb-457c-941b-2c7030f949a9	Alcohol laws of Missouri -- Missouri has no specific state limitations on the places where alcohol may be sold ``off-premises'' (i.e. for consumption elsewhere). As a result, Missouri is famous in the region for grocery stores, drug stores, and even gas stations throughout the state which sell a wide variety of beer, wine, and liquor. As long as it is not located within 100 feet (30 m) of a school or church, virtually any retail business (including a vague and undefined ``general merchandise store'') which obtains the proper licenses from the Division of Alcohol and Tobacco Control and local authorities may sell any type of alcohol. State law even forbids a local option and prohibits cities and counties from banning the off-premises sale of alcohol.	can you buy wine in grocery stores in missouri	0
2dd69330-7557-4aa2-8ca7-1148731f42af	Dr. Martens -- In 2004 a new range of Dr. Martens was launched in an attempt to appeal to a wider market, and especially young people. The shoes and boots were intended to be more comfortable, and easier to break in, and included some new design elements. Dr. Martens also began producing footwear again at the Cobbs Lane Factory in Wollaston, England in 2004. These products are part of the ``Vintage'' line, which the company advertises as being made to the original specifications. Sales of these shoes are low in comparison to those made in Asia, however; in 2010, the factory was producing about 50 pairs per day. In 2005, the R. Griggs company was given an award by the ``Institute for Turnaround'' for implementing a successful restructure.	are doc martens still made in the uk	0
7834040c-7ddd-4777-85d1-431d3ce95b24	Metabolism -- The most common set of catabolic reactions in animals can be separated into three main stages. In the first stage, large organic molecules, such as proteins, polysaccharides or lipids, are digested into their smaller components outside cells. Next, these smaller molecules are taken up by cells and converted to smaller molecules, usually acetyl coenzyme A (acetyl-CoA), which releases some energy. Finally, the acetyl group on the CoA is oxidised to water and carbon dioxide in the citric acid cycle and electron transport chain, releasing the energy that is stored by reducing the coenzyme nicotinamide adenine dinucleotide (NAD) into NADH.	cells produce water as a by-product of energy metabolism	0
0badbd93-754c-483e-98f9-25bdc79ca73e	Jersey pound -- Both Jersey and Bank of England notes are legal tender in Jersey and circulate together, alongside the Guernsey pound and Scottish banknotes. The Jersey notes are not legal tender in the United Kingdom but are legal currency, so creditors and traders may accept them if they so choose.	is jersey currency legal tender in the uk	0
da157bc5-9bcc-478c-a2e5-3dd1c32fac85	Avengers: Infinity War -- In October 2014, Marvel announced a two-part sequel to Avengers: Age of Ultron, titled Avengers: Infinity War. Part 1 was scheduled to be released on May 4, 2018, with Part 2 scheduled for May 3, 2019. In April 2015, Marvel announced that Anthony and Joe Russo would direct both parts of Avengers: Infinity War, with back-to-back filming expected to begin in 2016. The same month, Kevin Feige said the films would be two, distinct films ``because they (have) such shared elements, it felt appropriate... to (subtitle the films) like that. But I wouldn't call it one story that's cut in half. I would say it's going to be two distinct movies.'' By May 2015, Christopher Markus & Stephen McFeely signed on to write the screenplays for both parts of the film, which draws inspiration from Jim Starlin's 1991 ``The Infinity Gauntlet'' comic and Jonathan Hickman's 2013 ``Infinity'' comic. Anthony Russo added the film was inspired by 1990s heist films, with Thanos on ``on a smash-and-grab (to acquire the Infinity Stones), and everybody's trying to catch up the whole movie.'' In May 2016, the Russos revealed that they would be retitling the two films, to further remove the misconception that the films were one large film split in two, with Joe stating, ``The intention is we will change (the titles), we just haven't come up with (them) yet.'' That July, Marvel revealed the film's title would be shortened to simply Avengers: Infinity War.	is infinity war going to be 2 parts	0
