id	text_a	text_b	label
74353519-1fff-41e8-a9bf-0b3f27361ee3	Tom threw his schoolbag down to Ray after he reached the top of the stairs.	he	0
3df0d1d8-3670-42b2-a6e9-8609b1fb311d	Frank was upset with Tom because the toaster he had sold him didn't work.	he	0
2d2ab626-2ced-4e28-bdb1-3114794d6b59	Susan knows all about Ann 's personal problems because she is indiscreet.	Ann	0
764910e3-eea7-460e-a818-f091c094679a	When Mr. Bond , the veterinarian, came to look at the black horse that lay groaning on the grass, he felt him all over, and shook his head; one of his legs was broken.	his	0
f1439194-5c20-47e0-b06b-ea02b3b1078b	Always before, Larry had helped Dad with his work. But he could not help him now, for Dad said that his boss at the railroad company would not want anyone but him to work in the office.	him	0
b45d0500-872b-488c-847f-a908a54a8508	Every day after dinner Mr. Schmidt took a long nap. Mark would let him sleep for an hour, then wake him up, scold him, and get him to work. He needed to get him to finish his work, because his work was beautiful	Mr. Schmidt	0
13d0be38-dec3-4e14-be7d-c07334e29b56	"The boy continued to whip the pony , and eventually the pony threw him over. John laughed out quite loud. ""Good for him,"" he said. "	pony	0
da857af8-833d-4899-ab66-faf97c711332	George got free tickets to the play, but he gave them to Eric , even though he was particularly eager to see it.	Eric	0
f27ae245-23e3-4651-a1ad-9a1a54f788fc	The path to the lake was blocked, so we couldn't use it .	it	0
d801a6d1-9664-4a0a-a356-0db3683f99b8	I stuck a pin through a carrot. When I pulled the pin out, it had a hole.	The pin	0
36bbe8ac-4f48-444b-9934-9d536629f44b	Lily spoke to Donna , breaking her concentration.	Lily	0
f47ed40b-114f-4d24-973b-13b8c12fed55	Lionel is holding captive a scientist, Dr. Vardi , who has invented a device that turns animals invisible; Lionel plans to use it on Geoffrey and send him to steal nuclear material from an army vault.	him	0
4d549ade-d359-4084-a148-caeadf12ca30	The mothers of Arthur and Celeste have come to the town to fetch them. They are very happy to have them back, but they scold them just the same because they ran away.	mothers	0
8b56009a-6529-40a8-ac29-f1c00a38a245	Jim yelled at Kevin because he was so upset.	he	0
aedceceb-c0c7-4eed-8fd1-1e03d6c29829	The man couldn't lift his son because he was so heavy.	he	0
a2450e24-7f16-43bf-964d-21fa53449646	My meeting started at 4:00 and I needed to catch the train at 4:30, so there wasn't much time. Luckily, it was short, so it worked out.	it	0
9c917d44-5380-4131-b349-5e527a66b284	The signs over the shops' doors had pictures that indicated what work was done inside. Although more and more people were learning how to read, each artisan still had signs, not wishing to lose a possible patron merely because he happened to be illiterate.	he	0
acb528b1-6f44-4ade-afcb-bf81797f637b	Since it was raining, I carried the newspaper in my backpack to keep it dry.	it	0
49985784-99a9-4656-8afc-f42e911314b8	Susan knows all about Ann 's personal problems because she is nosy.	Ann	0
718e59b9-9ebd-442c-a27f-b966d4eb76be	Mark heard Steve 's feet going down the ladder. The door of the shop closed after him. He ran to look out the window.	He	0
603f7b93-c9b9-48f0-86af-57fa0776cdd2	This book introduced Shakespeare to Goethe ; it was a fine selection of his writing.	Goethe	0
c291e7f7-7ac4-4260-a4c7-486ed2925814	Paul tried to call George on the phone, but he wasn't successful.	he	0
19fa0b43-f46b-46d1-990d-870b50518687	Mark heard Steve 's feet going down the ladder. The door of the shop closed after him. He ran to look out the window.	Steve	0
074a5a19-74cb-4e84-9835-87e014b7f1e0	Babar wonders how he can get new clothing. Luckily, a very rich old man who has always been fond of little elephants understands right away that he is longing for a fine suit. As he likes to make people happy, he gives him his wallet.	he	0
cd1bad51-7a2c-4a09-bbb2-e497ae1f0f93	The older students were bullying the younger ones, so we rescued them .	The older students	0
511dd373-d0be-4bff-98cf-b694b556aab6	Alice was dusting the living room and trying to find the button that Mama had hidden. No time today to look at old pictures in her favorite photo album . Today she had to hunt for a button , so she put the album on a chair without even opening it .	living room	0
4cd6d3f1-6fcd-4d4d-93b8-d126b1d3be97	Pete envies Martin because he is very successful.	he	0
a17102e1-4c1c-4aaf-aa8c-b5dd5849ccd5	Even before they reached town , they could hear a sound like corn popping. Dora asked what it was, and Dad said it was firecrackers.	it	0
36705850-df6b-4fde-95c6-a62abe44e1e4	Bob paid for Charlie 's college education, but now Charlie acts as though it never happened. He is very hurt.	He	0
ec9c9e91-9d22-4589-9c18-59d46aa91ed1	"The boy continued to whip the pony , and eventually the pony threw him over. John laughed out quite loud. ""Good for him,"" he said. "	him	0
69c6ec7f-d7c4-486e-93dd-9cb2806fbf0a	Sir Clifford wants me to find him a new groom , about twenty or twenty-one, who knows his business. His old coachman is getting feeble, and he wants a man to work with him and get into his ways, who would be able, when the old man was pensioned off, to step into his place.	his	0
5eb8ef1a-71b0-4793-93c3-b4a563680875	It is not easy to space buttonholes exactly the same distance apart, and it is very difficult to cut them precisely the right size . The tiniest slip of the scissors will make the hole too large, and even one thread uncut will leave it too small.	it	0
8b384751-ee8c-4d28-b1af-b5126acef14f	Always before, Larry had helped Dad with his work. But he could not help him now, for Dad said that his boss at the railroad company would not want anyone but him to work in the office.	Dad	0
8d06f25f-7856-4f2a-b6f5-bc5666fb420a	Since Chester was dependent on Uncle Vernon , he couldn't very well marry without his approval	his	0
597b10ab-f7ef-4123-a6ad-e0eec2629076	Sir Clifford wants me to find him a new groom , about twenty or twenty-one, who knows his business. His old coachman is getting feeble, and he wants a man to work with him and get into his ways, who would be able, when the old man was pensioned off, to step into his place	new groom	0
640725c9-7e09-4b85-9503-8f3db1bba010	Dan had to stop Bill from toying with the injured bird. He is very cruel.	Dan	0
366e4f13-3b67-4ee4-a7ee-c9f398ed0324	James asked Robert for a favor but he was refused.	he	0
359c10a7-ec7f-44d2-80ba-ae6123a44f98	The man lifted the boy onto his bunk bed.	his	0
745e7dec-c050-46f2-8194-32149b5d15fa	I took the water bottle out of the backpack so that it would be handy.	The backpack	0
51c0ee37-80af-4034-9482-7b21cd0e4487	We saw a boy trying to leap a pony over a gate; the pony would not take the leap, and the boy cut him with the whip, but he only turned to one side.	he	0
6f4b2741-e273-4e33-8c08-65560eb1d79c	"Tom said ""Check"" to Ralph as he moved his bishop."	his	0
570025f4-2700-4f28-b588-fba718d6b12a	After I saw Bill catching flies and pulling off their wings, I boxed his ears. I showed the master the flies, some crushed and some crawling about helpless, and I showed him the wings on the window sill. I never saw him so angry before; but as Bill was still howling and whining, like the coward that he was, he did not give him any more punishment of that kind, but set him up on a stool for the rest of the afternoon, and said that he should not go out to play for that week.	him	0
aac84b5d-4878-4161-9d46-bf67f919838e	The actress used to be named Terpsichore , but she changed it to Tina a few years ago, because she figured it was too hard to pronounce.	it	0
ab8c49db-921f-4ff2-8c52-db6ad9063619	Bill passed the gameboy to John because his turn was next.	his	0
e0dccf72-4b74-43ab-bc92-b6944820b20d	Emma's mother had died long ago, and her place had been taken by an excellent woman as governess.	Emma	0
9cf659ea-1c03-4b7f-a00c-fafd8abdcf40	The Wainwrights treated Mr. Crowley like a prince until he made his will in their favor; then they treated him like dirt. Folks said he died just to be rid of their everlasting nagging.	their	0
8f36841f-1c18-45a2-8180-75b40d14e07f	Ann asked Mary what time the library closes, because she had forgotten.	Ann	0
6f38144f-9127-486d-b100-56b9ebd47617	The cat was lying by the mouse hole waiting for the mouse , but it was too cautious.	The cat	0
ea88677e-f704-4cf9-ad1c-2f6bc2e06b93	I poured water from the bottle into the cup until it was full.	it	0
99020e1e-da43-421c-8c99-5a56f3995e17	Adam can't leave work here until Bob arrives to replace him. If Bob had left home for work on time, he would be gone by this time.	Bob	0
4c692b0c-5e55-4007-8207-8ee06165c6b6	After I saw Bill catching flies and pulling off their wings, I boxed his ears. I showed the master the flies, some crushed and some crawling about helpless, and I showed him the wings on the window sill. I never saw him so angry before; but as Bill was still howling and whining, like the coward that he was, he did not give him any more punishment of that kind, but set him up on a stool for the rest of the afternoon, and said that he should not go out to play for that week.	Bill	0
136cf5c3-c5d6-41e7-b223-9bea2eefd848	Sir Clifford wants me to find him a new groom , about twenty or twenty-one, who knows his business. His old coachman is getting feeble, and he wants a man to work with him and get into his ways, who would be able, when the old man was pensioned off, to step into his place	his	0
a09fe19b-287f-457f-b14d-778f62bd8bd0	Thomson visited Cooper 's grave in 1765. At that date he had been dead for five years.	Thomson	0
c5f01317-fd61-4e4b-8580-a3e3faec09a1	Always before, Larry had helped Dad with his work. But he could not help him now, for Dad said that his boss at the railroad company would not want anyone but him to work in the office.	Larry	0
8409b0c1-6df1-4111-bc26-b7c31c651343	John was doing research in the library when he heard a man humming and whistling. He was very annoying.	John	0
c654c905-30f6-4ef5-b38c-76decac998a2	Thomson visited Cooper 's grave in 1765. At that date he had been dead for five years.	he	0
9f0cdebe-893a-4ee8-9e44-ead785e09dcd	Billy cried because Toby wouldn't share his toy.	his	0
2497c95f-ec21-4126-9b2c-32f7cc2af7df	I saw Jim yelling at some guy in a military uniform with a huge red beard. I don't know who he was, but he looked very unhappy.	he	0
00870b58-333f-4b0b-a0d6-7f357fb0b084	The firemen arrived after the police because they were coming from so far away.	they	0
e4f43ed2-0d85-440d-b360-17dbf3231c91	Of one thing Mark was sure. Harry knew much less than he did.	he	0
c5aa8267-d67b-4cc5-8adf-264111fd1a5b	The sack of potatoes had been placed below the bag of flour , so it had to be moved first.	The bag of flour	0
85ad191f-ee47-4168-a81d-9f447dbfbd57	"During a game of tag, Ethan chased Luke because he was ""it""."	Luke	0
94d3e75b-3b92-4abd-a8ac-63eda8f7fae0	The storekeepers stayed in town to run their stores and lived in the rooms behind them .	stores	0
e26b2563-25e7-4b56-bb42-5b437da83649	After I saw Bill catching flies and pulling off their wings, I boxed his ears. I showed the master the flies, some crushed and some crawling about helpless, and I showed him the wings on the window sill. I never saw him so angry before; but as Bill was still howling and whining, like the coward that he was, he did not give him any more punishment of that kind, but set him up on a stool for the rest of the afternoon, and said that he should not go out to play for that week.	Bill	0
ba658c5e-21f6-4710-ac1c-08bfc22079fe	Anne gave birth to a daughter last month. She is a very charming woman.	Anne	0
7bb87008-2e4a-44a1-8ebe-16d0f35f60b3	John ordered Bill to leave, so an hour later he left.	he	0
c72d63b4-ba50-4741-8013-24837136335e	I took the water bottle out of the backpack so that it would be handy.	it	0
4d29689e-2778-4b98-a65d-56bd2f5cbfe8	Bob was playing cards with Adam and was way ahead. If Adam hadn't had a sudden run of good luck, he would have won.	Adam	0
1a249269-499a-4df7-8a5e-4a223430abae	The politicians far away in Washington could not know the settlers so they must make rules to regulate them.	politicians	0
371c4b79-93fa-4f0d-89b1-9a411558ea24	The delivery truck zoomed by the school bus because it was going so slow.	the delivery truck	0
6d751626-8676-42ef-930b-fab3f4f0136e	My master and mistress decided to pay a visit to some friends who lived about forty-six miles from our home, and James was to drive them .	some friends	0
214c6231-5126-4a02-9ac1-77a9b54b1b7c	When my parents died, I was not earning enough to keep myself or my crippled sister Nelly , and without our kind mistress , we would have gone to the poorhouse. Nelly calls her her angel and she has good right to do so. her	her	0
650fe16e-35fa-41ea-921a-be83ccef1991	Papa looked down at the children 's faces , so puzzled and sad now. It was bad enough that they had to be denied so many things because he couldn't afford them.	faces	0
e1653687-1f8d-4c3c-b92b-9d2a43196d29	The customer walked into the bank and stabbed one of the tellers. He was immediately taken to the hospital.	The customer	0
289675b4-edc9-46e5-9549-f0910859aa0c	The stable was very roomy, with four good stalls; a large swinging window opened into the yard , which made it pleasant and airy.	stable	0
ad8e8240-ba80-457c-ad6d-957dfcd25566	As Ollie carried Tommy up the long winding steps, his legs ached.	his	0
409824f1-8051-41cd-9cea-bbffcd1bd7ae	The donkey wished a wart on its hind leg would disappear, and it did.	it	0
216dc17b-4ea5-443e-8208-25f95b215839	In July, Kamtchatka declared war on Yakutsk . Since Yakutsk 's army was much better equipped and ten times larger, they were defeated within weeks.	they	0
87a1df53-14f2-48b4-949a-f2d1b72671c6	The fish ate the worm . It was hungry.	It	0
9737d5c9-3f47-4023-918c-1a86da760550	Since it was raining, I carried the newspaper in my backpack to keep it dry.	The newspaper	0
b407dfa3-e27a-44f0-a48d-bed9bc91c31a	The city councilmen refused the demonstrators a permit because they feared violence.	The demonstrators	0
83154c06-eea3-4ddd-8c4c-49c57c7380e5	Since it was raining, I carried the newspaper over my backpack to keep it dry.	The newspaper	0
d6ffe41e-6ab2-4d08-b023-b864e707c261	The foxes are getting in at night and attacking the chickens . I shall have to kill them .	The chickens	0
60190347-8d48-41af-8f8a-6ed6d56bbf51	"Tom said ""Check"" to Ralph as he moved his bishop."	his	0
2276943b-be59-47ff-ad92-cdb5f4632db6	Emma's mother had died long ago, and her place had been taken by an excellent woman as governess.	her	0
0c175fda-9661-4092-93ab-83646d1b9966	The actress used to be named Terpsichore , but she changed it to Tina a few years ago, because she figured it was too hard to pronounce.	Terpsichore	0
39a58f7e-3fd4-4561-a4f9-5e7a154e1f1a	Pam's parents came home and found her having sex with her boyfriend, Paul. They were furious about it.	Pam's parents	0
2b854063-cc50-4f2f-8aab-89cb042f1f4d	If the con artist has succeeded in fooling Sam , he would have lost a lot of money.	Sam	0
30b9e314-7a19-43d1-9034-c7853cc291dc	The journalists interviewed the stars of the new movie. They were very cooperative, so the interview lasted for a long time.	They	0
90718680-6034-4a68-a3b0-3b8259034cf9	Sam took French classes from Adam , because he was known to speak it fluently.	he	0
1f8b7835-d2dc-4789-939e-c9d0928a21c6	Mama came over and sat down beside Alice . Gently she stroked her hair and let the child weep.	she	0
c74f8d8e-80a7-44b0-8330-39fe54a7d946	Susan knew that Ann 's son had been in a car accident, because she told her about it.	she	0
c9b1bbf8-77ce-436b-9038-f009a0eb416b	Bernard , who had not told the government official that he was less than 21 when he filed for a homestead claim, did not consider that he had done anything dishonest. Still, anyone who knew that he was 19 years old could take his claim away from him.	he	0
b83e6bd6-a213-46a8-90eb-694fdeb4384a	Although they ran at about the same speed, Sue beat Sally because she had such a bad start.	Sally	0
412c31de-a624-4b2f-b274-f0132969c23d	Anna did a lot better than her good friend Lucy on the test because she had studied so hard.	she	0
1b052ee6-b0ec-4a49-9380-c55365a3c448	Alice was dusting the living room and trying to find the button that Mama had hidden. No time today to look at old pictures in her favorite photo album . Today she had to hunt for a button , so she put the album on a chair without even opening it .	album	0
96d3e239-a0dc-43f9-b641-9a3a2e793854	Ann asked Mary what time the library closes, but she had forgotten.	she	0
8827b368-33d4-4017-a49f-c220354224ca	Fred watched TV while George went out to buy groceries. After an hour he got back.	he	0
78d6f00c-3ace-4aff-91ca-6d9673323859	The storekeepers stayed in town to run their stores and lived in the rooms behind them .	rooms	0
f4a426f2-0a67-46fe-93bb-54bd9d4c7651	Meanwhile, in the forest, the elephants are calling and hunting high and low for Arthur and Celeste , and their mothers are very worried. Fortunately, in flying over the town, an old marabou bird has seen them and come back quickly to tell the news.	their	0
e55f4f79-1db3-4851-92ec-879fbf08c2ed	Every day after dinner Mr. Schmidt took a long nap. Mark would let him sleep for an hour, then wake him up, scold him, and get him to work. He needed to get him to finish his work, because his work was beautiful	Mark	0
c5be2026-e5b6-4d6b-811e-db3d0fa3f038	Always before, Larry had helped Dad with his work. But he could not help him now, for Dad said that his boss at the railroad company would not want anyone but him to work in the office.	his	0
2adc0092-1adb-4711-a6c3-3139afe38165	Sam took French classes from Adam , because he was known to speak it fluently.	Sam	0
17636b9e-9e8a-460d-b6ac-f4ad8c5bb3f4	Pam's parents came home and found her having sex with her boyfriend, Paul. They were embarrassed about it.	They	0
b3d62553-5771-433f-b599-8145a762664f	The city councilmen refused the demonstrators a permit because they feared violence.	The city councilmen	0
e7059815-6ae5-49ee-82f1-6c4c1a58473e	Many people start to read Paul's books and can't put them down. They are popular because Paul writes so well.	Paul's books	0
651592f5-f4cf-4395-9946-fd0f915a1d12	Joan made sure to thank Susan for all the help she had given.	Susan	0
6fac7c1e-8751-4daa-abfe-96cd2cdc5409	Then he took a piece of iron the shape of the horse horse's foot , and clapped it on, and drove some nails through the shoe quite into its hoof, so that the shoe was firmly on	it	0
2428c9e7-34e6-43be-9559-b321446385dc	Sir Clifford wants me to find him a new groom , about twenty or twenty-one, who knows his business. His old coachman is getting feeble, and he wants a man to work with him and get into his ways, who would be able, when the old man was pensioned off, to step into his place.	his	0
83337d2d-7d97-4401-8278-2c7cd63c9148	As Ollie carried Tommy up the long winding steps, his legs dangled.	his	0
e2c2c13f-6305-4ab2-a207-e5332cf325ad	When Mr. Bond , the veterinarian, came to look at the black horse that lay groaning on the grass, he felt him all over, and shook his head; one of his legs was broken.	Mr. Bond	0
cbccec22-0398-439d-a3bd-9115acd1d462	The sack of potatoes had been placed above the bag of flour , so it had to be moved first.	it	0
650c5812-91d6-4c36-89e0-c6877201dfa9	The donkey wished a wart on its hind leg would disappear, and it did.	it	0
7b1385f9-066e-48a1-9d2d-0f862b05b883	The Wainwrights treated Mr. Crowley like a prince until he made his will in their favor; then they treated him like dirt. Folks said he died just to be rid of their everlasting nagging.	their	0
6c196b74-d418-4cf7-9e0b-fd64e36ea236	Jane knocked on Susan 's door but she did not get an answer.	she	0
7022d4fe-1e45-4065-bab7-36e9cc98644d	"Tom said ""Check"" to Ralph as he took his bishop."	his	0
00cb0f8c-4a3a-46ed-9f61-2fe2cd9481e5	Kirilov ceded the presidency to Shatov because he was less popular.	Kirilov	0
35f889bc-9919-400e-adce-c5b3ed67f0e7	Mark was close to Mr. Singer 's heels. He heard him calling for the captain, promising him, in the jargon everyone talked that night, that not one thing should be damaged on the ship except only the ammunition, but the captain and all his crew had best stay in the cabin until the work was over	Mr. Singer	0
e7d3bbbb-3a74-49a9-a8ac-975ae56473ce	Sir Clifford wants me to find him a new groom , about twenty or twenty-one, who knows his business. His old coachman is getting feeble, and he wants a man to work with him and get into his ways, who would be able, when the old man was pensioned off, to step into his place	his	0
4e2148b2-9caa-49de-b9ef-788cb4e5d8c4	Emma Emma's mother had died long ago, and her education had been managed by an excellent woman as governess.	Emma	0
3c089299-e1c5-4498-a7d2-7d640afea038	Mr. Moncrieff visited Chester 's luxurious New York apartment, thinking that it belonged to his son Edward . The result was that Mr. Moncrieff has decided to cancel Edward 's allowance on the ground that he no longer requires his financial support.	his	0
ea44bffa-6412-4a38-b459-15d8ff771899	The mothers of Arthur and Celeste have come to the town to fetch them . They are very happy to have them back, but they scold them just the same because they ran away. them .	them	0
20fc54c5-a4e6-4cdf-abcd-f4bb6ff564dc	Bill passed the gameboy to John because his turn was over.	Bill	0
6ea0f930-fca4-4371-8115-6b3bd8601cee	Jim signaled the barman and gestured toward his empty glass	his	0
fb4ee893-bbe4-41ad-9073-0c91c3868e68	The foxes are getting in at night and attacking the chickens . They have gotten very bold.	The foxes	0
d4d2c92e-3d0a-46f6-bdb7-a97021a0e6c7	Emma's mother had died long ago, and her place had been taken by an excellent woman as governess.	Emma's mother	0
d1efa6c0-72b2-41d8-bd2f-b500ded6670f	Sir Clifford wants me to find him a new groom , about twenty or twenty-one, who knows his business. His old coachman is getting feeble, and he wants a man to work with him and get into his ways, who would be able, when the old man was pensioned off, to step into his place.	old coachman	0
8c4021a9-255a-4e39-bbe0-2b94885a84f8	The man lifted the boy onto his shoulders.	his	0
0df30246-15be-4455-af49-b4155dbb7f86	The trophy doesn't fit into the brown suitcase because it is too large.	the trophy	0
6e7b73e4-591b-42c9-bae8-e2bd6a078ddb	John promised Bill to leave, so an hour later he left.	he	0
f77101ea-aa04-4f0c-a743-11b778d5c13e	Sir Clifford wants me to find him a new groom , about twenty or twenty-one, who knows his business. His old coachman is getting feeble, and he wants a man to work with him and get into his ways, who would be able, when the old man was pensioned off, to step into his place.	Sir Clifford	0
c1f8494c-dbdd-4ae9-8ecf-2aef848b9d22	In the storm, the tree fell down and crashed through the roof of my house. Now, I have to get it removed.	The roof	0
7640afa6-7004-48e2-a7f9-f8e1a203a217	Fred covered his eyes with his hands , because the wind was blowing sand around. He lowered them when the wind stopped.	His hands	0
e7342364-7d72-404a-a3a6-39f02d59b791	Sir Clifford wants me to find him a new groom , about twenty or twenty-one, who knows his business. His old coachman is getting feeble, and he wants a man to work with him and get into his ways, who would be able, when the old man was pensioned off, to step into his place.	his	0
8c2893fb-6e67-4bf7-bb87-d5c7cafd1c0a	The path to the lake was blocked, so we couldn't reach it .	The lake	0
6ba21bbd-4a71-4336-a0d8-ca64cf14e84c	When Tommy dropped his ice cream, Timmy giggled, so father gave him a sympathetic look.	him	0
b55431b1-f7a3-4508-9a6f-29fcd4836a4e	Dr. Adams informed Kate that she had cancer and presented several options for future treatment.	she	0
734cb185-bb55-4190-98bf-8c1e62cc7134	Mama came over and sat down beside Alice . Gently she stroked her hair and let the child weep.	Alice	0
f7025b82-c723-41b9-849d-ba66b2f0b309	Sam and Amy are passionately in love, but Amy's parents are unhappy about it, because they are snobs.	Amy's parents	0
02b67a5c-f47f-47a4-ade5-aba77d6583f4	I poured water from the bottle into the cup until it was empty.	it	0
f048048d-d72d-49cd-9057-a49b449296f2	Fred watched TV while George went out to buy groceries. After an hour he got up.	Fred	0
63ea4507-eb38-4b45-84f9-ee8a46f18df3	Adam can't leave work here until Bob arrives to replace him. If Bob had left home for work on time, he would be here by this time.	he	0
f7212f5a-3906-4609-bbe5-039915f5d6e2	When Mr. Bond , the veterinarian, came to look at the black horse that lay groaning on the grass, he felt him all over, and shook his head; one of his legs was broken.	Mr. Bond	0
d661a7bc-fc5b-4fb6-b3ab-ead4dfecf0d1	When Mr. Bond , the veterinarian, came to look at the black horse that lay groaning on the grass, he felt him all over, and shook his head; one of his legs was broken.	the black horse	0
79dbfbb5-c1cf-4827-b526-26abc839187f	George got free tickets to the play, but he gave them to Eric , even though he was particularly eager to see it.	he	0
e3646861-1204-445c-8936-f32e52bad78d	Sam Goodman 's biography of the Spartan general Xenophanes conveys a vivid sense of the difficulties he faced in his childhood.	Goodman	0
774ab134-6caa-4a7c-8c37-90a136b1852f	The table was piled high with food , and on the floor beside it there were crocks, baskets, and a five-quart pail of milk.	floor	0
73958911-a9e0-4d2f-b45d-11f5b16dbebb	Sir Clifford wants me to find him a new groom , about twenty or twenty-one, who knows his business. His old coachman is getting feeble, and he wants a man to work with him and get into his ways, who would be able, when the old man was pensioned off, to step into his place.	Sir Clifford	0
ddd371c5-df6a-4a84-83af-5c94a1ea14bf	I put the butterfly wing on the table and it broke.	it	0
