id	text_a	text_b	label
25647c9b-ee8a-4674-a271-b8e4b2d28fb6	The woman held the girl against her chest	The woman	0
8cdb7441-fbce-43e0-8ec0-d745edb86a79	Papa looked down at the children 's faces , so puzzled and sad now. It was bad enough that they had to be denied so many things because he couldn't afford them .	things	0
9ad2fe16-80ae-43b0-8965-f67c51f8c5d4	Tom threw his schoolbag down to Ray after he reached the bottom of the stairs.	he	0
19229072-d230-424a-bfbd-27fd0adc66f1	Bernard , who had not told the government official that he was less than 21 when he filed for a homestead claim, did not consider that he had done anything dishonest. Still, anyone who knew that he was 19 years old could take his claim away from him .	him	0
6be424e4-7f1c-4b76-8ac0-a427953e827a	Sir Clifford wants me to find him a new groom , about twenty or twenty-one, who knows his business. His old coachman is getting feeble, and he wants a man to work with him and get into his ways, who would be able, when the old man was pensioned off, to step into his place	Sir Clifford	0
96b34ea5-e04d-455e-8d6e-ae082164b5ac	I tried to paint a picture of an orchard, with lemons in the lemon trees , but they came out looking more like light bulbs.	they	0
a865493e-c5a7-4db3-a463-e58e83247267	Fred covered his eyes with his hands , because the wind was blowing sand around. He lowered them when the wind stopped.	them	0
4b05aa4f-fa6d-4bf5-8204-c5f535d42739	Frank felt vindicated when his longtime rival Bill revealed that he was the winner of the competition.	Bill	0
c1379d15-e419-4e0d-95ff-1ef4b0eeca76	Steve follows Fred 's example in everything. He influences him hugely.	Fred	0
0895369e-78fc-4ec0-b687-5975fba637eb	Kirilov ceded the presidency to Shatov because he was more popular.	Shatov	0
7fe3a415-200d-4aea-b888-aa3077a74ea6	The delivery truck zoomed by the school bus because it was going so fast.	it	0
9f984196-7326-4767-84bb-59dd5128cd0b	The older students were bullying the younger ones, so we rescued them .	them	0
3c50ff3d-c27a-4e1a-b4eb-db19c33fe170	Bob collapsed on the sidewalk. Soon he saw Carl coming to help. He was very ill.	He	0
4a3de153-c8b0-4c80-ae70-25a69ae5869b	The trophy doesn't fit into the brown suitcase because it is too large.	it	0
10f61e74-6eb2-4147-804e-45e01c59900d	Our mistress hired a room for my crippled sister Nelly , and she gave her knitting and needlework when she was able to do it, and when she was ill she sent her dinners and many nice comfortable things and was like a mother to her.	mistress	0
7c774691-1bcf-4af8-9ed3-e0eb616c347b	John was doing research in the library when he heard a man humming and whistling. He was very annoyed.	John	0
853272fc-80e0-4af3-9993-7a79aca530b3	Pete envies Martin because he is very successful.	Martin	0
62070cf5-8870-457c-9fc6-d5e3aff5cc7e	Steve follows Fred 's example in everything. He admires him hugely.	Steve	0
b9ab8964-47a8-42b7-8891-b12b22ac87b8	The man lifted the boy onto his bunk bed.	The man	0
d95830b0-82dd-4b0b-9243-17c2c825de22	It is not easy to space buttonholes exactly the same distance apart, and it is very difficult to cut them precisely the right size . The tiniest slip of the scissors will make the hole too large, and even one thread uncut will leave it too small.	it	0
3d3cad21-64ef-4fed-807e-7388c7ca04ef	Then Dad figured out how much the man owed the store; to that he added the man 's board-bill at the cook-shanty. He subtracted that amount from the man 's wages, and made out his check	He	0
b2497759-8069-4d3a-b99a-4bfd252dc184	I stuck a pin through a carrot. When I pulled the pin out, it left a hole.	The pin	0
db7fe0e5-6d3f-4882-aa93-41e51d379b87	Carol believed that Rebecca regretted that she had stolen the watch.	she	0
547b7fcf-b339-4086-aa83-ece9c4d13632	This book introduced Shakespeare to Goethe ; it was a fine selection of his writing.	Shakespeare	0
0aed1da3-0208-4c4a-988a-72b8c8bc7334	Alice was dusting the living room and trying to find the button that Mama had hidden. No time today to look at old pictures in her favorite photo album . Today she had to hunt for a button , so she put the album on a chair without even opening it .	it	0
ee1235da-fa68-4642-a850-67f40a58d508	Babar wonders how he can get new clothing. Luckily, a very rich old man who has always been fond of little elephants understands right away that he is longing for a fine suit. As he likes to make people happy, he gives him his wallet.	he	0
59df0e56-f4cc-4733-944b-61f26e346045	Fred covered his eyes with his hands , because the wind was blowing sand around. He opened them when the wind stopped.	them	0
790b575d-2f7c-41af-a0b4-0c3f8362b651	Sara borrowed the book from the library because she needs it for an article she is working on. She reads it when she gets home from work.	it	0
b172a2e6-61b5-4b13-8218-c9d765f9a66d	Thomson visited Cooper 's grave in 1765. At that date he had been travelling for five years.	he	0
93072f1a-6b78-44c8-89b8-a5fd23f3c988	We had hoped to place copies of our newsletter on all the chairs in the auditorium, but there were simply too many of them .	them	0
379f0ca0-2a72-49b1-8627-6cc54cdbc8ce	Always before, Larry had helped Dad with his work. But he could not help him now, for Dad said that his boss at the railroad company would not want anyone but him to work in the office.	he	0
71f6fd4d-7afb-4c16-81cb-38b289491413	Carol believed that Rebecca suspected that she had stolen the watch.	Carol	0
c07325bb-3498-4fb6-9fa7-bda21f549d8b	Our mistress hired a room for my crippled sister Nelly , and she gave her knitting and needlework when she was able to do it, and when she was ill she sent her dinners and many nice comfortable things and was like a mother to her.	Nelly	0
efbc654c-ed18-4571-bc1c-98a17259ff80	Then he took a piece of iron the shape of the horse horse's foot , and clapped it on, and drove some nails through the shoe quite into its hoof, so that the shoe was firmly on	piece of iron	0
3090115d-790a-4c6e-b10d-c4dca4cf4462	Tom gave Ralph a lift to school so he wouldn't have to drive alone.	he	0
60785324-2988-4196-a522-e8a0047034ac	When they had eventually calmed down a bit , and had gotten home, Mr. Farley put the magic pebble in an iron safe . Some day they might want to use it , but really for now, what more could they wish for?	it	0
dd8a8c4d-b20d-4ccf-a8f3-515f6af0688e	Meanwhile, in the forest, the elephants are calling and hunting high and low for Arthur and Celeste , and their mothers are very worried. Fortunately, in flying over the town, an old marabou bird has seen them and come back quickly to tell the news.	their mothers	0
93c23cc1-92c4-420f-b04b-103c1dd72737	It was a summer afternoon, and the dog was sitting in the middle of the lawn. After a while, it got up and moved to a spot under the tree, because it was cooler.	it	0
7fa4fac3-a54f-4566-ade2-524c8d637904	Mark heard Steve 's feet going down the ladder. The door of the shop closed after him . He ran to look out the window.	Steve	0
05378b26-fdfd-457a-97a0-711fcb300e61	There is a pillar between me and the stage , and I can't see around it .	The stage	0
8e823452-fee4-4170-9ba9-478c1eaceecb	Sam's drawing was hung just above Tina's and it did look much better with another one above it.	Sam's drawing	0
30d62601-ed4d-441e-b3e7-fd35ce198590	Mark was close to Mr. Singer 's heels. He heard him calling for the captain, promising him, in the jargon everyone talked that night, that not one thing should be damaged on the ship except only the ammunition, but the captain and all his crew had best stay in the cabin until the work was over	Mark	0
4cbc42d1-3e53-4711-b072-5620360e008b	Bob paid for Charlie 's college education, but now Charlie acts as though it never happened. He is very hurt.	He	0
df3a0c8f-50a1-4b3f-abd7-7323c0727f46	Alice was dusting the living room and trying to find the button that Mama had hidden. No time today to look at old pictures in her favorite photo album. Today she had to hunt for a button, so she put the album on a chair without even opening it.	Mama	0
798854be-6fb4-469c-b715-c68213245b85	Carol believed that Rebecca suspected that she had stolen the watch.	she	0
da8baa28-8616-4d71-a4bf-d3f1a3105ca0	Although they ran at about the same speed, Sue beat Sally because she had such a good start.	she	0
109793b1-5aad-4e23-bff5-3adda61b8ae8	At the Loebner competition the judges couldn't figure out which respondents were the chatbots because they were so advanced.	they	0
461ae8b3-f788-4a75-b9e5-0d74fb5c7afb	Grant worked hard to harvest his beans so he and his family would have enough to eat that winter, His friend Henry let him stack them in his barn where they would dry. Later, he and Tatyana would shell them and cook them for their Sunday dinners.	beans	0
4f06ffc2-85e3-4e48-aeb9-f5a058726ae4	Fred is the only man still alive who remembers my great-grandfather . He was a remarkable man.	Fred	0
a23b907f-7d1b-4183-a096-ca5f66d26d12	Sam Goodman 's biography of the Spartan general Xenophanes conveys a vivid sense of the difficulties he faced in his research.	Xenophanes	0
21213f6a-82c9-4e69-916a-11d3fff1c89a	George got free tickets to the play, but he gave them to Eric , because he was not particularly eager to see it.	Eric	0
5428cb63-1a35-4d4d-a15e-6a350e9326fc	The mothers of Arthur and Celeste have come to the town to fetch them. They are very happy to have them back, but they scold them just the same because they ran away.	Arthur and Celeste	0
5c181764-e76e-4ea5-af4f-cc557efee9eb	Mark told Pete many lies about himself, which Pete included in his book. He should have been more truthful.	Pete	0
36054b98-7e9c-46a4-9969-4908db167f26	Bill passed the half-empty plate to John because he was full.	John	0
e15fa1f8-e568-403e-b299-60e8a1684894	All the buttons up the back of Dora 's plaid dress were buttoned outside-in. Maude should have thought to button her up; but no, she had left poor little Dora to do the best she could, alone.	she	0
636c95c6-51a4-4fba-9e0e-57afa34d45b8	Fred is the only man still alive who remembers my great-grandfather . He was a remarkable man.	My great-grandfather	0
12561200-5bb6-4ccb-9b96-23ad8a1fae83	There is a pillar between me and the stage , and I can't see around it .	it	0
0b8a3f5a-fc2c-403d-ac2b-60e25024fc91	Sergeant Holmes asked the girls to describe the intruder . Nancy not only provided the policeman with an excellent description of the heavyset thirty-year-old prowler, but drew a rough sketch of his face.	the intruder	0
25ed89f0-a53a-493c-b8ef-a32ba011eb8a	Kirilov ceded the presidency to Shatov because he was less popular.	he	0
8afe3a39-38fd-4d6f-a632-8e3452ac41c3	Susan knew that Ann 's son had been in a car accident, because she told her about it.	she	0
91dabf62-ef3f-4ad9-9f08-2e86112de324	The police arrested all of the gang members . They were trying to stop the drug trade in the neighborhood.	They	0
3b43da5f-7f87-49f2-b74c-be6e23cd6f7a	The woman held the girl against her will.	The woman	0
d3136389-cee7-40ac-b6e8-95822eac79b5	Bob collapsed on the sidewalk. Soon he saw Carl coming to help. He was very ill.	Carl	0
9ecb587f-8482-489b-900f-8bfaccdb836f	Sir Clifford wants me to find him a new groom , about twenty or twenty-one, who knows his business. His old coachman is getting feeble, and he wants a man to work with him and get into his ways, who would be able, when the old man was pensioned off, to step into his place	his	0
1f9500f9-9f7f-4b1c-9fd7-13075ddf25a7	The cat was lying by the mouse hole waiting for the mouse , but it was too impatient.	it	0
ad6b0ebf-1d0f-468b-b8ce-2e741af52043	Mr. Moncrieff visited Chester 's luxurious New York apartment, thinking that it belonged to his son Edward . The result was that Mr. Moncrieff has decided to cancel Edward 's allowance on the ground that he no longer requires his financial support.	Chester	0
8a60800a-0f7f-466f-a7cc-462542cc2810	The pony behaved well, sir, and showed no vice; but at last he just threw up his heels and tipped the young gentleman into the thorn hedge. He wanted me to help him out, but I hope you will excuse me, sir, I did not feel inclined to do so.	pony	0
a4c6a22c-f0de-475c-8c4c-05aabf56609f	The actress used to be named Terpsichore , but she changed it to Tina a few years ago, because she figured it was easier to pronounce.	Tina	0
a2bf9f04-c134-4113-97f9-0eede34d4657	The path to the lake was blocked, so we couldn't reach it .	it	0
21ac1f71-34c3-4766-b327-34c05221a772	Many people start to read Paul's books and can't put them down. They are popular because Paul writes so well.	People	0
ac5888de-1f67-4aa3-a645-33ca050041cc	Kirilov ceded the presidency to Shatov because he was more popular.	Kirilov	0
bb3773ca-9345-4ba0-ba1b-f8b614ca0bde	Ann asked Mary what time the library closes, but she had forgotten.	Ann	0
f80d9f94-4086-4999-a330-4bc14988d7af	Everyone really loved the oatmeal cookies ; only a few people liked the chocolate chip cookies . Next time, we should make more of them .	them	0
0d913778-3fcf-43c6-aed6-f242143c8d62	One day Dick was teasing the colts, and did not know that the master was in the next field; but he was there, watching what was going on; over the hedge he jumped in a snap, and catching Dick by the arm, he hit him so hard that he roared with the pain and surprise.	Dick	0
4655230c-948b-44c0-aa0a-5ab2cd844b48	At the Loebner competition the judges couldn't figure out which respondents were the chatbots because they were so advanced.	they	0
b6ff87fe-f6a9-4c3d-9006-9f961762acee	There is a pillar between me and the stage , and I can't see it .	The stage	0
53e64862-f71b-491f-9ad9-0900c435cd05	Lionel is holding captive a scientist, Dr. Vardi , who has invented a device that turns animals invisible; Lionel plans to use it on Geoffrey and send him to steal nuclear material from an army vault.	Geoffrey	0
15579e16-608c-4665-af70-c9a3b0df495a	I asked Dave to get me my sweater from the other side of the yacht . While he was gone, I rested my arm on the rail over there and suddenly it gave way.	it	0
1d254fbf-46ea-4cd6-978b-518a23634574	John hired Bill to take care of him .	Bill	0
7ae5581e-7f5a-4185-93d5-946e721ad8eb	I poured water from the bottle into the cup until it was empty.	it	0
527ddc2e-6c61-47f1-9b1d-b4c8a3223946	The sculpture rolled off the shelf because it wasn't anchored.	it	0
5daf819e-ac26-4e2c-9222-b8ef5a92e7cd	The storekeepers stayed in town to run their stores and lived in the rooms behind them .	them	0
23079aae-fc21-4d3e-9a81-27a5a3f7fb5d	Billy cried because Toby wouldn't accept his toy.	Toby	0
69226afc-db1c-4130-91bb-6ea519a1118e	Bob paid for Charlie 's college education. He is very generous.	He	0
a3d16f08-b987-4489-9db5-8460e38995ac	I tried to paint a picture of an orchard, with lemons in the lemon trees , but they came out looking more like light bulbs.	they	0
32a25cd5-db98-44d0-bf71-1acadeba559a	Mark was close to Mr. Singer 's heels. He heard him calling for the captain, promising him, in the jargon everyone talked that night, that not one thing should be damaged on the ship except only the ammunition, but the captain and all his crew had best stay in the cabin until the work was over	He	0
2af40c38-ce76-4055-8bb3-25bd54d7bfba	At the Loebner competition the judges couldn't figure out which respondents were the chatbots because they were so advanced.	the judges	0
901c6734-534d-405b-b18e-a71ce145c064	Alice tried frantically to stop her daughter from chatting at the party, leaving us to wonder why she was behaving so strangely.	she	0
3d98cd7a-cd16-4c54-bc0f-9d259abd712e	I poured water from the bottle into the cup until it was empty.	the bottle	0
61136716-3426-4582-8578-e6848d96a352	Mary tucked her daughter Anne into bed, so that she could sleep.	Mary	0
5f053dc1-f0e7-479e-b385-b263637a6adf	Our mistress hired a room for my crippled sister Nelly , and she gave her knitting and needlework when she was able to do it, and when she was ill she sent her dinners and many nice comfortable things and was like a mother to her.	Nelly	0
048c0a66-ccff-4923-8e41-a356bfa3976a	At the Loebner competition the judges couldn't figure out which respondents were the chatbots because they were so advanced.	the chatbots	0
cdac8d96-9c2a-49e3-8f07-764a52186671	In the middle of the outdoor concert, the rain started falling, but it continued until 10.	it	0
140c30fd-98ff-4a6d-b30f-5533f6d36f82	One day Dick was teasing the colts, and did not know that the master was in the next field; but he was there, watching what was going on; over the hedge he jumped in a snap, and catching Dick by the arm, he hit him so hard that he roared with the pain and surprise.	him	0
dcf6cde9-8402-4cf8-9bff-abef4f885d37	Mr. Moncrieff visited Chester 's luxurious New York apartment, thinking that it belonged to his son Edward . The result was that Mr. Moncrieff has decided to cancel Edward 's allowance on the ground that he no longer requires his financial support.	Edward	0
f97da52b-45d2-4931-8c2f-93a1ea5880aa	Bob paid for Charlie 's college education. He is very generous.	He	0
1fb05406-40a9-49b9-a609-1cd3555b3960	Joan made sure to thank Susan for all the help she had given.	Joan	0
803d7c65-fdf0-4030-bb62-2accaf8bf1f9	Madonna fired her trainer because she couldn't stand her boyfriend.	Madonna	0
0bbe5bda-b58e-4afb-b501-e0d35b5a605d	Fred is the only man alive who still remembers my father as an infant. When Fred first saw my father , he was twelve years old.	Fred	0
86053641-d63c-4ce8-8bc4-4b79fad17409	Joe Joe's uncle can still beat him at tennis, even though he is 30 years younger.	Joe's uncle	0
e3e5d0de-0734-4aba-96a5-5bec9594259d	Fred was supposed to run the dishwasher , but he put it off, because he wanted to watch TV. But the show turned out to be boring, so he changed his mind and turned it off.	The dishwasher	0
05a61a46-e455-4b28-b150-b48c9a669685	The pony behaved well, sir, and showed no vice; but at last he just threw up his heels and tipped the young gentleman into the thorn hedge. He wanted me to help him out, but I hope you will excuse me, sir, I did not feel inclined to do so.	young gentleman	0
5547ed15-6bef-42a1-bd2a-787fdf1bfe12	Lily spoke to Donna , breaking her concentration.	her	0
6c4a5c6a-dcad-4032-a978-3646e9785c1c	Bob paid for Charlie 's college education, but now Charlie acts as though it never happened. He is very ungrateful.	Bob	0
640100cd-2886-46bf-9708-eb131771592d	As Andrea in the crop duster passed over Susan , she could see the landing strip.	Andrea	0
021847e2-fa5c-410e-b044-30b3dc39e241	It was a summer afternoon, and the dog was sitting in the middle of the lawn. After a while, it got up and moved to a spot under the tree, because it was hot.	it	0
fe609d9d-fcfd-4c9d-a35f-19e694226335	The table was piled high with food , and on the floor beside it there were crocks, baskets, and a five-quart pail of milk.	it	0
6582f454-0d2f-4852-a202-9e4b4cefc0f4	"The boy continued to whip the pony , and eventually the pony threw him over. John laughed out quite loud. ""Good for him,"" he said. "	him	0
4fddbd20-991a-4bef-b87e-777d8a3aa544	Babar wonders how he can get new clothing. Luckily, a very rich old man who has always been fond of little elephants understands right away that he is longing for a fine suit. As he likes to make people happy, he gives him his wallet.	Babar	0
c71dc6af-f70c-4e39-8b3b-f5e324b4b772	Equally swoon-worthy is C.K. Dexter Haven , a pallid young dandy holding a jade-handled walking stick, with a poodle asleep at his feet	poodle	0
ca2c42a7-92c3-4997-87d3-9da800668be0	Bernard , who had not told the government official that he was less than 21 when he filed for a homestead claim, did not consider that he had done anything dishonest. Still, anyone who knew that he was 19 years old could take his claim away from him .	anyone	0
b34dadc7-9815-49d6-982c-913697527a38	I put the cake away in the refrigerator . It has a lot of leftovers in it.	The refrigerator	0
24948c40-6bee-4450-9b0a-f465ea3986c4	I sallied out for a bit of food , more to pass the time than because I wanted it .	time	0
b398b352-3b37-4c1b-a24c-360c4421aedd	Mr. Taylor was a man of uncertain temper and his general tendency was to think that David was a poor chump and that whatever step he took in any direction on his own account was just another proof of his innate idiocy,	his	0
5da0f3e9-ecd3-4909-a220-2b59b9c6e4b4	Sam pulled up a chair to the piano , but it was broken, so he had to sing instead.	The piano	0
40608ca2-5b2c-4ec9-9528-1347efaef3f8	While Nancy and Ellen counted the silverware, Mrs. Smith hastened upstairs. In a few minutes she returned and one look at her stricken face told the girls that the precious map was gone.	Nancy	0
c9befd2f-a0d6-4306-bce2-c7f5d9adcfa6	"Tatyana managed two guitars and a bag , and still could point out the Freemans : ""Isn't it nice that they have come, Mama!"""	they	0
8dba17d2-3c65-44a7-81b0-bf4b1feec84c	Fred was supposed to run the dishwasher , but he put it off, because he wanted to watch TV. But the show turned out to be boring, so he changed his mind and turned it on.	The dishwasher	0
65c43e7b-578d-44d6-bdd1-db9488069d56	"The boy continued to whip the pony , and eventually the pony threw him over. John laughed out quite loud. ""Served him right,"" he said."	him	0
e42fba59-b220-4f82-884d-72e2741c5176	The mothers of Arthur and Celeste have come to the town to fetch them. They are very happy to have them back, but they scold them just the same because they ran away.	Arthur and Celeste	0
575e233e-a263-4367-88b7-a49154296c19	While Nancy and Ellen counted the silverware, Mrs. Smith hastened upstairs. In a few minutes she returned and one look at her stricken face told the girls that the precious map was gone.	her	0
bf6f4426-365c-4c49-97e1-948f1fd9644f	The dog chased the cat , which ran up a tree. It waited at the bottom.	It	0
51e8bac2-7aec-4366-a340-95083e873636	The signs over the shops' doors had pictures that indicated what work was done inside. Although more and more people were learning how to read, each artisan still had signs, not wishing to lose a possible patron merely because he happened to be illiterate.	patron	0
95487089-dd44-4e96-a7d6-88b028343ea2	James asked Robert for a favor but he was refused.	Robert	0
952686d0-bf29-4ec9-8579-0994cc7a46a1	Pete envies Martin because he is very successful.	Pete	0
f9f5611a-ba7d-4cef-b16c-b0692ea4b06f	When the sponsors of the bill got to the town hall, they were surprised to find that the room was full of opponents. They were very much in the minority.	They	0
67d11732-4203-41d4-a447-0e5f431241f3	I asked Dave to get me my sweater from the other side of the yacht . While he was gone, I rested my arm on the rail over there and suddenly it gave way.	it	0
e61d01a7-901d-486c-a086-7c7b3be46adb	Fred and Alice had very warm down coats , but they were not prepared for the cold in Alaska.	they	0
e8c69551-44a7-47c4-a7fa-ab4cb1e2d9a5	Bob paid for Charlie 's college education, but now Charlie acts as though it never happened. He is very ungrateful.	He	0
8279414b-c50a-481a-b3c5-789bc986501d	Kirilov ceded the presidency to Shatov because he was more popular.	he	0
4e1f0dcc-98b1-4f83-ad7e-fa370a10b9c3	One day Dick was teasing the colts, and did not know that the master was in the next field; but he was there, watching what was going on; over the hedge he jumped in a snap, and catching Dick by the arm, he hit him so hard that he roared with the pain and surprise.	he	0
f394d35a-0f4d-4e54-bc04-4c6bd7f14966	The path to the lake was blocked, so we couldn't reach it .	it	0
bec4dff2-1623-4590-ad8d-c48c519f2c2a	If the con artist has succeeded in fooling Sam , he would have gotten a lot of money.	he	0
80e7ef87-a4fc-4253-8c10-b4018a562d81	I poured water from the bottle into the cup until it was full.	the cup	0
67117fc4-66c0-488f-9d90-d40f08c192e4	"Dan took the rear seat while Bill claimed the front because his ""Dibs!"" was quicker."	his	0
c380cad3-6087-4964-bd17-da8913d68814	Meanwhile, in the forest, the elephants are calling and hunting high and low for Arthur and Celeste , and their mothers are very worried. Fortunately, in flying over the town, an old marabou bird has seen them and come back quickly to tell the news.	Arthur and Celeste	0
12d12c3d-26a0-4816-8959-6e8ab488ec5a	Our mistress hired a room for my crippled sister Nelly , and she gave her knitting and needlework when she was able to do it, and when she was ill she sent her dinners and many nice comfortable things and was like a mother to her.	mistress	0
5ee2a08a-3f2f-4eba-b631-36d37a2f3260	Sam pulled up a chair to the piano , but it was broken, so he had to sing instead.	it	0
cea8ad39-51a6-4b3b-8fca-1371f1d9ff2a	After a somewhat lengthy conversation, Nancy convinced the housekeeper that there was no immediate cause for alarm. She did not mention the incident at the Hamilton bus station, knowing it would only add to Mrs. Gruen’s uneasiness.	the housekeeper	0
695288cf-fcd0-472b-bc00-d38292b162b5	The signs over the shops' doors had pictures that indicated what work was done inside. Although more and more people were learning how to read, each artisan still had signs, not wishing to lose a possible patron merely because he happened to be illiterate.	artisan	0
eae58154-aca1-4f10-9a79-b6bc9b9c881f	The Wainwrights treated Mr. Crowley like a prince until he made his will in their favor; then they treated him like dirt. Folks said he died just to be rid of their everlasting nagging.	Wainwrights	0
baf9ff64-29c3-41dd-8da1-ae7e08c07e3b	All the buttons up the back of Dora 's plaid dress were buttoned outside-in. Maude should have thought to button her up; but no, she had left poor little Dora to do the best she could, alone.	Dora	0
0bb2c076-e13f-44c4-b4ab-9da23ba821e8	Alice was dusting the living room and trying to find the button that Mama had hidden. No time today to look at old pictures in her favorite photo album. Today she had to hunt for a button, so she put the album on a chair without even opening it.	Mama	0
