id	text_a	text_b	label
eb3c8c5b-102b-4dee-9063-fcad1cc639c4	After I saw Bill catching flies and pulling off their wings, I boxed his ears. I showed the master the flies, some crushed and some crawling about helpless, and I showed him the wings on the window sill. I never saw him so angry before; but as Bill was still howling and whining, like the coward that he was, he did not give him any more punishment of that kind, but set him up on a stool for the rest of the afternoon, and said that he should not go out to play for that week.	he	0
c03f8a47-f189-49f2-b4df-ea7f090d8a07	I used an old rag to clean the knife , and then I put it in the trash.	it	0
1d456eca-e237-477d-9283-f339346dea29	The path to the lake was blocked, so we couldn't use it .	The path	0
34f3f92e-d68a-4ae4-9b20-af6d6dd0fa53	I tried to paint a picture of an orchard, with lemons in the lemon trees , but they came out looking more like light bulbs.	lemons	0
ce704200-1465-4dc5-889e-517eedeb64af	What about the time you cut up tulip bulbs in the hamburgers because you thought they were onions?	tulip bulbs	0
348d7009-d351-4f26-bba8-2e0461581b07	The mothers of Arthur and Celeste have come to the town to fetch them. They are very happy to have them back, but they scold them just the same because they ran away.	mothers	0
2f4c7a8d-a8d1-4477-8abc-37e669c3ba30	Our mistress hired a room for my crippled sister Nelly , and she gave her knitting and needlework when she was able to do it, and when she was ill she sent her dinners and many nice comfortable things and was like a mother to her.	her	0
bb1d048e-921e-4b36-8bbe-4abfd90b1064	When Tatyana reached the cabin, her mother was sleeping. She was careful not to disturb her, undressing and climbing back into her berth.	She	0
843e76ce-913a-41a7-8f4f-6016449dc396	We went to the lake , because a shark had been seen at the ocean beach , so it was a dangerous place to swim.	The ocean beach	0
8264e119-2e5b-43bd-b700-27d61a4a64f8	After I saw Bill catching flies and pulling off their wings, I boxed his ears. I showed the master the flies, some crushed and some crawling about helpless, and I showed him the wings on the window sill. I never saw him so angry before; but as Bill was still howling and whining, like the coward that he was, he did not give him any more punishment of that kind, but set him up on a stool for the rest of the afternoon, and said that he should not go out to play for that week.	the master	0
e77c98be-982d-4e50-b11a-9d684c7004b7	Jane knocked on Susan 's door but she did not get an answer.	Susan	0
3494d513-3b75-480f-b2c5-81c6b9b50fc4	The foxes are getting in at night and attacking the chickens . They have gotten very bold.	The chickens	0
103bf291-eff7-4532-b101-1f883c033289	Jane knocked on Susan 's door, but there was no answer. She was out.	She	0
dda564b1-354d-4a1f-bde7-70f71b6dbf13	When Tatyana reached the cabin, her mother was sleeping. She was careful not to disturb her , undressing and climbing back into her berth.	mother	0
d56b771a-c778-4dde-a303-e6bbc5992367	In the storm, the tree fell down and crashed through the roof of my house. Now, I have to get it removed.	it	0
d9c72924-53e0-4540-9cfd-c4d5b76eb635	The sculpture rolled off the shelf because it wasn't anchored.	The sculpture	0
ff71c237-40ad-4410-8393-f98db866347c	Bernard , who had not told the government official that he was less than 21 when he filed for a homestead claim, did not consider that he had done anything dishonest. Still, anyone who knew that he was 19 years old could take his claim away from him.	the government official	0
5f94a3c1-d4ee-4c4a-9e58-950e2ea2b842	Bernard , who had not told the government official that he was less than 21 when he filed for a homestead claim, did not consider that he had done anything dishonest. Still, anyone who knew that he was 19 years old could take his claim away from him .	him	0
cee2df48-d49a-471c-b6cf-ea11f330c02f	The woman held the girl against her chest	her	0
03f0eada-7f5f-46a3-be3f-9588b39dfe6a	Susan knew that Ann 's son had been in a car accident, because she told her about it.	Susan	0
f92c12f2-cf2f-48ff-a03e-921be7e072b9	Always before, Larry had helped Dad with his work. But he could not help him now, for Dad said that his boss at the railroad company would not want anyone but him to work in the office.	he	0
7382313e-e88f-4808-9fc4-771df8a38e11	"The user changed his password from "" GrWQWu8JyC "" to "" willow-towered Canopy Huntertropic wrestles "" as it was easy to remember."	it	0
b3cd6b29-5102-45be-ad30-3bb070015b41	Sam pulled up a chair to the piano , but it was broken, so he had to stand instead.	The piano	0
fad1c396-c576-4e05-8180-d50089772e9c	Sir Clifford wants me to find him a new groom , about twenty or twenty-one, who knows his business. His old coachman is getting feeble, and he wants a man to work with him and get into his ways, who would be able, when the old man was pensioned off, to step into his place.	His	0
cf31c632-bb11-47b4-8577-1349318cf40d	Madonna fired her trainer because she slept with her boyfriend.	Madonna	0
12bf2ef5-c1e0-418c-a3fd-e0d782e0997f	John was doing research in the library when he heard a man humming and whistling. He was very annoyed.	He	0
86a096f7-2484-487f-845a-15c2a815901a	Bill passed the gameboy to John because his turn was over.	his	0
c4ae83c2-8c5f-4673-a39f-38e731984cf5	Larry , a timid teen-ager, lives with his widowed mother in a Brooklyn housing project. Larry Larry's father , a gang leader, was shot to death; his father's disciple, Antonio , takes Larry under his wing, and quickly molds him into a drug runner.	Larry	0
a8fa2cd3-404e-4fc1-bd5e-690a04a8d590	In the storm, the tree fell down and crashed through the roof of my house. Now, I have to get it repaired.	it	0
09e3ad11-2a90-491e-bdf2-041c7d863610	Beth didn't get angry with Sally , who had cut her off, because she stopped and counted to ten.	Sally	0
45c3d0c1-372d-430d-a17f-39ffc53d28e5	The journalists interviewed the stars of the new movie. They were very persistent, so the interview lasted for a long time.	They	0
97a6dc63-d600-492f-8f56-e02b6187bf3b	"During a game of tag, Ethan ran from Luke because he was ""it""."	he	0
70233a80-3848-4a30-af1d-57950ee075be	The father carried the sleeping boy in his arms	his	0
e63d171a-e46b-45a6-8d9a-af7bc455f6fe	The cat was lying by the mouse hole waiting for the mouse , but it was too cautious.	it	0
110a5cc0-423b-4988-b599-e9ee6d91a276	John was jogging through the park when he saw a man juggling watermelons. He was very impressed.	He	0
b631279b-cf61-452e-9e68-65c1024b198c	The journalists interviewed the stars of the new movie. They were very persistent, so the interview lasted for a long time.	They	0
0631c28f-9036-4bad-b775-30e55a6a32e9	Jane knocked on Susan 's door, but there was no answer. She was out.	She	0
2171337c-9a8e-497a-a972-d73f6b2cc0c7	Madonna fired her trainer because she couldn't stand her boyfriend.	her	0
2a6276ae-4fb6-4ca7-998b-222ff8906bce	Do you suppose that Peter is responsible for the captain ’s illness? Maybe he bribed the cook to put something in his food.	Peter	0
4786d371-cc13-46a9-94ca-19dff7b5bdb3	Patting her back, the woman smiled at the girl .	her	0
be67594f-9e97-4f59-abc9-f17d984d3f11	Steve follows Fred 's example in everything. He admires him hugely.	He	0
00944a9e-f0ab-4264-bcb5-3b6dc9b12b57	Sam Goodman 's biography of the Spartan general Xenophanes conveys a vivid sense of the difficulties he faced in his research.	Goodman	0
e97bb71b-5000-42aa-8ca9-4b79a758a0cb	Mama came over and sat down beside Alice . Gently she stroked her hair and let the child weep.	her	0
0c4e84b9-7462-4e6b-a023-6d9288cf7e73	The scientists are studying three species of fish that have recently been found living in the Indian Ocean. They appeared two years ago.	The scientists	0
d04bde7a-5ae9-42d8-88ac-b4a92eed1f0d	Fred and Alice had very warm down coats , but they were not prepared for the cold in Alaska.	Fred and Alice	0
88408d43-8a0f-48ce-acb0-1451b8d3bcd6	Jim comforted Kevin because he was so upset.	Jim	0
a142a948-b462-4bf6-a68f-f371f5182b4a	Jane gave Joan candy because she was hungry.	she	0
01ed73bc-0380-43c9-a9b4-f857918c51a6	Every day after dinner Mr. Schmidt took a long nap. Mark would let him sleep for an hour, then wake him up, scold him, and get him to work. He needed to get him to finish his work, because his work was beautiful	Mr. Schmidt	0
d5fb27f7-06cf-4adf-b28d-bb97664b8788	The foxes are getting in at night and attacking the chickens . They have gotten very nervous.	The chickens	0
19b4c44f-8038-412a-881b-97d380dbd086	Babar wonders how he can get new clothing. Luckily, a very rich old man who has always been fond of little elephants understands right away that he is longing for a fine suit. As he likes to make people happy, he gives him his wallet.	old man	0
13bbde5d-3dfa-47e8-a822-a1d4b2e3ccc4	Tom gave Ralph a lift to school so he wouldn't have to walk.	Tom	0
67e21a0a-f86b-490a-9f0f-c3e54cfc6dc7	Sam took French classes from Adam , because he was known to speak it fluently.	he	0
9da6fe90-0c57-4dfa-810f-726c6896150c	The stable was very roomy, with four good stalls; a large swinging window opened into the yard , which made it pleasant and airy.	it	0
d4768f5f-b333-46fb-a049-a9907f5245da	Of one thing Mark was sure. Harry knew much less than he did.	he	0
9c87bf8c-9d84-48e5-9f49-4b42797288a4	Dr. Adams informed Kate that she had cancer and presented several options for future treatment.	Kate	0
48f6ef3b-7cd9-4f12-8b29-62b12ec58e63	Susan knows all about Ann 's personal problems because she is indiscreet.	she	0
8ba8158a-63f3-4307-9cec-d600af342421	Fred and Alice had very warm down coats , but they were not enough for the cold in Alaska.	Fred and Alice	0
ba78f72d-7106-482f-bc96-fdf0b22039c0	Sir Clifford wants me to find him a new groom , about twenty or twenty-one, who knows his business. His old coachman is getting feeble, and he wants a man to work with him and get into his ways, who would be able, when the old man was pensioned off, to step into his place	new groom	0
554130ec-9c26-43b7-b425-55cab444655e	We went to the lake , because a shark had been seen at the ocean beach , so it was a dangerous place to swim.	The lake	0
6ebc86ce-48bf-4eda-87b3-1449e7862bcb	I tried to paint a picture of an orchard, with lemons in the lemon trees , but they came out looking more like light bulbs.	lemon trees	0
bc5a825b-b86f-43ac-ad65-969fdc77c279	Thomson visited Cooper 's grave in 1765. At that date he had been dead for five years.	Cooper	0
5468fc63-8200-4e24-973e-ca80215ade90	The fish ate the worm . It was tasty.	It	0
16da5f22-eb45-4274-a7d3-a1d6558fa880	I put the heavy book on the table and it broke.	The heavy book	0
2d84e1d6-b510-43db-8158-feb56aa90e46	Anna did a lot worse than her good friend Lucy on the test because she had studied so hard.	Anna	0
adf77a31-c640-4ef8-8653-adf821dffa20	Sam Goodman 's biography of the Spartan general Xenophanes conveys a vivid sense of the difficulties he faced in his childhood.	he	0
4cb52fad-ceab-4920-9aaa-dff3047f775a	Jane knocked on the door, and Susan answered it. She invited her to come out.	She	0
a82c14fd-35af-4533-a768-3cdf7400b605	Larry , a timid teen-ager, lives with his widowed mother in a Brooklyn housing project. Larry Larry's father , a gang leader, was shot to death; his father's disciple, Antonio , takes Larry under his wing, and quickly molds him into a drug runner.	Larry's father	0
94464d93-476a-4065-9f3a-08ec167a9c3d	Bob paid for Charlie 's college education. He is very grateful.	Bob	0
2fe2b2a9-d200-4472-a3b4-13a9b0792d89	Lily spoke to Donna , breaking her silence.	Lily	0
1dec242d-cf8f-422f-bb93-b0156addf7eb	Mark was close to Mr. Singer 's heels. He heard him calling for the captain, promising him, in the jargon everyone talked that night, that not one thing should be damaged on the ship except only the ammunition, but the captain and all his crew had best stay in the cabin until the work was over	He	0
1a98ecfb-f461-4742-9a05-97d1f8b1ee7f	The mothers of Arthur and Celeste have come to the town to fetch them. They are very happy to have them back, but they scold them just the same because they ran away.	they	0
d9d4da10-2ad1-4051-9b03-2a3379137e95	Our mistress hired a room for my crippled sister Nelly , and she gave her knitting and needlework when she was able to do it, and when she was ill she sent her dinners and many nice comfortable things and was like a mother to her.	she	0
711c637c-79d2-470b-a9f0-84cdea98dfd9	Lily spoke to Donna , breaking her silence.	her	0
02bdfe23-dc10-442b-98cd-1d19dfc92944	Alice looked for her friend Jade in the crowd. Since she always has good luck, Alice spotted her quickly.	Alice	0
adf3afe0-3757-40d2-bc02-e83fdf6eb14a	Alice looked for her friend Jade in the crowd. Since she always has good luck, Alice spotted her quickly.	she	0
1e08a05b-2897-4aa4-80d7-8fef137c9f4b	I tried to paint a picture of an orchard, with lemons in the lemon trees , but they came out looking more like light bulbs.	they	0
99608872-6fb5-4b85-8fde-2ab858bdbc91	One day Dick was teasing the colts, and did not know that the master was in the next field; but he was there, watching what was going on; over the hedge he jumped in a snap, and catching Dick by the arm, he hit him so hard that he roared with the pain and surprise.	Dick	0
c8573851-ab2d-478d-b7a5-e116fa075e15	After I saw Bill catching flies and pulling off their wings, I boxed his ears. I showed the master the flies, some crushed and some crawling about helpless, and I showed him the wings on the window sill. I never saw him so angry before; but as Bill was still howling and whining, like the coward that he was, he did not give him any more punishment of that kind, but set him up on a stool for the rest of the afternoon, and said that he should not go out to play for that week.	him	0
9b216973-241d-491e-ab53-11b6fb8d58a1	Alice was dusting the living room and trying to find the button that Mama had hidden. No time today to look at old pictures in her favorite photo album . Today she had to hunt for a button , so she put the album on a chair without even opening it .	it	0
31443b69-9f2c-43fa-b240-455c0c8bed76	Sam and Amy are passionately in love, but Amy's parents are unhappy about it, because they are snobs.	Sam and Amy	0
c2fe6f0f-3d20-456a-926f-9d336ad805fb	Bob collapsed on the sidewalk. Soon he saw Carl coming to help. He was very concerned.	He	0
1567423b-448e-407c-815b-f9a17b3cecc8	When Mr. Bond , the veterinarian, came to look at the black horse that lay groaning on the grass, he felt him all over, and shook his head; one of his legs was broken.	his	0
2bce4bf4-51e7-450c-9fde-7ce54afb9576	Joe Joe's uncle can still beat him at tennis, even though he is 30 years older.	he	0
cfe4df39-4b32-4ed5-b1ce-ec9be304f3ea	The mothers of Arthur and Celeste have come to the town to fetch them . They are very happy to have them back, but they scold them just the same because they ran away. them .	Arthur and Celeste	0
1dd9933e-f0db-4727-9f4f-a9ca16dc636f	The path to the lake was blocked, so we couldn't use it .	it	0
5953a59d-53c9-4ce8-a429-2ad024fd449f	When my parents died, I was not earning enough to keep myself or my crippled sister Nelly , and without our kind mistress , we would have gone to the poorhouse. Nelly calls her her angel and she has good right to do so. her	her	0
ab0f400d-45f9-4c50-903b-98807738e777	John promised Bill to leave, so an hour later he left.	he	0
50bfb57a-ba6a-4352-a326-f3efc30ef8dd	The city councilmen refused the demonstrators a permit because they feared violence.	they	0
7b6e3a16-85eb-4649-9e42-18ae317725a5	Archaeologists have concluded that humans lived in Laputa 20,000 years ago. They hunted for deer on the river banks.	They	0
140be012-f5d8-493e-aa5e-4ade1afe06a8	After I saw Bill catching flies and pulling off their wings, I boxed his ears. I showed the master the flies, some crushed and some crawling about helpless, and I showed him the wings on the window sill. I never saw him so angry before; but as Bill was still howling and whining, like the coward that he was, he did not give him any more punishment of that kind, but set him up on a stool for the rest of the afternoon, and said that he should not go out to play for that week.	he	0
c974e678-4104-436c-b94f-408d903a3e9e	Jim yelled at Kevin because he was so upset.	Kevin	0
beb57db8-b87b-4b80-ac87-f8df7a6bcf87	I saw Jim yelling at some guy in a military uniform with a huge red beard. I don't know who he was, but he looked very unhappy.	Jim	0
ca4e73eb-dfaa-4529-b6c0-d5cd8abe532b	Jackson was greatly influenced by Arnold , though he lived two centuries later.	he	0
f717a707-dda3-4cf9-b10e-0bf80d64852b	The delivery truck zoomed by the school bus because it was going so slow.	the school bus	0
51a4dc99-b37d-4fbf-9ffb-4d4562c91c19	We went to the lake , because a shark had been seen at the ocean beach , so it was a safer place to swim.	The lake	0
cf1fbcbf-ac11-4607-9ad4-70f6253d190a	George got free tickets to the play, but he gave them to Eric , because he was not particularly eager to see it.	he	0
58236b1f-71a8-4439-9996-787bd3579051	Then he took a piece of iron the shape of the horse horse's foot , and clapped it on, and drove some nails through the shoe quite into its hoof, so that the shoe was firmly on	horse's foot	0
8de95911-c3cd-4cf6-904d-c61d92bb1edf	One day Dick was teasing the colts, and did not know that the master was in the next field; but he was there, watching what was going on; over the hedge he jumped in a snap, and catching Dick by the arm, he hit him so hard that he roared with the pain and surprise.	he	0
28c7922f-38e5-4187-a507-5e50d6900eb2	What about the time you cut up tulip bulbs in the hamburgers because you thought they were onions?	they	0
407ff14c-7675-48f6-8e1f-b3d54350568b	The city councilmen refused the demonstrators a permit because they advocated violence.	The demonstrators	0
adc7a7db-34e9-4b39-a7c1-d8f26167390e	The path to the lake was blocked, so we couldn't use it .	The lake	0
3706350b-dfff-4d2b-b246-23bb2bfaa54e	Mr. Moncrieff visited Chester 's luxurious New York apartment, thinking that it belonged to his son Edward . The result was that Mr. Moncrieff has decided to cancel Edward 's allowance on the ground that he no longer requires his financial support.	he	0
1866876e-16b0-4593-b44c-b7a2025a2376	Bernard , who had not told the government official that he was less than 21 when he filed for a homestead claim, did not consider that he had done anything dishonest. Still, anyone who knew that he was 19 years old could take his claim away from him.	the government official	0
599e9497-9c9f-4499-ad66-3b8cd70c1f03	Anna did a lot better than her good friend Lucy on the test because she had studied so hard.	Anna	0
1ad71356-eb38-40ac-b249-bf26c6f7d93b	After I saw Bill catching flies and pulling off their wings, I boxed his ears. I showed the master the flies, some crushed and some crawling about helpless, and I showed him the wings on the window sill. I never saw him so angry before; but as Bill was still howling and whining, like the coward that he was, he did not give him any more punishment of that kind, but set him up on a stool for the rest of the afternoon, and said that he should not go out to play for that week.	the master	0
affe1c49-465b-4b14-9e95-71953b7a4127	"Tatyana knew that Grandma always enjoyed serving an abundance of food to her guests. Now Tatyana watched as Grandma gathered Tatyana 's small mother into a wide, scrawny embrace and then propelled her to the table, lifting her shawl from her shoulders, seating her in the place of honor, and saying simply: ""There's plenty."""	Grandma	0
05353f5b-b30b-4a56-984c-77da1ac00c3e	The politicians far away in Washington could not know the settlers so they must make rules to regulate them.	settlers	0
a0d46d02-c166-410d-8a28-811c4529db9c	Do you suppose that Peter is responsible for the captain ’s illness? Maybe he bribed the cook to put something in his food.	the captain	0
8c2cb3ef-7773-4aeb-ba9e-fda6a5a47ef2	After I saw Bill catching flies and pulling off their wings, I boxed his ears. I showed the master the flies, some crushed and some crawling about helpless, and I showed him the wings on the window sill. I never saw him so angry before; but as Bill was still howling and whining, like the coward that he was, he did not give him any more punishment of that kind, but set him up on a stool for the rest of the afternoon, and said that he should not go out to play for that week.	him	0
9c9290f1-6abd-432e-a829-c7bc871ac596	Susan knows all about Ann 's personal problems because she is indiscreet.	Susan	0
86d24267-1bcf-4868-a4e5-19177a842a99	Paul tried to call George on the phone, but he wasn't successful.	he	0
7d7c5e7f-3abf-4da4-b9eb-62ce1b192e36	Joe Joe's uncle can still beat him at tennis, even though he is 30 years older.	he	0
3d0e898e-aad3-4547-940f-efbf7919c793	Jane knocked on Susan 's door, but there was no answer. She was disappointed.	Jane	0
ddaa49ea-515d-4de8-ab1c-f7a6a758c8b8	Emma Emma's mother had died long ago, and her education had been managed by an excellent woman as governess.	Emma's mother	0
f7a55190-eb85-48d3-9ad3-2d38a09f3c49	We saw a boy trying to leap a pony over a gate; the pony would not take the leap, and the boy cut him with the whip, but he only turned to one side.	pony	0
5361a22a-99a1-49f4-8bd3-99759dcb7b3d	Mark heard Steve 's feet going down the ladder. The door of the shop closed after him. He ran to look out the window.	Mark	0
3909abc5-bd40-4568-93b4-89736b1800bd	Do you suppose that Peter is responsible for the captain ’s illness? Maybe he bribed the cook to put something in his food.	his	0
3dffe284-b514-46ff-ad8b-08c71827eeda	The customer walked into the bank and stabbed one of the tellers. He was immediately taken to the hospital.	He	0
ecfacd1b-7dfe-4b5d-8678-a3547b79ab24	Fred is the only man still alive who remembers my great-grandfather . He was a remarkable man.	He	0
a86f53a7-a414-409c-8850-a14586f348e1	"The boy continued to whip the pony , and eventually the pony threw him over. John laughed out quite loud. ""Served him right,"" he said."	him	0
54854270-9ee2-4a90-b61f-95b7e0886c26	Joe paid the detective after he delivered the final report on the case.	he	0
2b601f9a-8302-4605-b5ce-76617d783f21	The sun was covered by a thick cloud all morning, but luckily, by the time the picnic started, it was gone.	The sun	0
dbfb942a-0c4a-4509-99fe-8c08c1144fb6	The firemen arrived before the police because they were coming from so far away.	The police	0
d490331c-4ddb-4b2f-b358-13a471561ceb	George got free tickets to the play, but he gave them to Eric , even though he was particularly eager to see it.	he	0
3f72a82e-d295-4a66-ab72-0b6d299af6e3	I took the water bottle out of the backpack so that it would be handy.	The water bottle	0
04423049-2135-4a0c-95c0-0a876879c902	John hired Bill to take care of him .	him	0
9ed46207-c58b-4b9d-9dda-089747be628e	Meanwhile, in the forest, the elephants are calling and hunting high and low for Arthur and Celeste , and their mothers are very worried. Fortunately, in flying over the town, an old marabou bird has seen them and come back quickly to tell the news.	them	0
52bb5814-fd4b-4b22-bd4e-f0830e2c014c	One day Dick was teasing the colts, and did not know that the master was in the next field; but he was there, watching what was going on; over the hedge he jumped in a snap, and catching Dick by the arm, he hit him so hard that he roared with the pain and surprise.	he	0
c35e7fb0-e73d-4ba3-94f4-9fd4f4f564fd	Bob collapsed on the sidewalk. Soon he saw Carl coming to help. He was very concerned.	Carl	0
d78a350f-cf5d-4ebc-be7b-736388f49129	"Tatyana knew that Grandma always enjoyed serving an abundance of food to her guests. Now Tatyana watched as Grandma gathered Tatyana 's small mother into a wide, scrawny embrace and then propelled her to the table, lifting her shawl from her shoulders, seating her in the place of honor, and saying simply: ""There's plenty."""	Tatyana	0
8a29f281-d97c-45d8-be57-2f7b27e99466	Jane knocked on Susan 's door but she did not answer.	she	0
d0229513-6615-4748-b312-b52dec81e0d0	Fred watched TV while George went out to buy groceries. After an hour he got up.	George	0
6fd0391f-aba5-42e7-a107-37b87e4d51cd	Billy cried because Toby wouldn't accept his toy.	Billy	0
a7c253fc-e069-412b-bb7a-11d0ca06a0b4	The fish ate the worm . It was tasty.	The fish	0
f61fe0ff-4bdb-41a4-a644-2abd292b3f7b	This book introduced Shakespeare to Goethe ; it was a major influence on his writing.	Goethe	0
a22839aa-9ed2-46d8-9eac-18468f8573a0	Joe Joe's uncle can still beat him at tennis, even though he is 30 years younger.	he	0
84204b94-fbd3-4a21-9b48-b531795647dd	Bill passed the gameboy to John because his turn was next.	John	0
a07bd034-1e6d-42c1-b658-518bc80d9a09	When Tommy dropped his ice cream, Timmy giggled, so father gave him a stern look.	Timmy	0
febde4e1-253a-49e8-937f-a50bfab767b8	The sack of potatoes had been placed below the bag of flour , so it had to be moved first.	it	0
bd839f14-22e3-48ae-8adb-ec47d2cb72a4	The first place that I can well remember was a large pleasant meadow with a pond of clear water in it . Some shady trees leaned over	it	0
fcde7804-8356-4cd4-8b0e-0a1b734626fa	Sam Goodman 's biography of the Spartan general Xenophanes conveys a vivid sense of the difficulties he faced in his research.	he	0
e9562128-c466-4c4b-b623-051114835f5d	Sid explained his theory to Mark but he couldn't convince him.	he	0
fe93bd54-5eb2-454f-add5-9a72d4cb461b	Grant worked hard to harvest his beans so he and his family would have enough to eat that winter, His friend Henry let him stack them in his barn where they would dry. Later, he and Tatyana would shell them and cook them for their Sunday dinners.	their	0
5b7dbb89-0119-4271-afb7-aa4aba2a0422	Anne gave birth to a daughter last month. She is a very charming baby.	Anne	0
